task,graph,graph_adj,graph_nl,nodes,num_nodes,num_edges,directed,question,answer,steps,choices,label,id
neighbor,"[(ZTT, QFK), (ZTT, CNA), (CNA, PMR), (CNA, FBU), (PMR, UOJ), (PMR, DQP), (DQP, COH), (DQP, TTW), (DQP, RLA), (DQP, QFC), (DQP, BQV), (COH, YXW), (COH, EHR), (COH, MGZ)]","{ZTT: [QFK, CNA],
QFK: [ZTT],
CNA: [ZTT, PMR, FBU],
PMR: [UOJ, DQP, CNA],
UOJ: [PMR],
DQP: [PMR, COH, TTW, RLA, QFC, BQV],
COH: [YXW, EHR, DQP, MGZ],
YXW: [COH],
EHR: [COH],
MGZ: [COH],
TTW: [DQP],
RLA: [DQP],
QFC: [DQP],
BQV: [DQP],
FBU: [CNA]}","Node ZTT is connected to nodes QFK, CNA.
Node QFK is connected to node ZTT.
Node CNA is connected to nodes ZTT, PMR, FBU.
Node PMR is connected to nodes UOJ, DQP, CNA.
Node UOJ is connected to node PMR.
Node DQP is connected to nodes PMR, COH, TTW, RLA, QFC, BQV.
Node COH is connected to nodes YXW, EHR, DQP, MGZ.
Node YXW is connected to node COH.
Node EHR is connected to node COH.
Node MGZ is connected to node COH.
Node TTW is connected to node DQP.
Node RLA is connected to node DQP.
Node QFC is connected to node DQP.
Node BQV is connected to node DQP.
Node FBU is connected to node CNA.","[BQV, PMR, RLA, FBU, TTW, CNA, EHR, YXW, DQP, UOJ, ZTT, QFC, QFK, MGZ, COH]",15,14,False,Which are the neighbor nodes of node UOJ? ,[PMR],"Let's solve it step by step.
Node UOJ connects to nodes [PMR], so the neighbors of node UOJ are ","('[[EHR, PMR, YXW, QFC, BQV, COH, QFK, RLA, MGZ, CNA, DQP, ZTT, UOJ], [DQP, QFC, BQV, TTW, CNA, ZTT, EHR, UOJ, RLA, COH, YXW, PMR, FBU, MGZ], [PMR], [YXW, FBU, QFK, RLA, EHR, MGZ, PMR, UOJ]]',)",2,226
neighbor,"[(ODJ, PHI), (ODJ, YTC), (PHI, DSD), (YTC, MNX), (YTC, RAJ), (EOY, DSD), (DSD, PHI), (DSD, MML), (QGM, EOY), (FLK, PHI), (FLK, ISL), (FLK, YTC), (ISL, FLK), (MNX, MML), (YGX, RAJ), (YGX, YTC), (YGX, MML), (YGX, ODJ), (YGX, FLK), (RAJ, QGM), (SJK, EOY), (SJK, MNX), (SJK, YTC)]","{ODJ: [PHI, YTC],
PHI: [DSD],
YTC: [MNX, RAJ],
EOY: [DSD],
DSD: [PHI, MML],
MML: [],
QGM: [EOY],
FLK: [PHI, ISL, YTC],
ISL: [FLK],
MNX: [MML],
YGX: [RAJ, YTC, MML, ODJ, FLK],
RAJ: [QGM],
SJK: [EOY, MNX, YTC]}","Node ODJ is connected to nodes PHI, YTC.
Node PHI is connected to node DSD.
Node YTC is connected to nodes MNX, RAJ.
Node EOY is connected to node DSD.
Node DSD is connected to nodes PHI, MML.
Node QGM is connected to node EOY.
Node FLK is connected to nodes PHI, ISL, YTC.
Node ISL is connected to node FLK.
Node MNX is connected to node MML.
Node YGX is connected to nodes RAJ, YTC, MML, ODJ, FLK.
Node RAJ is connected to node QGM.
Node SJK is connected to nodes EOY, MNX, YTC.","[YGX, ISL, RAJ, MNX, EOY, PHI, QGM, ODJ, YTC, DSD, SJK, MML, FLK]",13,23,True,"Which are the neighbor nodes of node YTC? In the context of a directed graph, we consider a node's successors as its neighbors. ","[MNX, RAJ]","Let's solve it step by step.
Node YTC connects to nodes [MNX, RAJ], so the neighbors of node YTC are ","('[[MML, SJK, DSD, EOY, ODJ, PHI], [ODJ, MNX, QGM, SJK, YTC, MML], [MNX, RAJ], [QGM, FLK]]',)",2,227
neighbor,"[(QAX, YIR), (QAX, RQB), (YIR, YCR), (YIR, XFR), (RQB, LIW), (RQB, FJY), (RQB, CGA), (RQB, PNY), (RQB, CPH), (RQB, KAO), (LIW, NNR), (NNR, MWC), (CPH, PHH)]","{QAX: [YIR, RQB],
YIR: [QAX, YCR, XFR],
RQB: [QAX, LIW, FJY, CGA, PNY, CPH, KAO],
YCR: [YIR],
XFR: [YIR],
LIW: [NNR, RQB],
NNR: [LIW, MWC],
MWC: [NNR],
FJY: [RQB],
CGA: [RQB],
PNY: [RQB],
CPH: [RQB, PHH],
KAO: [RQB],
PHH: [CPH]}","Node QAX is connected to nodes YIR, RQB.
Node YIR is connected to nodes QAX, YCR, XFR.
Node RQB is connected to nodes QAX, LIW, FJY, CGA, PNY, CPH, KAO.
Node YCR is connected to node YIR.
Node XFR is connected to node YIR.
Node LIW is connected to nodes NNR, RQB.
Node NNR is connected to nodes LIW, MWC.
Node MWC is connected to node NNR.
Node FJY is connected to node RQB.
Node CGA is connected to node RQB.
Node PNY is connected to node RQB.
Node CPH is connected to nodes RQB, PHH.
Node KAO is connected to node RQB.
Node PHH is connected to node CPH.","[CPH, FJY, PHH, MWC, QAX, YIR, KAO, CGA, RQB, XFR, YCR, LIW, PNY, NNR]",14,13,False,Which are the neighbor nodes of node CGA? ,[RQB],"Let's solve it step by step.
Node CGA connects to nodes [RQB], so the neighbors of node CGA are ","('[[KAO], [RQB], [QAX, FJY, MWC], [PNY, FJY, CGA, YIR]]',)",1,228
neighbor,"[(ZTU, VBO), (ZTU, DXG), (ZTU, ROD), (ZTU, DIC), (ZTU, CYY), (ZTU, RJC), (ZTU, UAI), (ZTU, DWS), (VBO, DXG), (VBO, ROD), (VBO, DIC), (VBO, UIY), (VBO, CYY), (VBO, OOM), (VBO, HXS), (VBO, DWS), (DXG, ROD), (DXG, CYY), (DXG, OOM), (DXG, RJC), (DXG, UAI), (DXG, HXS), (DXG, DWS), (ROD, DIC), (ROD, UIY), (ROD, RJC), (ROD, DWS), (DIC, CYY), (DIC, RJC), (DIC, UAI), (CYY, UIY), (CYY, RJC), (CYY, UAI), (CYY, HXS), (CYY, DWS), (RJC, UIY), (RJC, OOM), (RJC, UAI), (RJC, HXS), (RJC, DWS), (UAI, OOM), (UAI, HXS), (DWS, UIY), (DWS, OOM), (DWS, HXS), (UIY, HXS), (OOM, HXS)]","{ZTU: [VBO, DXG, ROD, DIC, CYY, RJC, UAI, DWS],
VBO: [ZTU, DXG, ROD, DIC, UIY, CYY, OOM, HXS, DWS],
DXG: [ZTU, VBO, ROD, CYY, OOM, RJC, UAI, HXS, DWS],
ROD: [ZTU, VBO, DXG, DIC, UIY, RJC, DWS],
DIC: [ZTU, VBO, ROD, CYY, RJC, UAI],
CYY: [ZTU, VBO, DXG, DIC, UIY, RJC, UAI, HXS, DWS],
RJC: [ZTU, DXG, ROD, DIC, UIY, CYY, OOM, UAI, HXS, DWS],
UAI: [ZTU, DXG, DIC, CYY, OOM, RJC, HXS],
DWS: [ZTU, VBO, DXG, ROD, UIY, CYY, OOM, RJC, HXS],
UIY: [VBO, ROD, CYY, RJC, HXS, DWS],
OOM: [VBO, DXG, RJC, UAI, HXS, DWS],
HXS: [VBO, DXG, UIY, CYY, OOM, RJC, UAI, DWS]}","Node ZTU is connected to nodes VBO, DXG, ROD, DIC, CYY, RJC, UAI, DWS.
Node VBO is connected to nodes ZTU, DXG, ROD, DIC, UIY, CYY, OOM, HXS, DWS.
Node DXG is connected to nodes ZTU, VBO, ROD, CYY, OOM, RJC, UAI, HXS, DWS.
Node ROD is connected to nodes ZTU, VBO, DXG, DIC, UIY, RJC, DWS.
Node DIC is connected to nodes ZTU, VBO, ROD, CYY, RJC, UAI.
Node CYY is connected to nodes ZTU, VBO, DXG, DIC, UIY, RJC, UAI, HXS, DWS.
Node RJC is connected to nodes ZTU, DXG, ROD, DIC, UIY, CYY, OOM, UAI, HXS, DWS.
Node UAI is connected to nodes ZTU, DXG, DIC, CYY, OOM, RJC, HXS.
Node DWS is connected to nodes ZTU, VBO, DXG, ROD, UIY, CYY, OOM, RJC, HXS.
Node UIY is connected to nodes VBO, ROD, CYY, RJC, HXS, DWS.
Node OOM is connected to nodes VBO, DXG, RJC, UAI, HXS, DWS.
Node HXS is connected to nodes VBO, DXG, UIY, CYY, OOM, RJC, UAI, DWS.","[ZTU, UAI, HXS, UIY, CYY, OOM, VBO, DIC, ROD, DXG, DWS, RJC]",12,47,False,Which are the neighbor nodes of node ZTU? ,"[VBO, DXG, ROD, DIC, CYY, RJC, UAI, DWS]","Let's solve it step by step.
Node ZTU connects to nodes [VBO, DXG, ROD, DIC, CYY, RJC, UAI, DWS], so the neighbors of node ZTU are ","('[[DIC], [OOM, CYY, HXS, UIY, DXG, ROD, DWS], [HXS, ZTU, OOM, CYY, DXG], [VBO, DXG, ROD, DIC, CYY, RJC, UAI, DWS]]',)",3,229
neighbor,"[(OXS, UCX), (OXS, IUP), (OXS, YMR), (OXS, AXI), (UCX, ZMC), (UCX, OXS), (IUP, NTM), (IUP, AXI), (YMR, NTM), (YMR, UCX), (YMR, LEB), (AXI, OXS), (AXI, LEB), (AXI, YMR), (AXI, NTM), (ZMC, NTM), (NTM, ODK), (NTM, OXS), (NTM, UCX), (NTM, IUP), (NTM, YMR), (LEB, YMR), (LEB, AXI), (LEB, ZMC), (LEB, ODK), (LEB, OXS), (LEB, UCX), (ODK, YMR), (ODK, NTM), (ODK, AXI)]","{OXS: [UCX, IUP, YMR, AXI],
UCX: [ZMC, OXS],
IUP: [NTM, AXI],
YMR: [NTM, UCX, LEB],
AXI: [OXS, LEB, YMR, NTM],
ZMC: [NTM],
NTM: [ODK, OXS, UCX, IUP, YMR],
LEB: [YMR, AXI, ZMC, ODK, OXS, UCX],
ODK: [YMR, NTM, AXI]}","Node OXS is connected to nodes UCX, IUP, YMR, AXI.
Node UCX is connected to nodes ZMC, OXS.
Node IUP is connected to nodes NTM, AXI.
Node YMR is connected to nodes NTM, UCX, LEB.
Node AXI is connected to nodes OXS, LEB, YMR, NTM.
Node ZMC is connected to node NTM.
Node NTM is connected to nodes ODK, OXS, UCX, IUP, YMR.
Node LEB is connected to nodes YMR, AXI, ZMC, ODK, OXS, UCX.
Node ODK is connected to nodes YMR, NTM, AXI.","[AXI, LEB, IUP, ZMC, YMR, UCX, OXS, NTM, ODK]",9,30,True,"Which are the neighbor nodes of node AXI? In the context of a directed graph, we consider a node's successors as its neighbors. ","[OXS, LEB, YMR, NTM]","Let's solve it step by step.
Node AXI connects to nodes [OXS, LEB, YMR, NTM], so the neighbors of node AXI are ","('[[LEB], [ODK, OXS, NTM, AXI, YMR], [YMR, LEB, ZMC, ODK, UCX, IUP, NTM, OXS], [OXS, LEB, YMR, NTM]]',)",3,230
neighbor,"[(OGU, YLZ), (OGU, BAA), (YLZ, ZFU), (BAA, FTL), (ZFU, BYO), (BYO, EQZ), (BYO, ZPE), (EQZ, ZPE)]","{OGU: [YLZ, BAA],
YLZ: [OGU, ZFU],
BAA: [OGU, FTL],
ZFU: [YLZ, BYO],
BYO: [EQZ, ZPE, ZFU],
EQZ: [BYO, ZPE],
ZPE: [BYO, EQZ],
FTL: [BAA]}","Node OGU is connected to nodes YLZ, BAA.
Node YLZ is connected to nodes OGU, ZFU.
Node BAA is connected to nodes OGU, FTL.
Node ZFU is connected to nodes YLZ, BYO.
Node BYO is connected to nodes EQZ, ZPE, ZFU.
Node EQZ is connected to nodes BYO, ZPE.
Node ZPE is connected to nodes BYO, EQZ.
Node FTL is connected to node BAA.","[ZFU, EQZ, ZPE, BYO, YLZ, FTL, BAA, OGU]",8,8,False,Which are the neighbor nodes of node EQZ? ,"[BYO, ZPE]","Let's solve it step by step.
Node EQZ connects to nodes [BYO, ZPE], so the neighbors of node EQZ are ","('[[EQZ, ZPE, OGU, BAA, FTL, BYO, ZFU], [EQZ, ZPE, YLZ], [BYO, ZPE], [YLZ, BAA, EQZ, BYO, ZFU]]',)",2,231
neighbor,"[(PFG, GAK), (PFG, SMW), (PFG, IZP), (PFG, ZEX), (PFG, JGS), (PFG, RWJ), (PFG, YNX), (PFG, WTI), (PFG, SUK), (PFG, SKZ), (GAK, SRO), (GAK, ZQX), (GAK, EFX), (GAK, SMW), (GAK, IZP), (GAK, ZEX), (GAK, RWJ), (GAK, QSU), (GAK, YNX), (GAK, SKZ), (SMW, SRO), (SMW, ZQX), (SMW, IZP), (SMW, ZEX), (SMW, JGS), (SMW, RWJ), (SMW, QSU), (SMW, WTI), (SMW, SUK), (SMW, SKZ), (IZP, SRO), (IZP, ZQX), (IZP, EFX), (IZP, JGS), (IZP, YNX), (IZP, WTI), (IZP, SUK), (IZP, SKZ), (ZEX, SRO), (ZEX, JGS), (ZEX, RWJ), (ZEX, QSU), (ZEX, SUK), (ZEX, SKZ), (JGS, SRO), (JGS, ZQX), (JGS, EFX), (JGS, RWJ), (JGS, QSU), (JGS, YNX), (JGS, SUK), (JGS, SKZ), (RWJ, SRO), (RWJ, ZQX), (RWJ, EFX), (RWJ, YNX), (RWJ, SUK), (RWJ, SKZ), (YNX, ZQX), (YNX, EFX), (YNX, QSU), (YNX, SKZ), (WTI, SRO), (WTI, ZQX), (WTI, EFX), (WTI, SUK), (WTI, SKZ), (SUK, SRO), (SUK, ZQX), (SUK, EFX), (SUK, QSU), (SKZ, SRO), (SKZ, ZQX), (SKZ, QSU), (SRO, EFX), (SRO, QSU), (EFX, ZQX), (QSU, ZQX)]","{PFG: [GAK, SMW, IZP, ZEX, JGS, RWJ, YNX, WTI, SUK, SKZ],
GAK: [PFG, SRO, ZQX, EFX, SMW, IZP, ZEX, RWJ, QSU, YNX, SKZ],
SMW: [PFG, SRO, ZQX, GAK, IZP, ZEX, JGS, RWJ, QSU, WTI, SUK, SKZ],
IZP: [PFG, SRO, ZQX, GAK, EFX, SMW, JGS, YNX, WTI, SUK, SKZ],
ZEX: [PFG, SRO, GAK, SMW, JGS, RWJ, QSU, SUK, SKZ],
JGS: [PFG, SRO, ZQX, EFX, SMW, IZP, ZEX, RWJ, QSU, YNX, SUK, SKZ],
RWJ: [PFG, SRO, ZQX, GAK, EFX, SMW, ZEX, JGS, YNX, SUK, SKZ],
YNX: [PFG, ZQX, GAK, EFX, IZP, JGS, RWJ, QSU, SKZ],
WTI: [PFG, SRO, ZQX, EFX, SMW, IZP, SUK, SKZ],
SUK: [PFG, SRO, ZQX, EFX, SMW, IZP, ZEX, JGS, RWJ, QSU, WTI],
SKZ: [PFG, SRO, ZQX, GAK, SMW, IZP, ZEX, JGS, RWJ, QSU, YNX, WTI],
SRO: [GAK, EFX, SMW, IZP, ZEX, JGS, RWJ, QSU, WTI, SUK, SKZ],
EFX: [SRO, ZQX, GAK, IZP, JGS, RWJ, YNX, WTI, SUK],
QSU: [SRO, ZQX, GAK, SMW, ZEX, JGS, YNX, SUK, SKZ],
ZQX: [GAK, EFX, SMW, IZP, JGS, RWJ, QSU, YNX, WTI, SUK, SKZ]}","Node PFG is connected to nodes GAK, SMW, IZP, ZEX, JGS, RWJ, YNX, WTI, SUK, SKZ.
Node GAK is connected to nodes PFG, SRO, ZQX, EFX, SMW, IZP, ZEX, RWJ, QSU, YNX, SKZ.
Node SMW is connected to nodes PFG, SRO, ZQX, GAK, IZP, ZEX, JGS, RWJ, QSU, WTI, SUK, SKZ.
Node IZP is connected to nodes PFG, SRO, ZQX, GAK, EFX, SMW, JGS, YNX, WTI, SUK, SKZ.
Node ZEX is connected to nodes PFG, SRO, GAK, SMW, JGS, RWJ, QSU, SUK, SKZ.
Node JGS is connected to nodes PFG, SRO, ZQX, EFX, SMW, IZP, ZEX, RWJ, QSU, YNX, SUK, SKZ.
Node RWJ is connected to nodes PFG, SRO, ZQX, GAK, EFX, SMW, ZEX, JGS, YNX, SUK, SKZ.
Node YNX is connected to nodes PFG, ZQX, GAK, EFX, IZP, JGS, RWJ, QSU, SKZ.
Node WTI is connected to nodes PFG, SRO, ZQX, EFX, SMW, IZP, SUK, SKZ.
Node SUK is connected to nodes PFG, SRO, ZQX, EFX, SMW, IZP, ZEX, JGS, RWJ, QSU, WTI.
Node SKZ is connected to nodes PFG, SRO, ZQX, GAK, SMW, IZP, ZEX, JGS, RWJ, QSU, YNX, WTI.
Node SRO is connected to nodes GAK, EFX, SMW, IZP, ZEX, JGS, RWJ, QSU, WTI, SUK, SKZ.
Node EFX is connected to nodes SRO, ZQX, GAK, IZP, JGS, RWJ, YNX, WTI, SUK.
Node QSU is connected to nodes SRO, ZQX, GAK, SMW, ZEX, JGS, YNX, SUK, SKZ.
Node ZQX is connected to nodes GAK, EFX, SMW, IZP, JGS, RWJ, QSU, YNX, WTI, SUK, SKZ.","[SUK, SRO, PFG, QSU, EFX, JGS, RWJ, ZEX, IZP, WTI, SMW, GAK, YNX, ZQX, SKZ]",15,78,False,Which are the neighbor nodes of node SUK? ,"[PFG, SRO, ZQX, EFX, SMW, IZP, ZEX, JGS, RWJ, QSU, WTI]","Let's solve it step by step.
Node SUK connects to nodes [PFG, SRO, ZQX, EFX, SMW, IZP, ZEX, JGS, RWJ, QSU, WTI], so the neighbors of node SUK are ","('[[EFX, RWJ, QSU, JGS, IZP, SRO, ZQX, ZEX, GAK, SKZ, YNX], [RWJ, YNX, QSU, PFG, WTI], [PFG, SRO, ZQX, EFX, SMW, IZP, ZEX, JGS, RWJ, QSU, WTI], [IZP, GAK, YNX]]',)",2,232
neighbor,"[(GSF, OAR), (GSF, CUT), (GSF, WDB), (GSF, GPP), (GSF, XCQ), (GSF, SBE), (GSF, QOD), (OAR, CFD), (OAR, CUT), (OAR, VZS), (OAR, GPP), (OAR, XCQ), (OAR, MMI), (OAR, QOD), (CUT, WDB), (CUT, GPP), (CUT, JVK), (CUT, XCQ), (CUT, SBE), (WDB, VZS), (WDB, GPP), (WDB, JVK), (WDB, MMI), (GPP, CFD), (GPP, GIS), (GPP, VZS), (GPP, XCQ), (GPP, MMI), (GPP, QOD), (XCQ, GIS), (XCQ, VZS), (XCQ, JVK), (XCQ, MMI), (SBE, CFD), (SBE, GIS), (SBE, VZS), (SBE, MMI), (QOD, CFD), (CFD, JVK), (CFD, MMI), (VZS, JVK), (JVK, GIS)]","{GSF: [OAR, CUT, WDB, GPP, XCQ, SBE, QOD],
OAR: [GSF, CFD, CUT, VZS, GPP, XCQ, MMI, QOD],
CUT: [GSF, OAR, WDB, GPP, JVK, XCQ, SBE],
WDB: [GSF, CUT, VZS, GPP, JVK, MMI],
GPP: [GSF, OAR, CFD, CUT, WDB, GIS, VZS, XCQ, MMI, QOD],
XCQ: [GSF, OAR, CUT, GIS, VZS, GPP, JVK, MMI],
SBE: [GSF, CFD, CUT, GIS, VZS, MMI],
QOD: [GSF, OAR, CFD, GPP],
CFD: [OAR, GPP, JVK, SBE, MMI, QOD],
VZS: [OAR, WDB, GPP, JVK, XCQ, SBE],
MMI: [OAR, CFD, WDB, GPP, XCQ, SBE],
JVK: [CFD, CUT, WDB, GIS, VZS, XCQ],
GIS: [GPP, JVK, XCQ, SBE]}","Node GSF is connected to nodes OAR, CUT, WDB, GPP, XCQ, SBE, QOD.
Node OAR is connected to nodes GSF, CFD, CUT, VZS, GPP, XCQ, MMI, QOD.
Node CUT is connected to nodes GSF, OAR, WDB, GPP, JVK, XCQ, SBE.
Node WDB is connected to nodes GSF, CUT, VZS, GPP, JVK, MMI.
Node GPP is connected to nodes GSF, OAR, CFD, CUT, WDB, GIS, VZS, XCQ, MMI, QOD.
Node XCQ is connected to nodes GSF, OAR, CUT, GIS, VZS, GPP, JVK, MMI.
Node SBE is connected to nodes GSF, CFD, CUT, GIS, VZS, MMI.
Node QOD is connected to nodes GSF, OAR, CFD, GPP.
Node CFD is connected to nodes OAR, GPP, JVK, SBE, MMI, QOD.
Node VZS is connected to nodes OAR, WDB, GPP, JVK, XCQ, SBE.
Node MMI is connected to nodes OAR, CFD, WDB, GPP, XCQ, SBE.
Node JVK is connected to nodes CFD, CUT, WDB, GIS, VZS, XCQ.
Node GIS is connected to nodes GPP, JVK, XCQ, SBE.","[XCQ, MMI, WDB, JVK, CFD, CUT, QOD, OAR, VZS, SBE, GSF, GPP, GIS]",13,42,False,Which are the neighbor nodes of node GIS? ,"[GPP, JVK, XCQ, SBE]","Let's solve it step by step.
Node GIS connects to nodes [GPP, JVK, XCQ, SBE], so the neighbors of node GIS are ","('[[GPP, QOD, OAR, GSF, MMI, JVK, XCQ, CFD], [OAR, JVK, SBE, QOD, WDB, XCQ, GSF], [GPP, JVK, XCQ, SBE], [GSF, JVK, OAR, CFD, XCQ, GPP, SBE, QOD, WDB, MMI, GIS]]',)",2,233
neighbor,"[(ONI, QES), (ONI, HTE), (QES, JIA), (QES, IMP), (QES, IEA), (HTE, JIA), (HTE, IEA), (HTE, QES), (JIA, ZGK), (JIA, HTE), (JIA, ONI), (ZGK, QES), (ZGK, JIA), (IMP, IEA), (IMP, IVI), (IMP, JIA), (IEA, IVI), (IEA, OTN), (IEA, HTE), (IEA, ZGK), (IVI, IMP), (OTN, QES), (OTN, ONI), (OTN, JIA), (OTN, ZGK), (OTN, IVI)]","{ONI: [QES, HTE],
QES: [JIA, IMP, IEA],
HTE: [JIA, IEA, QES],
JIA: [ZGK, HTE, ONI],
ZGK: [QES, JIA],
IMP: [IEA, IVI, JIA],
IEA: [IVI, OTN, HTE, ZGK],
IVI: [IMP],
OTN: [QES, ONI, JIA, ZGK, IVI]}","Node ONI is connected to nodes QES, HTE.
Node QES is connected to nodes JIA, IMP, IEA.
Node HTE is connected to nodes JIA, IEA, QES.
Node JIA is connected to nodes ZGK, HTE, ONI.
Node ZGK is connected to nodes QES, JIA.
Node IMP is connected to nodes IEA, IVI, JIA.
Node IEA is connected to nodes IVI, OTN, HTE, ZGK.
Node IVI is connected to node IMP.
Node OTN is connected to nodes QES, ONI, JIA, ZGK, IVI.","[ZGK, JIA, IVI, HTE, ONI, IMP, IEA, QES, OTN]",9,26,True,"Which are the neighbor nodes of node QES? In the context of a directed graph, we consider a node's successors as its neighbors. ","[JIA, IMP, IEA]","Let's solve it step by step.
Node QES connects to nodes [JIA, IMP, IEA], so the neighbors of node QES are ","('[[JIA, ZGK, IMP, ONI, QES, OTN], [JIA], [IMP, ZGK, IVI, HTE], [JIA, IMP, IEA]]',)",3,234
neighbor,"[(MGV, BSF), (MGV, BBX), (MGV, SEX), (BSF, PYO), (BSF, BBX), (BSF, YQG), (BSF, SEX), (BBX, PYO), (BBX, NSU), (BBX, OOV), (SEX, PYO), (SEX, NSU), (SEX, UCQ), (SEX, OOV), (NSU, YQG), (NSU, OOV), (YQG, UCQ)]","{MGV: [BSF, BBX, SEX],
BSF: [MGV, PYO, BBX, YQG, SEX],
BBX: [MGV, PYO, NSU, BSF, OOV],
SEX: [MGV, PYO, NSU, BSF, UCQ, OOV],
PYO: [BSF, BBX, SEX],
NSU: [BBX, YQG, SEX, OOV],
YQG: [NSU, BSF, UCQ],
OOV: [NSU, BBX, SEX],
UCQ: [YQG, SEX]}","Node MGV is connected to nodes BSF, BBX, SEX.
Node BSF is connected to nodes MGV, PYO, BBX, YQG, SEX.
Node BBX is connected to nodes MGV, PYO, NSU, BSF, OOV.
Node SEX is connected to nodes MGV, PYO, NSU, BSF, UCQ, OOV.
Node PYO is connected to nodes BSF, BBX, SEX.
Node NSU is connected to nodes BBX, YQG, SEX, OOV.
Node YQG is connected to nodes NSU, BSF, UCQ.
Node OOV is connected to nodes NSU, BBX, SEX.
Node UCQ is connected to nodes YQG, SEX.","[BBX, NSU, YQG, OOV, SEX, BSF, PYO, UCQ, MGV]",9,17,False,Which are the neighbor nodes of node BSF? ,"[MGV, PYO, BBX, YQG, SEX]","Let's solve it step by step.
Node BSF connects to nodes [MGV, PYO, BBX, YQG, SEX], so the neighbors of node BSF are ","('[[YQG], [], [NSU], [MGV, PYO, BBX, YQG, SEX]]',)",3,235
neighbor,"[(TJY, OYM), (TJY, XQZ), (TJY, VWZ), (XQZ, MBG), (XQZ, CIA), (XQZ, LLH), (XQZ, CGT), (MBG, EEA), (CGT, WZU)]","{TJY: [OYM, XQZ, VWZ],
OYM: [TJY],
XQZ: [TJY, MBG, CIA, LLH, CGT],
VWZ: [TJY],
MBG: [EEA, XQZ],
EEA: [MBG],
CIA: [XQZ],
LLH: [XQZ],
CGT: [XQZ, WZU],
WZU: [CGT]}","Node TJY is connected to nodes OYM, XQZ, VWZ.
Node OYM is connected to node TJY.
Node XQZ is connected to nodes TJY, MBG, CIA, LLH, CGT.
Node VWZ is connected to node TJY.
Node MBG is connected to nodes EEA, XQZ.
Node EEA is connected to node MBG.
Node CIA is connected to node XQZ.
Node LLH is connected to node XQZ.
Node CGT is connected to nodes XQZ, WZU.
Node WZU is connected to node CGT.","[VWZ, WZU, XQZ, MBG, LLH, OYM, CIA, CGT, EEA, TJY]",10,9,False,Which are the neighbor nodes of node TJY? ,"[OYM, XQZ, VWZ]","Let's solve it step by step.
Node TJY connects to nodes [OYM, XQZ, VWZ], so the neighbors of node TJY are ","('[[MBG, TJY, EEA, OYM, VWZ, LLH, CIA, XQZ], [OYM, CIA, EEA], [EEA, XQZ, MBG, TJY, OYM, CIA, WZU], [OYM, XQZ, VWZ]]',)",3,236
neighbor,"[(MLI, FBS), (MLI, YZN), (MLI, WAH), (MLI, QCV), (FBS, EDD), (FBS, KCI), (FBS, WAH), (YZN, EDD), (YZN, OEK), (YZN, PWK), (WAH, EDD), (WAH, OEK), (QCV, CHL), (EDD, KCI), (EDD, KAI), (EDD, PWK), (EDD, JNH), (KCI, OEK), (KCI, CHL), (OEK, PWK), (PWK, KAI), (PWK, CHL), (KAI, CHL), (KAI, JNH)]","{MLI: [FBS, YZN, WAH, QCV],
FBS: [MLI, EDD, KCI, WAH],
YZN: [MLI, EDD, OEK, PWK],
WAH: [MLI, FBS, EDD, OEK],
QCV: [MLI, CHL],
EDD: [FBS, YZN, KCI, WAH, KAI, PWK, JNH],
KCI: [FBS, EDD, OEK, CHL],
OEK: [YZN, PWK, KCI, WAH],
PWK: [YZN, EDD, OEK, KAI, CHL],
KAI: [EDD, PWK, CHL, JNH],
JNH: [EDD, KAI],
CHL: [PWK, KCI, KAI, QCV]}","Node MLI is connected to nodes FBS, YZN, WAH, QCV.
Node FBS is connected to nodes MLI, EDD, KCI, WAH.
Node YZN is connected to nodes MLI, EDD, OEK, PWK.
Node WAH is connected to nodes MLI, FBS, EDD, OEK.
Node QCV is connected to nodes MLI, CHL.
Node EDD is connected to nodes FBS, YZN, KCI, WAH, KAI, PWK, JNH.
Node KCI is connected to nodes FBS, EDD, OEK, CHL.
Node OEK is connected to nodes YZN, PWK, KCI, WAH.
Node PWK is connected to nodes YZN, EDD, OEK, KAI, CHL.
Node KAI is connected to nodes EDD, PWK, CHL, JNH.
Node JNH is connected to nodes EDD, KAI.
Node CHL is connected to nodes PWK, KCI, KAI, QCV.","[PWK, MLI, CHL, JNH, WAH, EDD, QCV, KAI, KCI, FBS, OEK, YZN]",12,24,False,Which are the neighbor nodes of node EDD? ,"[FBS, YZN, KCI, WAH, KAI, PWK, JNH]","Let's solve it step by step.
Node EDD connects to nodes [FBS, YZN, KCI, WAH, KAI, PWK, JNH], so the neighbors of node EDD are ","('[[], [FBS, OEK, WAH, KCI], [OEK, FBS, KAI, MLI, JNH, WAH, KCI], [FBS, YZN, KCI, WAH, KAI, PWK, JNH]]',)",3,237
neighbor,"[(FIQ, UYE), (FIQ, IHS), (FIQ, PGZ), (FIQ, XTD), (UYE, VZN), (UYE, IHS), (IHS, FAR), (PGZ, XJP), (PGZ, AGZ), (PGZ, XTD), (PGZ, FAR), (VZN, PGZ), (VZN, FIQ), (FAR, UYE), (FAR, IHS), (FAR, XTD), (XJP, AGZ), (XJP, XTD), (XJP, FAR), (XJP, UYE), (XJP, YJE), (AGZ, YJE), (YJE, PGZ)]","{FIQ: [UYE, IHS, PGZ, XTD],
UYE: [VZN, IHS],
IHS: [FAR],
PGZ: [XJP, AGZ, XTD, FAR],
XTD: [],
VZN: [PGZ, FIQ],
FAR: [UYE, IHS, XTD],
XJP: [AGZ, XTD, FAR, UYE, YJE],
AGZ: [YJE],
YJE: [PGZ]}","Node FIQ is connected to nodes UYE, IHS, PGZ, XTD.
Node UYE is connected to nodes VZN, IHS.
Node IHS is connected to node FAR.
Node PGZ is connected to nodes XJP, AGZ, XTD, FAR.
Node VZN is connected to nodes PGZ, FIQ.
Node FAR is connected to nodes UYE, IHS, XTD.
Node XJP is connected to nodes AGZ, XTD, FAR, UYE, YJE.
Node AGZ is connected to node YJE.
Node YJE is connected to node PGZ.","[IHS, XJP, XTD, PGZ, AGZ, FAR, FIQ, UYE, YJE, VZN]",10,23,True,"Which are the neighbor nodes of node UYE? In the context of a directed graph, we consider a node's successors as its neighbors. ","[VZN, IHS]","Let's solve it step by step.
Node UYE connects to nodes [VZN, IHS], so the neighbors of node UYE are ","('[[UYE], [VZN, IHS], [], [AGZ, XJP, XTD]]',)",1,238
neighbor,"[(AUV, YSC), (AUV, MFB), (YSC, ZIH), (MFB, ZIH), (ZIH, WNW), (WNW, USE), (GPI, USE), (GPI, KJL), (KJL, KJH)]","{AUV: [YSC, MFB],
YSC: [AUV, ZIH],
MFB: [AUV, ZIH],
ZIH: [YSC, MFB, WNW],
WNW: [ZIH, USE],
GPI: [USE, KJL],
USE: [GPI, WNW],
KJL: [GPI, KJH],
KJH: [KJL]}","Node AUV is connected to nodes YSC, MFB.
Node YSC is connected to nodes AUV, ZIH.
Node MFB is connected to nodes AUV, ZIH.
Node ZIH is connected to nodes YSC, MFB, WNW.
Node WNW is connected to nodes ZIH, USE.
Node GPI is connected to nodes USE, KJL.
Node USE is connected to nodes GPI, WNW.
Node KJL is connected to nodes GPI, KJH.
Node KJH is connected to node KJL.","[MFB, AUV, KJH, YSC, USE, ZIH, KJL, GPI, WNW]",9,9,False,Which are the neighbor nodes of node KJH? ,[KJL],"Let's solve it step by step.
Node KJH connects to nodes [KJL], so the neighbors of node KJH are ","('[[MFB, KJH, AUV, YSC, KJL, ZIH], [ZIH], [WNW, KJL, AUV, USE, ZIH, MFB, KJH, YSC], [KJL]]',)",3,239
neighbor,"[(LFI, LRU), (LFI, GWP), (LRU, MXF), (GWP, QKW), (GWP, AFS), (MXF, HEH), (QKW, CYU), (CYU, HEH), (HEH, OYS)]","{LFI: [LRU, GWP],
LRU: [LFI, MXF],
GWP: [LFI, QKW, AFS],
MXF: [LRU, HEH],
QKW: [GWP, CYU],
AFS: [GWP],
CYU: [QKW, HEH],
HEH: [MXF, CYU, OYS],
OYS: [HEH]}","Node LFI is connected to nodes LRU, GWP.
Node LRU is connected to nodes LFI, MXF.
Node GWP is connected to nodes LFI, QKW, AFS.
Node MXF is connected to nodes LRU, HEH.
Node QKW is connected to nodes GWP, CYU.
Node AFS is connected to node GWP.
Node CYU is connected to nodes QKW, HEH.
Node HEH is connected to nodes MXF, CYU, OYS.
Node OYS is connected to node HEH.","[OYS, LRU, MXF, LFI, GWP, HEH, AFS, QKW, CYU]",9,9,False,Which are the neighbor nodes of node CYU? ,"[QKW, HEH]","Let's solve it step by step.
Node CYU connects to nodes [QKW, HEH], so the neighbors of node CYU are ","('[[GWP, OYS, CYU, QKW, LRU, MXF, LFI], [GWP, QKW, CYU, AFS, LRU, LFI, HEH], [HEH, MXF, CYU], [QKW, HEH]]',)",3,240
neighbor,"[(QGS, MPV), (MPV, OMC), (MPV, VPZ), (ICB, XMW), (ICB, VPZ), (ICB, MJX), (XMW, HKN), (XMW, VPZ), (XMW, OMC), (XMW, AAN), (XMW, QGS), (VPZ, HKN), (HKN, ICB), (OMC, AAN), (OMC, QGS), (OMC, XMW), (OMC, MPV), (AAN, VPZ), (AAN, MPV)]","{QGS: [MPV],
MPV: [OMC, VPZ],
ICB: [XMW, VPZ, MJX],
XMW: [HKN, VPZ, OMC, AAN, QGS],
VPZ: [HKN],
MJX: [],
HKN: [ICB],
OMC: [AAN, QGS, XMW, MPV],
AAN: [VPZ, MPV]}","Node QGS is connected to node MPV.
Node MPV is connected to nodes OMC, VPZ.
Node ICB is connected to nodes XMW, VPZ, MJX.
Node XMW is connected to nodes HKN, VPZ, OMC, AAN, QGS.
Node VPZ is connected to node HKN.
Node HKN is connected to node ICB.
Node OMC is connected to nodes AAN, QGS, XMW, MPV.
Node AAN is connected to nodes VPZ, MPV.","[VPZ, MJX, AAN, XMW, ICB, HKN, QGS, OMC, MPV]",9,19,True,"Which are the neighbor nodes of node XMW? In the context of a directed graph, we consider a node's successors as its neighbors. ","[HKN, VPZ, OMC, AAN, QGS]","Let's solve it step by step.
Node XMW connects to nodes [HKN, VPZ, OMC, AAN, QGS], so the neighbors of node XMW are ","('[[ICB, MJX, QGS, XMW, OMC], [MPV, OMC], [MPV, MJX, ICB, OMC, QGS, HKN, AAN, VPZ], [HKN, VPZ, OMC, AAN, QGS]]',)",3,241
