task,graph,graph_adj,graph_nl,nodes,num_nodes,num_edges,directed,question,answer,steps,choices,label,id
neighbor,"[(KRE, YTE), (KRE, CER), (YTE, TDN), (CER, MOR), (CER, FFB), (FFB, UZR), (FFB, JIS), (UZR, BLC), (UZR, FPR)]","{KRE: [YTE, CER],
YTE: [KRE, TDN],
CER: [KRE, MOR, FFB],
TDN: [YTE],
MOR: [CER],
FFB: [CER, UZR, JIS],
UZR: [BLC, FFB, FPR],
BLC: [UZR],
FPR: [UZR],
JIS: [FFB]}","Node KRE is connected to nodes YTE, CER.
Node YTE is connected to nodes KRE, TDN.
Node CER is connected to nodes KRE, MOR, FFB.
Node TDN is connected to node YTE.
Node MOR is connected to node CER.
Node FFB is connected to nodes CER, UZR, JIS.
Node UZR is connected to nodes BLC, FFB, FPR.
Node BLC is connected to node UZR.
Node FPR is connected to node UZR.
Node JIS is connected to node FFB.","[JIS, KRE, BLC, MOR, UZR, TDN, YTE, FPR, CER, FFB]",10,9,False,Which are the neighbor nodes of node FPR? ,[UZR],"Let's solve it step by step.
Node FPR connects to nodes [UZR], so the neighbors of node FPR are ","('[[UZR, CER, FFB, KRE, JIS, MOR, YTE, FPR, BLC], [BLC, FFB, FPR, JIS, YTE, KRE, TDN, MOR], [UZR], [JIS, FPR, TDN, UZR, CER, FFB]]',)",2,141
neighbor,"[(KQG, ITU), (KQG, WMY), (KQG, RKP), (KQG, VAN), (KQG, YSG), (KQG, FBZ), (KQG, ZXO), (KQG, VXY), (ITU, SHT), (ITU, ECI), (RKP, KST), (YSG, DJE)]","{KQG: [ITU, WMY, RKP, VAN, YSG, FBZ, ZXO, VXY],
ITU: [KQG, SHT, ECI],
WMY: [KQG],
RKP: [KQG, KST],
VAN: [KQG],
YSG: [KQG, DJE],
FBZ: [KQG],
ZXO: [KQG],
VXY: [KQG],
SHT: [ITU],
ECI: [ITU],
DJE: [YSG],
KST: [RKP]}","Node KQG is connected to nodes ITU, WMY, RKP, VAN, YSG, FBZ, ZXO, VXY.
Node ITU is connected to nodes KQG, SHT, ECI.
Node WMY is connected to node KQG.
Node RKP is connected to nodes KQG, KST.
Node VAN is connected to node KQG.
Node YSG is connected to nodes KQG, DJE.
Node FBZ is connected to node KQG.
Node ZXO is connected to node KQG.
Node VXY is connected to node KQG.
Node SHT is connected to node ITU.
Node ECI is connected to node ITU.
Node DJE is connected to node YSG.
Node KST is connected to node RKP.","[FBZ, SHT, ECI, KST, WMY, ITU, YSG, DJE, KQG, ZXO, RKP, VXY, VAN]",13,12,False,Which are the neighbor nodes of node VXY? ,[KQG],"Let's solve it step by step.
Node VXY connects to nodes [KQG], so the neighbors of node VXY are ","('[[ECI, RKP, FBZ, DJE, VAN], [ZXO, ECI, KQG, FBZ, ITU, KST, RKP, VXY, SHT, DJE], [KQG], [KST, FBZ, YSG, KQG, ECI, SHT, ITU, WMY, VXY, ZXO, DJE]]',)",2,142
neighbor,"[(UZW, MYJ), (UZW, MBX), (UZW, XUI), (UZW, FZB), (UZW, UCT), (UZW, UES), (UZW, UTB), (MBX, QRX), (MBX, LHU), (UCT, BEE), (QRX, JXM), (QRX, NEI), (QRX, HXO)]","{UZW: [MYJ, MBX, XUI, FZB, UCT, UES, UTB],
MYJ: [UZW],
MBX: [UZW, QRX, LHU],
XUI: [UZW],
FZB: [UZW],
UCT: [UZW, BEE],
UES: [UZW],
UTB: [UZW],
QRX: [MBX, JXM, NEI, HXO],
LHU: [MBX],
BEE: [UCT],
JXM: [QRX],
NEI: [QRX],
HXO: [QRX]}","Node UZW is connected to nodes MYJ, MBX, XUI, FZB, UCT, UES, UTB.
Node MYJ is connected to node UZW.
Node MBX is connected to nodes UZW, QRX, LHU.
Node XUI is connected to node UZW.
Node FZB is connected to node UZW.
Node UCT is connected to nodes UZW, BEE.
Node UES is connected to node UZW.
Node UTB is connected to node UZW.
Node QRX is connected to nodes MBX, JXM, NEI, HXO.
Node LHU is connected to node MBX.
Node BEE is connected to node UCT.
Node JXM is connected to node QRX.
Node NEI is connected to node QRX.
Node HXO is connected to node QRX.","[UTB, UES, BEE, QRX, XUI, LHU, JXM, MYJ, UZW, UCT, HXO, FZB, MBX, NEI]",14,13,False,Which are the neighbor nodes of node UES? ,[UZW],"Let's solve it step by step.
Node UES connects to nodes [UZW], so the neighbors of node UES are ","('[[UZW], [LHU], [MBX, NEI, LHU, BEE, XUI, HXO, UES, JXM], [HXO, UTB, JXM, UES, UZW, NEI, XUI, MBX, LHU, UCT, MYJ, BEE]]',)",0,143
neighbor,"[(GWL, DDH), (GWL, OIZ), (GWL, JUN), (GWL, YDO), (GWL, TBQ), (GWL, WSS), (GWL, OYG), (GWL, ZOC), (DDH, WYC), (DDH, OIZ), (DDH, JUN), (DDH, YDO), (DDH, WSS), (DDH, OYG), (OIZ, WYC), (OIZ, JUN), (OIZ, YDO), (OIZ, OYG), (OIZ, ZOC), (JUN, WYC), (JUN, YDO), (JUN, TBQ), (JUN, WSS), (JUN, OYG), (YDO, TBQ), (YDO, WSS), (YDO, OYG), (TBQ, WYC), (TBQ, WSS), (TBQ, OYG), (TBQ, ZOC), (WSS, OYG), (OYG, WYC), (OYG, ZOC), (ZOC, WYC)]","{GWL: [DDH, OIZ, JUN, YDO, TBQ, WSS, OYG, ZOC],
DDH: [GWL, WYC, OIZ, JUN, YDO, WSS, OYG],
OIZ: [GWL, DDH, WYC, JUN, YDO, OYG, ZOC],
JUN: [GWL, DDH, WYC, OIZ, YDO, TBQ, WSS, OYG],
YDO: [GWL, DDH, OIZ, JUN, TBQ, WSS, OYG],
TBQ: [GWL, WYC, JUN, YDO, WSS, OYG, ZOC],
WSS: [GWL, DDH, JUN, YDO, TBQ, OYG],
OYG: [GWL, DDH, WYC, OIZ, JUN, YDO, TBQ, WSS, ZOC],
ZOC: [GWL, WYC, OIZ, TBQ, OYG],
WYC: [DDH, OIZ, JUN, TBQ, OYG, ZOC]}","Node GWL is connected to nodes DDH, OIZ, JUN, YDO, TBQ, WSS, OYG, ZOC.
Node DDH is connected to nodes GWL, WYC, OIZ, JUN, YDO, WSS, OYG.
Node OIZ is connected to nodes GWL, DDH, WYC, JUN, YDO, OYG, ZOC.
Node JUN is connected to nodes GWL, DDH, WYC, OIZ, YDO, TBQ, WSS, OYG.
Node YDO is connected to nodes GWL, DDH, OIZ, JUN, TBQ, WSS, OYG.
Node TBQ is connected to nodes GWL, WYC, JUN, YDO, WSS, OYG, ZOC.
Node WSS is connected to nodes GWL, DDH, JUN, YDO, TBQ, OYG.
Node OYG is connected to nodes GWL, DDH, WYC, OIZ, JUN, YDO, TBQ, WSS, ZOC.
Node ZOC is connected to nodes GWL, WYC, OIZ, TBQ, OYG.
Node WYC is connected to nodes DDH, OIZ, JUN, TBQ, OYG, ZOC.","[YDO, OIZ, DDH, GWL, OYG, WSS, WYC, ZOC, TBQ, JUN]",10,35,False,Which are the neighbor nodes of node JUN? ,"[GWL, DDH, WYC, OIZ, YDO, TBQ, WSS, OYG]","Let's solve it step by step.
Node JUN connects to nodes [GWL, DDH, WYC, OIZ, YDO, TBQ, WSS, OYG], so the neighbors of node JUN are ","('[[YDO, WYC, ZOC, OIZ, WSS, TBQ, GWL, JUN], [DDH], [GWL, DDH, WYC, OIZ, YDO, TBQ, WSS, OYG], [OYG, JUN]]',)",2,144
neighbor,"[(YJM, QJM), (YJM, HNX), (YJM, AZT), (YJM, ZCE), (YJM, SYA), (YJM, OKI), (YJM, HEQ), (AZT, HBV), (SYA, CVH), (SYA, HPQ), (OKI, OSP), (CRW, WSW), (CRW, SGJ), (CRW, OSP)]","{YJM: [QJM, HNX, AZT, ZCE, SYA, OKI, HEQ],
QJM: [YJM],
HNX: [YJM],
AZT: [YJM, HBV],
ZCE: [YJM],
SYA: [YJM, CVH, HPQ],
OKI: [YJM, OSP],
HEQ: [YJM],
HBV: [AZT],
CRW: [WSW, SGJ, OSP],
WSW: [CRW],
SGJ: [CRW],
OSP: [CRW, OKI],
CVH: [SYA],
HPQ: [SYA]}","Node YJM is connected to nodes QJM, HNX, AZT, ZCE, SYA, OKI, HEQ.
Node QJM is connected to node YJM.
Node HNX is connected to node YJM.
Node AZT is connected to nodes YJM, HBV.
Node ZCE is connected to node YJM.
Node SYA is connected to nodes YJM, CVH, HPQ.
Node OKI is connected to nodes YJM, OSP.
Node HEQ is connected to node YJM.
Node HBV is connected to node AZT.
Node CRW is connected to nodes WSW, SGJ, OSP.
Node WSW is connected to node CRW.
Node SGJ is connected to node CRW.
Node OSP is connected to nodes CRW, OKI.
Node CVH is connected to node SYA.
Node HPQ is connected to node SYA.","[HNX, SGJ, WSW, YJM, OKI, OSP, HBV, ZCE, AZT, QJM, CRW, HPQ, CVH, HEQ, SYA]",15,14,False,Which are the neighbor nodes of node YJM? ,"[QJM, HNX, AZT, ZCE, SYA, OKI, HEQ]","Let's solve it step by step.
Node YJM connects to nodes [QJM, HNX, AZT, ZCE, SYA, OKI, HEQ], so the neighbors of node YJM are ","('[[CVH, HBV, CRW, HNX, OSP, WSW, SYA, OKI, SGJ], [], [QJM, HNX, AZT, ZCE, SYA, OKI, HEQ], [SGJ, CRW, OSP, QJM, HEQ, ZCE]]',)",2,145
neighbor,"[(WDX, GWY), (WDX, UJT), (WDX, XHA), (WDX, UQM), (WDX, DFO), (WDX, OLA), (WDX, JTP), (WDX, NKQ), (WDX, MKU), (WDX, FUX), (GWY, UJT), (GWY, XHA), (GWY, DFO), (GWY, RYC), (GWY, JTP), (GWY, RFR), (UJT, XHA), (UJT, RYC), (UJT, MKU), (UJT, RFR), (UJT, FUX), (XHA, UQM), (XHA, DFO), (XHA, OLA), (XHA, JTP), (XHA, NKQ), (XHA, RFR), (UQM, RYC), (UQM, LRK), (UQM, MKU), (UQM, RFR), (DFO, NKQ), (DFO, MKU), (OLA, RYC), (OLA, NKQ), (OLA, MKU), (JTP, RYC), (JTP, LRK), (JTP, NKQ), (JTP, MKU), (NKQ, MKU), (NKQ, FUX), (MKU, LRK), (MKU, FUX), (FUX, RYC), (FUX, RFR), (RFR, LRK)]","{WDX: [GWY, UJT, XHA, UQM, DFO, OLA, JTP, NKQ, MKU, FUX],
GWY: [WDX, UJT, XHA, DFO, RYC, JTP, RFR],
UJT: [WDX, GWY, XHA, RYC, MKU, RFR, FUX],
XHA: [WDX, GWY, UJT, UQM, DFO, OLA, JTP, NKQ, RFR],
UQM: [WDX, XHA, RYC, LRK, MKU, RFR],
DFO: [WDX, GWY, XHA, NKQ, MKU],
OLA: [WDX, XHA, RYC, NKQ, MKU],
JTP: [WDX, GWY, XHA, RYC, LRK, NKQ, MKU],
NKQ: [WDX, XHA, DFO, OLA, JTP, MKU, FUX],
MKU: [WDX, UJT, UQM, DFO, LRK, OLA, JTP, NKQ, FUX],
FUX: [WDX, UJT, RYC, NKQ, MKU, RFR],
RYC: [GWY, UJT, UQM, OLA, JTP, FUX],
RFR: [GWY, UJT, XHA, UQM, LRK, FUX],
LRK: [UQM, JTP, MKU, RFR]}","Node WDX is connected to nodes GWY, UJT, XHA, UQM, DFO, OLA, JTP, NKQ, MKU, FUX.
Node GWY is connected to nodes WDX, UJT, XHA, DFO, RYC, JTP, RFR.
Node UJT is connected to nodes WDX, GWY, XHA, RYC, MKU, RFR, FUX.
Node XHA is connected to nodes WDX, GWY, UJT, UQM, DFO, OLA, JTP, NKQ, RFR.
Node UQM is connected to nodes WDX, XHA, RYC, LRK, MKU, RFR.
Node DFO is connected to nodes WDX, GWY, XHA, NKQ, MKU.
Node OLA is connected to nodes WDX, XHA, RYC, NKQ, MKU.
Node JTP is connected to nodes WDX, GWY, XHA, RYC, LRK, NKQ, MKU.
Node NKQ is connected to nodes WDX, XHA, DFO, OLA, JTP, MKU, FUX.
Node MKU is connected to nodes WDX, UJT, UQM, DFO, LRK, OLA, JTP, NKQ, FUX.
Node FUX is connected to nodes WDX, UJT, RYC, NKQ, MKU, RFR.
Node RYC is connected to nodes GWY, UJT, UQM, OLA, JTP, FUX.
Node RFR is connected to nodes GWY, UJT, XHA, UQM, LRK, FUX.
Node LRK is connected to nodes UQM, JTP, MKU, RFR.","[MKU, WDX, DFO, UJT, OLA, JTP, RYC, UQM, RFR, XHA, LRK, FUX, GWY, NKQ]",14,47,False,Which are the neighbor nodes of node RYC? ,"[GWY, UJT, UQM, OLA, JTP, FUX]","Let's solve it step by step.
Node RYC connects to nodes [GWY, UJT, UQM, OLA, JTP, FUX], so the neighbors of node RYC are ","('[[LRK, XHA, UQM, MKU], [NKQ, RFR, MKU, DFO, GWY, JTP, OLA, LRK, XHA, FUX, WDX], [XHA, RYC, OLA], [GWY, UJT, UQM, OLA, JTP, FUX]]',)",3,146
neighbor,"[(PDZ, EJI), (PDZ, NLK), (NLK, XAR), (NLK, RME), (NLK, PFP), (NLK, KWX), (NLK, LSG), (KWX, XSR)]","{PDZ: [EJI, NLK],
EJI: [PDZ],
NLK: [PDZ, XAR, RME, PFP, KWX, LSG],
XAR: [NLK],
RME: [NLK],
PFP: [NLK],
KWX: [NLK, XSR],
LSG: [NLK],
XSR: [KWX]}","Node PDZ is connected to nodes EJI, NLK.
Node EJI is connected to node PDZ.
Node NLK is connected to nodes PDZ, XAR, RME, PFP, KWX, LSG.
Node XAR is connected to node NLK.
Node RME is connected to node NLK.
Node PFP is connected to node NLK.
Node KWX is connected to nodes NLK, XSR.
Node LSG is connected to node NLK.
Node XSR is connected to node KWX.","[PFP, EJI, KWX, XSR, PDZ, LSG, RME, NLK, XAR]",9,8,False,Which are the neighbor nodes of node PFP? ,[NLK],"Let's solve it step by step.
Node PFP connects to nodes [NLK], so the neighbors of node PFP are ","('[[NLK], [XAR, EJI, LSG, PDZ, PFP, NLK, KWX], [], []]',)",0,147
neighbor,"[(WYF, QXS), (WYF, VDS), (WYF, VKL), (WYF, UJY), (WYF, ATZ), (QXS, WYF), (VDS, ATZ), (VDS, WYF), (VDS, ELW), (VKL, UJY), (VKL, QXS), (VKL, ELW), (VKL, VDS), (UJY, WYF), (ATZ, QXS), (ATZ, VDS), (ATZ, VKL), (ATZ, UJY), (ELW, VDS), (ELW, UJY), (SCX, WYF), (SCX, ELW), (SCX, VKL), (SCX, UJY), (SCX, ATZ)]","{WYF: [QXS, VDS, VKL, UJY, ATZ],
QXS: [WYF],
VDS: [ATZ, WYF, ELW],
VKL: [UJY, QXS, ELW, VDS],
UJY: [WYF],
ATZ: [QXS, VDS, VKL, UJY],
ELW: [VDS, UJY],
SCX: [WYF, ELW, VKL, UJY, ATZ]}","Node WYF is connected to nodes QXS, VDS, VKL, UJY, ATZ.
Node QXS is connected to node WYF.
Node VDS is connected to nodes ATZ, WYF, ELW.
Node VKL is connected to nodes UJY, QXS, ELW, VDS.
Node UJY is connected to node WYF.
Node ATZ is connected to nodes QXS, VDS, VKL, UJY.
Node ELW is connected to nodes VDS, UJY.
Node SCX is connected to nodes WYF, ELW, VKL, UJY, ATZ.","[ELW, VDS, QXS, WYF, SCX, VKL, ATZ, UJY]",8,25,True,"Which are the neighbor nodes of node SCX? In the context of a directed graph, we consider a node's successors as its neighbors. ","[WYF, ELW, VKL, UJY, ATZ]","Let's solve it step by step.
Node SCX connects to nodes [WYF, ELW, VKL, UJY, ATZ], so the neighbors of node SCX are ","('[[WYF, ATZ, SCX, VDS, ELW], [WYF, ELW, VKL, UJY, ATZ], [UJY, ELW, WYF, VKL], [VKL, VDS, ELW, UJY, WYF, ATZ, SCX]]',)",1,148
neighbor,"[(ADU, CVE), (ADU, EUS), (CVE, FCF), (EUS, KEJ), (FCF, FGH), (FCF, WYA), (FGH, SPB), (SPB, CWY), (CWY, SSS), (KEJ, TQD), (KEJ, SSS)]","{ADU: [CVE, EUS],
CVE: [ADU, FCF],
EUS: [ADU, KEJ],
FCF: [CVE, FGH, WYA],
FGH: [SPB, FCF],
SPB: [FGH, CWY],
CWY: [SPB, SSS],
WYA: [FCF],
KEJ: [TQD, SSS, EUS],
TQD: [KEJ],
SSS: [KEJ, CWY]}","Node ADU is connected to nodes CVE, EUS.
Node CVE is connected to nodes ADU, FCF.
Node EUS is connected to nodes ADU, KEJ.
Node FCF is connected to nodes CVE, FGH, WYA.
Node FGH is connected to nodes SPB, FCF.
Node SPB is connected to nodes FGH, CWY.
Node CWY is connected to nodes SPB, SSS.
Node WYA is connected to node FCF.
Node KEJ is connected to nodes TQD, SSS, EUS.
Node TQD is connected to node KEJ.
Node SSS is connected to nodes KEJ, CWY.","[WYA, CVE, FGH, FCF, SSS, EUS, TQD, ADU, KEJ, CWY, SPB]",11,11,False,Which are the neighbor nodes of node SPB? ,"[FGH, CWY]","Let's solve it step by step.
Node SPB connects to nodes [FGH, CWY], so the neighbors of node SPB are ","('[[], [TQD, FGH], [KEJ, FCF, CWY, CVE, WYA], [FGH, CWY]]',)",3,149
neighbor,"[(CJH, KII), (CJH, OTX), (CJH, WXD), (CJH, LRW), (KII, EFU), (KII, ZVN), (OTX, JQH), (OTX, BIH), (OTX, VFZ), (WXD, ZVN), (WXD, JQH), (WXD, VFZ), (LRW, VPB), (LRW, ZVN), (LRW, VFZ), (EFU, VPB), (EFU, VFZ), (ZVN, VPB), (ZVN, ZVI), (VPB, ZVI), (ZVI, BIH), (ZVI, JQH), (VFZ, JQH), (JQH, BIH)]","{CJH: [KII, OTX, WXD, LRW],
KII: [CJH, EFU, ZVN],
OTX: [CJH, JQH, BIH, VFZ],
WXD: [CJH, ZVN, JQH, VFZ],
LRW: [CJH, VPB, ZVN, VFZ],
EFU: [KII, VPB, VFZ],
ZVN: [KII, VPB, ZVI, WXD, LRW],
VPB: [EFU, ZVN, LRW, ZVI],
ZVI: [VPB, ZVN, BIH, JQH],
VFZ: [EFU, OTX, JQH, WXD, LRW],
JQH: [OTX, ZVI, BIH, WXD, VFZ],
BIH: [OTX, ZVI, JQH]}","Node CJH is connected to nodes KII, OTX, WXD, LRW.
Node KII is connected to nodes CJH, EFU, ZVN.
Node OTX is connected to nodes CJH, JQH, BIH, VFZ.
Node WXD is connected to nodes CJH, ZVN, JQH, VFZ.
Node LRW is connected to nodes CJH, VPB, ZVN, VFZ.
Node EFU is connected to nodes KII, VPB, VFZ.
Node ZVN is connected to nodes KII, VPB, ZVI, WXD, LRW.
Node VPB is connected to nodes EFU, ZVN, LRW, ZVI.
Node ZVI is connected to nodes VPB, ZVN, BIH, JQH.
Node VFZ is connected to nodes EFU, OTX, JQH, WXD, LRW.
Node JQH is connected to nodes OTX, ZVI, BIH, WXD, VFZ.
Node BIH is connected to nodes OTX, ZVI, JQH.","[WXD, VFZ, JQH, LRW, ZVI, ZVN, KII, OTX, VPB, EFU, BIH, CJH]",12,24,False,Which are the neighbor nodes of node EFU? ,"[KII, VPB, VFZ]","Let's solve it step by step.
Node EFU connects to nodes [KII, VPB, VFZ], so the neighbors of node EFU are ","('[[BIH, WXD, JQH], [KII, VPB, VFZ], [WXD, VPB, LRW, JQH], [WXD, EFU, JQH, OTX, VPB]]',)",1,150
neighbor,"[(AXT, VMG), (AXT, IUL), (AXT, UER), (AXT, OBN), (AXT, FTU), (AXT, ZJP), (UER, BRH), (OBN, QJO), (OBN, JCJ), (ZJP, ICY), (QJO, QFK)]","{AXT: [VMG, IUL, UER, OBN, FTU, ZJP],
VMG: [AXT],
IUL: [AXT],
UER: [AXT, BRH],
OBN: [AXT, QJO, JCJ],
FTU: [AXT],
ZJP: [AXT, ICY],
BRH: [UER],
QJO: [QFK, OBN],
QFK: [QJO],
JCJ: [OBN],
ICY: [ZJP]}","Node AXT is connected to nodes VMG, IUL, UER, OBN, FTU, ZJP.
Node VMG is connected to node AXT.
Node IUL is connected to node AXT.
Node UER is connected to nodes AXT, BRH.
Node OBN is connected to nodes AXT, QJO, JCJ.
Node FTU is connected to node AXT.
Node ZJP is connected to nodes AXT, ICY.
Node BRH is connected to node UER.
Node QJO is connected to nodes QFK, OBN.
Node QFK is connected to node QJO.
Node JCJ is connected to node OBN.
Node ICY is connected to node ZJP.","[VMG, ZJP, OBN, QFK, UER, IUL, QJO, BRH, ICY, JCJ, AXT, FTU]",12,11,False,Which are the neighbor nodes of node IUL? ,[AXT],"Let's solve it step by step.
Node IUL connects to nodes [AXT], so the neighbors of node IUL are ","('[[FTU, OBN, AXT, ZJP, QJO, QFK, ICY, JCJ], [JCJ, QFK, ICY, ZJP, QJO, IUL], [AXT], [FTU, BRH, UER, ZJP, QJO, OBN, AXT]]',)",2,151
neighbor,"[(HGI, WNV), (HGI, ONW), (HGI, QXZ), (WNV, QXZ), (ONW, QXZ), (ONW, DSO), (QXZ, ROM), (QXZ, VBY), (QXZ, DSO), (QXZ, TYB), (ROM, VBY), (DSO, TYB)]","{HGI: [WNV, ONW, QXZ],
WNV: [HGI, QXZ],
ONW: [HGI, QXZ, DSO],
QXZ: [HGI, WNV, ROM, VBY, DSO, TYB, ONW],
ROM: [VBY, QXZ],
VBY: [ROM, QXZ],
DSO: [QXZ, ONW, TYB],
TYB: [QXZ, DSO]}","Node HGI is connected to nodes WNV, ONW, QXZ.
Node WNV is connected to nodes HGI, QXZ.
Node ONW is connected to nodes HGI, QXZ, DSO.
Node QXZ is connected to nodes HGI, WNV, ROM, VBY, DSO, TYB, ONW.
Node ROM is connected to nodes VBY, QXZ.
Node VBY is connected to nodes ROM, QXZ.
Node DSO is connected to nodes QXZ, ONW, TYB.
Node TYB is connected to nodes QXZ, DSO.","[TYB, QXZ, DSO, VBY, ONW, HGI, WNV, ROM]",8,12,False,Which are the neighbor nodes of node HGI? ,"[WNV, ONW, QXZ]","Let's solve it step by step.
Node HGI connects to nodes [WNV, ONW, QXZ], so the neighbors of node HGI are ","('[[VBY, WNV, DSO, TYB, ROM, QXZ], [HGI, ROM, ONW, QXZ, WNV, VBY], [WNV, ONW, QXZ], [TYB, QXZ, HGI, ONW, ROM, WNV]]',)",2,152
neighbor,"[(QHY, MWV), (QHY, NKQ), (NKQ, DLM), (HBO, XKV), (HBO, IXN), (HBO, DLM), (HBO, JCC), (HBO, XHZ)]","{QHY: [MWV, NKQ],
MWV: [QHY],
NKQ: [QHY, DLM],
HBO: [XKV, IXN, DLM, JCC, XHZ],
XKV: [HBO],
IXN: [HBO],
DLM: [HBO, NKQ],
JCC: [HBO],
XHZ: [HBO]}","Node QHY is connected to nodes MWV, NKQ.
Node MWV is connected to node QHY.
Node NKQ is connected to nodes QHY, DLM.
Node HBO is connected to nodes XKV, IXN, DLM, JCC, XHZ.
Node XKV is connected to node HBO.
Node IXN is connected to node HBO.
Node DLM is connected to nodes HBO, NKQ.
Node JCC is connected to node HBO.
Node XHZ is connected to node HBO.","[QHY, JCC, XHZ, IXN, XKV, DLM, MWV, HBO, NKQ]",9,8,False,Which are the neighbor nodes of node DLM? ,"[HBO, NKQ]","Let's solve it step by step.
Node DLM connects to nodes [HBO, NKQ], so the neighbors of node DLM are ","('[[], [HBO, NKQ], [JCC], [IXN, XKV, JCC, NKQ, DLM, MWV, QHY, HBO]]',)",1,153
neighbor,"[(PFJ, RDY), (PFJ, FSH), (PFJ, KDK), (RDY, EWS), (RDY, VMP), (RDY, KDK), (RDY, YNM), (FSH, AIJ), (KDK, EWS), (KDK, VMP), (KDK, AIJ), (EWS, VMP), (EWS, YNM)]","{PFJ: [RDY, FSH, KDK],
RDY: [PFJ, EWS, VMP, KDK, YNM],
FSH: [PFJ, AIJ],
KDK: [PFJ, RDY, EWS, VMP, AIJ],
EWS: [RDY, VMP, KDK, YNM],
VMP: [RDY, EWS, KDK],
YNM: [RDY, EWS],
AIJ: [FSH, KDK]}","Node PFJ is connected to nodes RDY, FSH, KDK.
Node RDY is connected to nodes PFJ, EWS, VMP, KDK, YNM.
Node FSH is connected to nodes PFJ, AIJ.
Node KDK is connected to nodes PFJ, RDY, EWS, VMP, AIJ.
Node EWS is connected to nodes RDY, VMP, KDK, YNM.
Node VMP is connected to nodes RDY, EWS, KDK.
Node YNM is connected to nodes RDY, EWS.
Node AIJ is connected to nodes FSH, KDK.","[KDK, RDY, EWS, AIJ, PFJ, VMP, FSH, YNM]",8,13,False,Which are the neighbor nodes of node KDK? ,"[PFJ, RDY, EWS, VMP, AIJ]","Let's solve it step by step.
Node KDK connects to nodes [PFJ, RDY, EWS, VMP, AIJ], so the neighbors of node KDK are ","('[[PFJ, RDY, EWS, VMP, AIJ], [PFJ], [YNM, RDY, PFJ, EWS, AIJ], [AIJ, EWS]]',)",0,154
neighbor,"[(UCC, LAU), (UCC, ZLM), (UCC, TKU), (UCC, DTW), (UCC, XHF), (UCC, EOB), (UCC, LRD), (UCC, XPW), (TKU, GUY), (DTW, AJF), (XPW, OTS)]","{UCC: [LAU, ZLM, TKU, DTW, XHF, EOB, LRD, XPW],
LAU: [UCC],
ZLM: [UCC],
TKU: [UCC, GUY],
DTW: [UCC, AJF],
XHF: [UCC],
EOB: [UCC],
LRD: [UCC],
XPW: [UCC, OTS],
GUY: [TKU],
AJF: [DTW],
OTS: [XPW]}","Node UCC is connected to nodes LAU, ZLM, TKU, DTW, XHF, EOB, LRD, XPW.
Node LAU is connected to node UCC.
Node ZLM is connected to node UCC.
Node TKU is connected to nodes UCC, GUY.
Node DTW is connected to nodes UCC, AJF.
Node XHF is connected to node UCC.
Node EOB is connected to node UCC.
Node LRD is connected to node UCC.
Node XPW is connected to nodes UCC, OTS.
Node GUY is connected to node TKU.
Node AJF is connected to node DTW.
Node OTS is connected to node XPW.","[AJF, GUY, OTS, DTW, XHF, EOB, ZLM, LRD, UCC, XPW, TKU, LAU]",12,11,False,Which are the neighbor nodes of node AJF? ,[DTW],"Let's solve it step by step.
Node AJF connects to nodes [DTW], so the neighbors of node AJF are ","('[[LAU, TKU, LRD, DTW, XPW], [XPW, TKU, EOB, DTW], [LRD, LAU, AJF, GUY, EOB, OTS, DTW, UCC, ZLM, XHF], [DTW]]',)",3,155
neighbor,"[(MZV, EQV), (MZV, SDP), (MZV, QSP), (MZV, RZT), (MZV, BYN), (MZV, THV), (MZV, RRY), (MZV, WZI), (EQV, GKP), (EQV, BYN), (EQV, WZI), (SDP, QFK), (SDP, RRY), (SDP, YDW), (SDP, RZT), (SDP, GKP), (SDP, THV), (QSP, WZI), (QSP, BYN), (QSP, RZT), (RZT, QFK), (RZT, WZI), (RRY, QFK), (WZI, QFK), (WZI, YDW), (GKP, QFK), (QFK, YDW)]","{MZV: [EQV, SDP, QSP, RZT, BYN, THV, RRY, WZI],
EQV: [MZV, GKP, BYN, WZI],
SDP: [MZV, QFK, RRY, YDW, RZT, GKP, THV],
QSP: [MZV, WZI, BYN, RZT],
RZT: [MZV, SDP, QFK, QSP, WZI],
BYN: [MZV, EQV, QSP],
THV: [MZV, SDP],
RRY: [MZV, SDP, QFK],
WZI: [MZV, EQV, QFK, QSP, YDW, RZT],
GKP: [EQV, SDP, QFK],
QFK: [SDP, RRY, YDW, RZT, GKP, WZI],
YDW: [SDP, QFK, WZI]}","Node MZV is connected to nodes EQV, SDP, QSP, RZT, BYN, THV, RRY, WZI.
Node EQV is connected to nodes MZV, GKP, BYN, WZI.
Node SDP is connected to nodes MZV, QFK, RRY, YDW, RZT, GKP, THV.
Node QSP is connected to nodes MZV, WZI, BYN, RZT.
Node RZT is connected to nodes MZV, SDP, QFK, QSP, WZI.
Node BYN is connected to nodes MZV, EQV, QSP.
Node THV is connected to nodes MZV, SDP.
Node RRY is connected to nodes MZV, SDP, QFK.
Node WZI is connected to nodes MZV, EQV, QFK, QSP, YDW, RZT.
Node GKP is connected to nodes EQV, SDP, QFK.
Node QFK is connected to nodes SDP, RRY, YDW, RZT, GKP, WZI.
Node YDW is connected to nodes SDP, QFK, WZI.","[SDP, THV, MZV, YDW, RRY, RZT, EQV, GKP, QFK, QSP, BYN, WZI]",12,27,False,Which are the neighbor nodes of node SDP? ,"[MZV, QFK, RRY, YDW, RZT, GKP, THV]","Let's solve it step by step.
Node SDP connects to nodes [MZV, QFK, RRY, YDW, RZT, GKP, THV], so the neighbors of node SDP are ","('[[GKP, WZI, BYN, QFK, YDW, RZT, QSP, SDP, MZV, RRY, EQV], [YDW, SDP, EQV, WZI, GKP, BYN, MZV, RZT, QSP], [MZV, QFK, RRY, YDW, RZT, GKP, THV], [RRY]]',)",2,156
neighbor,"[(IMY, PKM), (IMY, LLF), (LLF, KFH), (LLF, TQX), (KFH, WTV), (TQX, EOX), (TQX, HZW), (TQX, ELP), (TQX, MBD), (HZW, TQD), (HZW, PFV), (TQD, HIJ)]","{IMY: [PKM, LLF],
PKM: [IMY],
LLF: [IMY, KFH, TQX],
KFH: [LLF, WTV],
TQX: [LLF, EOX, HZW, ELP, MBD],
EOX: [TQX],
HZW: [TQX, TQD, PFV],
ELP: [TQX],
MBD: [TQX],
TQD: [HIJ, HZW],
HIJ: [TQD],
PFV: [HZW],
WTV: [KFH]}","Node IMY is connected to nodes PKM, LLF.
Node PKM is connected to node IMY.
Node LLF is connected to nodes IMY, KFH, TQX.
Node KFH is connected to nodes LLF, WTV.
Node TQX is connected to nodes LLF, EOX, HZW, ELP, MBD.
Node EOX is connected to node TQX.
Node HZW is connected to nodes TQX, TQD, PFV.
Node ELP is connected to node TQX.
Node MBD is connected to node TQX.
Node TQD is connected to nodes HIJ, HZW.
Node HIJ is connected to node TQD.
Node PFV is connected to node HZW.
Node WTV is connected to node KFH.","[PFV, LLF, KFH, TQX, HZW, EOX, TQD, MBD, HIJ, PKM, WTV, IMY, ELP]",13,12,False,Which are the neighbor nodes of node HZW? ,"[TQX, TQD, PFV]","Let's solve it step by step.
Node HZW connects to nodes [TQX, TQD, PFV], so the neighbors of node HZW are ","('[[KFH, PKM, TQD, ELP, PFV, HZW, WTV, MBD, EOX, IMY], [ELP, IMY], [PFV, MBD, ELP, WTV, PKM, TQD, HIJ, EOX, IMY, HZW, LLF, TQX], [TQX, TQD, PFV]]',)",3,157
neighbor,"[(IVF, NKO), (IVF, UJV), (NKO, UJV), (UJV, SXJ), (SXJ, PMA), (PMA, RMM), (RMM, KHP), (OSZ, SQN), (OSZ, ZTI), (SQN, KHP)]","{IVF: [NKO, UJV],
NKO: [IVF, UJV],
UJV: [IVF, NKO, SXJ],
SXJ: [UJV, PMA],
PMA: [SXJ, RMM],
RMM: [PMA, KHP],
OSZ: [SQN, ZTI],
SQN: [OSZ, KHP],
ZTI: [OSZ],
KHP: [SQN, RMM]}","Node IVF is connected to nodes NKO, UJV.
Node NKO is connected to nodes IVF, UJV.
Node UJV is connected to nodes IVF, NKO, SXJ.
Node SXJ is connected to nodes UJV, PMA.
Node PMA is connected to nodes SXJ, RMM.
Node RMM is connected to nodes PMA, KHP.
Node OSZ is connected to nodes SQN, ZTI.
Node SQN is connected to nodes OSZ, KHP.
Node ZTI is connected to node OSZ.
Node KHP is connected to nodes SQN, RMM.","[PMA, UJV, NKO, SQN, KHP, ZTI, RMM, OSZ, IVF, SXJ]",10,10,False,Which are the neighbor nodes of node RMM? ,"[PMA, KHP]","Let's solve it step by step.
Node RMM connects to nodes [PMA, KHP], so the neighbors of node RMM are ","('[[PMA, KHP], [], [RMM, KHP, SQN], [KHP, RMM, OSZ]]',)",0,158
neighbor,"[(JUB, MPR), (JUB, SIF), (JUB, PCC), (JUB, MJX), (SIF, EFG), (EFG, LZO), (EFG, CFZ), (EFG, YTE), (EFG, NOB), (EFG, GBS), (EFG, QXK), (EFG, RVH), (EFG, IGC)]","{JUB: [MPR, SIF, PCC, MJX],
MPR: [JUB],
SIF: [JUB, EFG],
PCC: [JUB],
MJX: [JUB],
EFG: [LZO, CFZ, YTE, SIF, NOB, GBS, QXK, RVH, IGC],
LZO: [EFG],
CFZ: [EFG],
YTE: [EFG],
NOB: [EFG],
GBS: [EFG],
QXK: [EFG],
RVH: [EFG],
IGC: [EFG]}","Node JUB is connected to nodes MPR, SIF, PCC, MJX.
Node MPR is connected to node JUB.
Node SIF is connected to nodes JUB, EFG.
Node PCC is connected to node JUB.
Node MJX is connected to node JUB.
Node EFG is connected to nodes LZO, CFZ, YTE, SIF, NOB, GBS, QXK, RVH, IGC.
Node LZO is connected to node EFG.
Node CFZ is connected to node EFG.
Node YTE is connected to node EFG.
Node NOB is connected to node EFG.
Node GBS is connected to node EFG.
Node QXK is connected to node EFG.
Node RVH is connected to node EFG.
Node IGC is connected to node EFG.","[QXK, EFG, LZO, CFZ, MJX, GBS, MPR, JUB, IGC, YTE, SIF, PCC, NOB, RVH]",14,13,False,Which are the neighbor nodes of node MPR? ,[JUB],"Let's solve it step by step.
Node MPR connects to nodes [JUB], so the neighbors of node MPR are ","('[[PCC, MJX, LZO, EFG, GBS, NOB, IGC], [SIF, MPR, MJX, NOB, YTE, QXK], [JUB], [MJX, RVH, JUB, MPR, YTE, CFZ, PCC]]',)",2,159
