task,graph,graph_adj,graph_nl,nodes,num_nodes,num_edges,directed,question,answer,steps,choices,label,id
neighbor,"[(PPL, HVY), (PPL, KGL), (PPL, BYF), (PPL, ETH), (PPL, ZEJ), (PPL, ZTA), (PPL, EMS), (HVY, BYF), (HVY, BER), (HVY, FPY), (HVY, SMJ), (KGL, MMQ), (KGL, BYF), (KGL, ZTA), (KGL, EMS), (KGL, SMJ), (BYF, MMQ), (BYF, EOU), (BYF, ETH), (BYF, BER), (BYF, FPY), (BYF, ZTA), (BYF, EMS), (ETH, MMQ), (ETH, EOU), (ETH, BER), (ETH, SMJ), (ZEJ, VDN), (ZEJ, MMQ), (ZEJ, BER), (ZEJ, EMS), (ZTA, VDN), (ZTA, EOU), (ZTA, FPY), (ZTA, EMS), (ZTA, SMJ), (EMS, MMQ), (EMS, BER), (EMS, SMJ), (VDN, EOU), (VDN, BER), (VDN, FPY), (VDN, SMJ), (BER, MMQ), (BER, SMJ), (FPY, MMQ), (SMJ, MMQ)]","{PPL: [HVY, KGL, BYF, ETH, ZEJ, ZTA, EMS],
HVY: [PPL, BYF, BER, FPY, SMJ],
KGL: [PPL, MMQ, BYF, ZTA, EMS, SMJ],
BYF: [PPL, MMQ, HVY, EOU, KGL, ETH, BER, FPY, ZTA, EMS],
ETH: [PPL, MMQ, EOU, BYF, BER, SMJ],
ZEJ: [PPL, VDN, MMQ, BER, EMS],
ZTA: [PPL, VDN, EOU, KGL, BYF, FPY, EMS, SMJ],
EMS: [PPL, MMQ, KGL, BYF, ZEJ, BER, ZTA, SMJ],
VDN: [EOU, ZEJ, BER, FPY, ZTA, SMJ],
EOU: [VDN, BYF, ETH, ZTA],
BER: [VDN, MMQ, HVY, BYF, ETH, ZEJ, EMS, SMJ],
FPY: [VDN, MMQ, HVY, BYF, ZTA],
SMJ: [VDN, MMQ, HVY, KGL, ETH, BER, ZTA, EMS],
MMQ: [KGL, BYF, ETH, ZEJ, BER, FPY, EMS, SMJ]}","Node PPL is connected to nodes HVY, KGL, BYF, ETH, ZEJ, ZTA, EMS.
Node HVY is connected to nodes PPL, BYF, BER, FPY, SMJ.
Node KGL is connected to nodes PPL, MMQ, BYF, ZTA, EMS, SMJ.
Node BYF is connected to nodes PPL, MMQ, HVY, EOU, KGL, ETH, BER, FPY, ZTA, EMS.
Node ETH is connected to nodes PPL, MMQ, EOU, BYF, BER, SMJ.
Node ZEJ is connected to nodes PPL, VDN, MMQ, BER, EMS.
Node ZTA is connected to nodes PPL, VDN, EOU, KGL, BYF, FPY, EMS, SMJ.
Node EMS is connected to nodes PPL, MMQ, KGL, BYF, ZEJ, BER, ZTA, SMJ.
Node VDN is connected to nodes EOU, ZEJ, BER, FPY, ZTA, SMJ.
Node EOU is connected to nodes VDN, BYF, ETH, ZTA.
Node BER is connected to nodes VDN, MMQ, HVY, BYF, ETH, ZEJ, EMS, SMJ.
Node FPY is connected to nodes VDN, MMQ, HVY, BYF, ZTA.
Node SMJ is connected to nodes VDN, MMQ, HVY, KGL, ETH, BER, ZTA, EMS.
Node MMQ is connected to nodes KGL, BYF, ETH, ZEJ, BER, FPY, EMS, SMJ.","[PPL, KGL, MMQ, SMJ, EOU, EMS, VDN, ZTA, BYF, HVY, BER, ETH, ZEJ, FPY]",14,47,False,Which are the neighbor nodes of node PPL? ,"[HVY, KGL, BYF, ETH, ZEJ, ZTA, EMS]","Let's solve it step by step.
Node PPL connects to nodes [HVY, KGL, BYF, ETH, ZEJ, ZTA, EMS], so the neighbors of node PPL are ","('[[], [EMS, BER, ZEJ, VDN, PPL, MMQ, BYF, HVY, ZTA, ETH, KGL, EOU], [PPL, ETH, BYF, ZEJ, EMS, SMJ, FPY, ZTA, MMQ, HVY, EOU, VDN], [HVY, KGL, BYF, ETH, ZEJ, ZTA, EMS]]',)",3,64
neighbor,"[(VNU, QTB), (VNU, RCD), (VNU, FUN), (VNU, LHQ), (VNU, HRC), (VNU, ZCJ), (VNU, CTC), (VNU, LAH), (VNU, WDE), (VNU, PNN), (VNU, IJQ), (VNU, OMD), (QTB, RCD), (QTB, FUN), (QTB, LHQ), (QTB, HRC), (QTB, ZCJ), (QTB, CTC), (QTB, WDE), (QTB, IJQ), (QTB, OMD), (RCD, PZF), (RCD, LHQ), (RCD, HRC), (RCD, ZCJ), (RCD, CTC), (RCD, LAH), (RCD, PNN), (RCD, OMD), (FUN, PZF), (FUN, LHQ), (FUN, HRC), (FUN, CTC), (FUN, LAH), (FUN, WDE), (FUN, PNN), (FUN, IJQ), (FUN, OMD), (LHQ, PZF), (LHQ, LAH), (LHQ, WDE), (LHQ, PNN), (LHQ, IJQ), (LHQ, OMD), (HRC, CTC), (HRC, LAH), (HRC, WDE), (HRC, PNN), (HRC, IJQ), (ZCJ, PZF), (ZCJ, LAH), (ZCJ, WDE), (ZCJ, PNN), (ZCJ, IJQ), (CTC, PZF), (CTC, LAH), (CTC, WDE), (CTC, PNN), (CTC, IJQ), (CTC, OMD), (LAH, PZF), (LAH, PNN), (LAH, IJQ), (LAH, OMD), (WDE, PZF), (WDE, PNN), (WDE, IJQ), (WDE, OMD), (PNN, PZF), (IJQ, PZF), (IJQ, OMD)]","{VNU: [QTB, RCD, FUN, LHQ, HRC, ZCJ, CTC, LAH, WDE, PNN, IJQ, OMD],
QTB: [VNU, RCD, FUN, LHQ, HRC, ZCJ, CTC, WDE, IJQ, OMD],
RCD: [VNU, QTB, PZF, LHQ, HRC, ZCJ, CTC, LAH, PNN, OMD],
FUN: [VNU, QTB, PZF, LHQ, HRC, CTC, LAH, WDE, PNN, IJQ, OMD],
LHQ: [VNU, QTB, RCD, FUN, PZF, LAH, WDE, PNN, IJQ, OMD],
HRC: [VNU, QTB, RCD, FUN, CTC, LAH, WDE, PNN, IJQ],
ZCJ: [VNU, QTB, RCD, PZF, LAH, WDE, PNN, IJQ],
CTC: [VNU, QTB, RCD, FUN, PZF, HRC, LAH, WDE, PNN, IJQ, OMD],
LAH: [VNU, RCD, FUN, PZF, LHQ, HRC, ZCJ, CTC, PNN, IJQ, OMD],
WDE: [VNU, QTB, FUN, PZF, LHQ, HRC, ZCJ, CTC, PNN, IJQ, OMD],
PNN: [VNU, RCD, FUN, PZF, LHQ, HRC, ZCJ, CTC, LAH, WDE],
IJQ: [VNU, QTB, FUN, PZF, LHQ, HRC, ZCJ, CTC, LAH, WDE, OMD],
OMD: [VNU, QTB, RCD, FUN, LHQ, CTC, LAH, WDE, IJQ],
PZF: [RCD, FUN, LHQ, ZCJ, CTC, LAH, WDE, PNN, IJQ]}","Node VNU is connected to nodes QTB, RCD, FUN, LHQ, HRC, ZCJ, CTC, LAH, WDE, PNN, IJQ, OMD.
Node QTB is connected to nodes VNU, RCD, FUN, LHQ, HRC, ZCJ, CTC, WDE, IJQ, OMD.
Node RCD is connected to nodes VNU, QTB, PZF, LHQ, HRC, ZCJ, CTC, LAH, PNN, OMD.
Node FUN is connected to nodes VNU, QTB, PZF, LHQ, HRC, CTC, LAH, WDE, PNN, IJQ, OMD.
Node LHQ is connected to nodes VNU, QTB, RCD, FUN, PZF, LAH, WDE, PNN, IJQ, OMD.
Node HRC is connected to nodes VNU, QTB, RCD, FUN, CTC, LAH, WDE, PNN, IJQ.
Node ZCJ is connected to nodes VNU, QTB, RCD, PZF, LAH, WDE, PNN, IJQ.
Node CTC is connected to nodes VNU, QTB, RCD, FUN, PZF, HRC, LAH, WDE, PNN, IJQ, OMD.
Node LAH is connected to nodes VNU, RCD, FUN, PZF, LHQ, HRC, ZCJ, CTC, PNN, IJQ, OMD.
Node WDE is connected to nodes VNU, QTB, FUN, PZF, LHQ, HRC, ZCJ, CTC, PNN, IJQ, OMD.
Node PNN is connected to nodes VNU, RCD, FUN, PZF, LHQ, HRC, ZCJ, CTC, LAH, WDE.
Node IJQ is connected to nodes VNU, QTB, FUN, PZF, LHQ, HRC, ZCJ, CTC, LAH, WDE, OMD.
Node OMD is connected to nodes VNU, QTB, RCD, FUN, LHQ, CTC, LAH, WDE, IJQ.
Node PZF is connected to nodes RCD, FUN, LHQ, ZCJ, CTC, LAH, WDE, PNN, IJQ.","[PZF, LHQ, LAH, VNU, OMD, ZCJ, CTC, RCD, IJQ, PNN, FUN, QTB, HRC, WDE]",14,71,False,Which are the neighbor nodes of node QTB? ,"[VNU, RCD, FUN, LHQ, HRC, ZCJ, CTC, WDE, IJQ, OMD]","Let's solve it step by step.
Node QTB connects to nodes [VNU, RCD, FUN, LHQ, HRC, ZCJ, CTC, WDE, IJQ, OMD], so the neighbors of node QTB are ","('[[VNU, RCD, FUN, LHQ, HRC, ZCJ, CTC, WDE, IJQ, OMD], [LAH, CTC], [], [FUN]]',)",0,65
neighbor,"[(KXE, JVW), (KXE, WDO), (JVW, JTT), (JVW, RUD), (WDO, QVV), (WDO, WJF), (WDO, JVW), (QVV, XQH), (XQH, WDO), (XQH, ZOL), (XQH, DTN), (XQH, BLE), (XQH, JTT), (YVC, BLE), (YVC, AXT), (YVC, RUD), (YVC, XQH), (BLE, TVC), (BLE, WDO), (BLE, KXE), (AXT, JOL), (RUD, WDO), (RUD, DTN), (RUD, JOL), (RUD, WJF), (TVC, JOL), (TVC, ZOL), (TVC, DTN), (TVC, YVC), (JOL, RUD), (ZOL, DTN), (ZOL, JOL), (ZOL, WJF), (ZOL, JVW), (ZOL, XQH), (JTT, DTN), (JTT, BLE), (WJF, AXT), (WJF, ZOL), (WJF, DTN), (WJF, KXE), (WJF, BLE)]","{KXE: [JVW, WDO],
JVW: [JTT, RUD],
WDO: [QVV, WJF, JVW],
QVV: [XQH],
XQH: [WDO, ZOL, DTN, BLE, JTT],
YVC: [BLE, AXT, RUD, XQH],
BLE: [TVC, WDO, KXE],
AXT: [JOL],
RUD: [WDO, DTN, JOL, WJF],
TVC: [JOL, ZOL, DTN, YVC],
JOL: [RUD],
ZOL: [DTN, JOL, WJF, JVW, XQH],
DTN: [],
JTT: [DTN, BLE],
WJF: [AXT, ZOL, DTN, KXE, BLE]}","Node KXE is connected to nodes JVW, WDO.
Node JVW is connected to nodes JTT, RUD.
Node WDO is connected to nodes QVV, WJF, JVW.
Node QVV is connected to node XQH.
Node XQH is connected to nodes WDO, ZOL, DTN, BLE, JTT.
Node YVC is connected to nodes BLE, AXT, RUD, XQH.
Node BLE is connected to nodes TVC, WDO, KXE.
Node AXT is connected to node JOL.
Node RUD is connected to nodes WDO, DTN, JOL, WJF.
Node TVC is connected to nodes JOL, ZOL, DTN, YVC.
Node JOL is connected to node RUD.
Node ZOL is connected to nodes DTN, JOL, WJF, JVW, XQH.
Node JTT is connected to nodes DTN, BLE.
Node WJF is connected to nodes AXT, ZOL, DTN, KXE, BLE.","[DTN, WJF, YVC, KXE, XQH, BLE, TVC, ZOL, JVW, JTT, QVV, WDO, AXT, JOL, RUD]",15,42,True,"Which are the neighbor nodes of node WJF? In the context of a directed graph, we consider a node's successors as its neighbors. ","[AXT, ZOL, DTN, KXE, BLE]","Let's solve it step by step.
Node WJF connects to nodes [AXT, ZOL, DTN, KXE, BLE], so the neighbors of node WJF are ","('[[], [AXT, ZOL, DTN, KXE, BLE], [AXT, ZOL, KXE, RUD, DTN, YVC, JVW, XQH, WDO, QVV, TVC, BLE], [RUD, QVV, ZOL, AXT, WJF, JVW, DTN, YVC, JTT, BLE, XQH]]',)",1,66
neighbor,"[(KZD, ZPM), (KZD, PBS), (KZD, BWS), (KZD, PEN), (KZD, YSQ), (ZPM, PBS), (ZPM, LNC), (ZPM, HLN), (ZPM, PEN), (PBS, MKN), (PBS, PEN), (PBS, KZD), (BWS, FOF), (BWS, MKN), (BWS, PEN), (BWS, MME), (PEN, ROS), (PEN, MME), (PEN, KZD), (PEN, HLN), (YSQ, BWS), (LNC, GLK), (LNC, MKN), (LNC, ROS), (LNC, PBS), (LNC, FOF), (HLN, MKN), (HLN, ROS), (HLN, KZD), (HLN, FOF), (MKN, ROS), (FOF, YSQ), (MME, KZD), (MME, PBS), (MME, GLK), (MME, MKN), (MME, ROS), (GLK, KZD), (GLK, LNC), (GLK, HLN), (ROS, KZD), (ROS, BWS), (ROS, HLN), (ROS, GLK), (ROS, PEN)]","{KZD: [ZPM, PBS, BWS, PEN, YSQ],
ZPM: [PBS, LNC, HLN, PEN],
PBS: [MKN, PEN, KZD],
BWS: [FOF, MKN, PEN, MME],
PEN: [ROS, MME, KZD, HLN],
YSQ: [BWS],
LNC: [GLK, MKN, ROS, PBS, FOF],
HLN: [MKN, ROS, KZD, FOF],
MKN: [ROS],
FOF: [YSQ],
MME: [KZD, PBS, GLK, MKN, ROS],
GLK: [KZD, LNC, HLN],
ROS: [KZD, BWS, HLN, GLK, PEN]}","Node KZD is connected to nodes ZPM, PBS, BWS, PEN, YSQ.
Node ZPM is connected to nodes PBS, LNC, HLN, PEN.
Node PBS is connected to nodes MKN, PEN, KZD.
Node BWS is connected to nodes FOF, MKN, PEN, MME.
Node PEN is connected to nodes ROS, MME, KZD, HLN.
Node YSQ is connected to node BWS.
Node LNC is connected to nodes GLK, MKN, ROS, PBS, FOF.
Node HLN is connected to nodes MKN, ROS, KZD, FOF.
Node MKN is connected to node ROS.
Node FOF is connected to node YSQ.
Node MME is connected to nodes KZD, PBS, GLK, MKN, ROS.
Node GLK is connected to nodes KZD, LNC, HLN.
Node ROS is connected to nodes KZD, BWS, HLN, GLK, PEN.","[ZPM, KZD, BWS, HLN, MKN, FOF, GLK, YSQ, PEN, MME, ROS, PBS, LNC]",13,45,True,"Which are the neighbor nodes of node LNC? In the context of a directed graph, we consider a node's successors as its neighbors. ","[GLK, MKN, ROS, PBS, FOF]","Let's solve it step by step.
Node LNC connects to nodes [GLK, MKN, ROS, PBS, FOF], so the neighbors of node LNC are ","('[[HLN, MME, YSQ, ROS, LNC, PEN, ZPM, MKN, PBS, FOF], [GLK, MKN, ROS, PBS, FOF], [ROS, MME], [ROS, MKN, KZD, HLN, LNC, BWS, GLK, YSQ, PBS, PEN, FOF, ZPM]]',)",1,67
neighbor,"[(VNK, KTP), (VNK, ZAX), (VNK, HLO), (VNK, WGQ), (VNK, ZVC), (VNK, WEJ), (VNK, QAH), (VNK, SSY), (VNK, OCN), (VNK, TLU), (VNK, BAR), (KTP, BAR), (KTP, TLU), (KTP, WGQ), (ZAX, TLU), (ZAX, BAR), (HLO, ZVC), (HLO, BAR), (WGQ, ZVC), (ZVC, TLU), (ZVC, BAR), (ZVC, OCN), (WEJ, BAR), (QAH, TLU), (QAH, OCN), (OCN, TLU), (TLU, BAR)]","{VNK: [KTP, ZAX, HLO, WGQ, ZVC, WEJ, QAH, SSY, OCN, TLU, BAR],
KTP: [VNK, BAR, TLU, WGQ],
ZAX: [VNK, TLU, BAR],
HLO: [VNK, ZVC, BAR],
WGQ: [VNK, KTP, ZVC],
ZVC: [VNK, TLU, HLO, BAR, WGQ, OCN],
WEJ: [VNK, BAR],
QAH: [VNK, TLU, OCN],
SSY: [VNK],
OCN: [VNK, TLU, ZVC, QAH],
TLU: [VNK, KTP, ZAX, QAH, OCN, BAR, ZVC],
BAR: [VNK, KTP, TLU, ZAX, HLO, WEJ, ZVC]}","Node VNK is connected to nodes KTP, ZAX, HLO, WGQ, ZVC, WEJ, QAH, SSY, OCN, TLU, BAR.
Node KTP is connected to nodes VNK, BAR, TLU, WGQ.
Node ZAX is connected to nodes VNK, TLU, BAR.
Node HLO is connected to nodes VNK, ZVC, BAR.
Node WGQ is connected to nodes VNK, KTP, ZVC.
Node ZVC is connected to nodes VNK, TLU, HLO, BAR, WGQ, OCN.
Node WEJ is connected to nodes VNK, BAR.
Node QAH is connected to nodes VNK, TLU, OCN.
Node SSY is connected to node VNK.
Node OCN is connected to nodes VNK, TLU, ZVC, QAH.
Node TLU is connected to nodes VNK, KTP, ZAX, QAH, OCN, BAR, ZVC.
Node BAR is connected to nodes VNK, KTP, TLU, ZAX, HLO, WEJ, ZVC.","[BAR, QAH, OCN, VNK, WEJ, TLU, ZAX, ZVC, WGQ, KTP, SSY, HLO]",12,27,False,Which are the neighbor nodes of node OCN? ,"[VNK, TLU, ZVC, QAH]","Let's solve it step by step.
Node OCN connects to nodes [VNK, TLU, ZVC, QAH], so the neighbors of node OCN are ","('[[OCN, ZAX, VNK, BAR, TLU, WGQ, HLO, KTP, QAH, WEJ, ZVC], [VNK, TLU, ZVC, QAH], [QAH, TLU, VNK, KTP, HLO, BAR, WGQ, SSY, ZAX, OCN], [KTP, TLU, OCN, VNK, QAH, ZVC, SSY, WEJ, ZAX]]',)",1,68
neighbor,"[(ANM, TDT), (ANM, IEE), (ANM, GAW), (ANM, SVW), (TDT, IRY), (TDT, GAW), (TDT, KCL), (IEE, GAW), (IEE, KCL), (GAW, LRJ), (GAW, JQE), (GAW, IEV), (SVW, LRJ), (SVW, JQE), (IRY, KCL), (IRY, WWU), (IRY, JWW), (IRY, IEV), (JQE, JWW), (JQE, WWU)]","{ANM: [TDT, IEE, GAW, SVW],
TDT: [ANM, IRY, GAW, KCL],
IEE: [ANM, GAW, KCL],
GAW: [ANM, TDT, LRJ, JQE, IEV, IEE],
SVW: [ANM, LRJ, JQE],
IRY: [TDT, KCL, WWU, JWW, IEV],
KCL: [TDT, IEE, IRY],
LRJ: [GAW, SVW],
JQE: [GAW, SVW, JWW, WWU],
IEV: [GAW, IRY],
WWU: [IRY, JQE],
JWW: [IRY, JQE]}","Node ANM is connected to nodes TDT, IEE, GAW, SVW.
Node TDT is connected to nodes ANM, IRY, GAW, KCL.
Node IEE is connected to nodes ANM, GAW, KCL.
Node GAW is connected to nodes ANM, TDT, LRJ, JQE, IEV, IEE.
Node SVW is connected to nodes ANM, LRJ, JQE.
Node IRY is connected to nodes TDT, KCL, WWU, JWW, IEV.
Node KCL is connected to nodes TDT, IEE, IRY.
Node LRJ is connected to nodes GAW, SVW.
Node JQE is connected to nodes GAW, SVW, JWW, WWU.
Node IEV is connected to nodes GAW, IRY.
Node WWU is connected to nodes IRY, JQE.
Node JWW is connected to nodes IRY, JQE.","[IRY, GAW, JQE, IEV, SVW, IEE, JWW, KCL, TDT, WWU, LRJ, ANM]",12,20,False,Which are the neighbor nodes of node TDT? ,"[ANM, IRY, GAW, KCL]","Let's solve it step by step.
Node TDT connects to nodes [ANM, IRY, GAW, KCL], so the neighbors of node TDT are ","('[[GAW, TDT, ANM, WWU, SVW, JQE, KCL], [JWW, LRJ, ANM, GAW, IEV, WWU], [IEV, GAW, LRJ], [ANM, IRY, GAW, KCL]]',)",3,69
neighbor,"[(DQO, NJR), (DQO, JDW), (DQO, VIB), (NJR, FPT), (NJR, VIB), (NJR, SNX), (NJR, MWX), (JDW, FPT), (JDW, JBA), (JDW, DYE), (VIB, DYE), (VIB, MWX), (VIB, COG), (FPT, JBA), (FPT, DYE), (FPT, SNX), (SNX, MWX), (MWX, WAY), (JBA, DYE), (JBA, WAY), (JBA, ZZQ), (JBA, COG), (DYE, LFJ), (DYE, YLV), (LFJ, YLV), (YLV, WAY), (YLV, COG), (COG, ZZQ)]","{DQO: [NJR, JDW, VIB],
NJR: [DQO, FPT, VIB, SNX, MWX],
JDW: [DQO, FPT, JBA, DYE],
VIB: [DQO, NJR, DYE, MWX, COG],
FPT: [NJR, JDW, JBA, DYE, SNX],
SNX: [NJR, FPT, MWX],
MWX: [NJR, WAY, VIB, SNX],
JBA: [JDW, FPT, DYE, WAY, ZZQ, COG],
DYE: [JDW, FPT, LFJ, JBA, YLV, VIB],
LFJ: [DYE, YLV],
YLV: [DYE, LFJ, WAY, COG],
WAY: [MWX, YLV, JBA],
COG: [YLV, VIB, ZZQ, JBA],
ZZQ: [JBA, COG]}","Node DQO is connected to nodes NJR, JDW, VIB.
Node NJR is connected to nodes DQO, FPT, VIB, SNX, MWX.
Node JDW is connected to nodes DQO, FPT, JBA, DYE.
Node VIB is connected to nodes DQO, NJR, DYE, MWX, COG.
Node FPT is connected to nodes NJR, JDW, JBA, DYE, SNX.
Node SNX is connected to nodes NJR, FPT, MWX.
Node MWX is connected to nodes NJR, WAY, VIB, SNX.
Node JBA is connected to nodes JDW, FPT, DYE, WAY, ZZQ, COG.
Node DYE is connected to nodes JDW, FPT, LFJ, JBA, YLV, VIB.
Node LFJ is connected to nodes DYE, YLV.
Node YLV is connected to nodes DYE, LFJ, WAY, COG.
Node WAY is connected to nodes MWX, YLV, JBA.
Node COG is connected to nodes YLV, VIB, ZZQ, JBA.
Node ZZQ is connected to nodes JBA, COG.","[LFJ, DYE, NJR, ZZQ, JDW, DQO, JBA, VIB, YLV, COG, FPT, MWX, WAY, SNX]",14,28,False,Which are the neighbor nodes of node DQO? ,"[NJR, JDW, VIB]","Let's solve it step by step.
Node DQO connects to nodes [NJR, JDW, VIB], so the neighbors of node DQO are ","('[[COG, SNX, DYE, LFJ, YLV, WAY, JDW, VIB, ZZQ, FPT], [NJR, JDW, VIB], [COG, ZZQ, NJR], [LFJ, FPT, WAY, SNX, COG, JBA, NJR]]',)",1,70
neighbor,"[(RDE, JMC), (RDE, NWQ), (RDE, DWJ), (RDE, UVB), (RDE, ZUD), (JMC, OPM), (JMC, NWQ), (NWQ, ZUD), (NWQ, DWJ), (NWQ, VXE), (NWQ, PFS), (NWQ, OPM), (NWQ, OWC), (NWQ, HOE), (DWJ, ZUD), (UVB, OWC), (UVB, OPM), (ZUD, OWC), (OPM, VXE), (OPM, HOE), (OPM, PFS), (OWC, VXE), (OWC, PFS), (OWC, HOE)]","{RDE: [JMC, NWQ, DWJ, UVB, ZUD],
JMC: [RDE, OPM, NWQ],
NWQ: [RDE, JMC, ZUD, DWJ, VXE, PFS, OPM, OWC, HOE],
DWJ: [RDE, ZUD, NWQ],
UVB: [RDE, OWC, OPM],
ZUD: [RDE, DWJ, OWC, NWQ],
OPM: [JMC, NWQ, VXE, UVB, HOE, PFS],
OWC: [ZUD, NWQ, VXE, PFS, UVB, HOE],
VXE: [NWQ, OWC, OPM],
PFS: [NWQ, OWC, OPM],
HOE: [NWQ, OWC, OPM]}","Node RDE is connected to nodes JMC, NWQ, DWJ, UVB, ZUD.
Node JMC is connected to nodes RDE, OPM, NWQ.
Node NWQ is connected to nodes RDE, JMC, ZUD, DWJ, VXE, PFS, OPM, OWC, HOE.
Node DWJ is connected to nodes RDE, ZUD, NWQ.
Node UVB is connected to nodes RDE, OWC, OPM.
Node ZUD is connected to nodes RDE, DWJ, OWC, NWQ.
Node OPM is connected to nodes JMC, NWQ, VXE, UVB, HOE, PFS.
Node OWC is connected to nodes ZUD, NWQ, VXE, PFS, UVB, HOE.
Node VXE is connected to nodes NWQ, OWC, OPM.
Node PFS is connected to nodes NWQ, OWC, OPM.
Node HOE is connected to nodes NWQ, OWC, OPM.","[HOE, DWJ, JMC, ZUD, OPM, VXE, OWC, RDE, UVB, PFS, NWQ]",11,24,False,Which are the neighbor nodes of node VXE? ,"[NWQ, OWC, OPM]","Let's solve it step by step.
Node VXE connects to nodes [NWQ, OWC, OPM], so the neighbors of node VXE are ","('[[VXE, DWJ, ZUD, JMC, NWQ], [HOE, PFS, VXE, OWC, RDE, ZUD, NWQ, OPM, JMC], [NWQ, OWC, OPM], [PFS, RDE, OWC, DWJ, HOE, NWQ, JMC, OPM]]',)",2,71
neighbor,"[(IBS, IBW), (IBS, GDN), (IBS, PBE), (IBS, EXA), (IBS, JLI), (IBS, EPD), (IBS, LKR), (IBW, LKR), (IBW, MOH), (GDN, LKR), (GDN, MOH), (GDN, PBE), (GDN, JLI), (GDN, EXA), (GDN, GRQ), (EXA, EPD)]","{IBS: [IBW, GDN, PBE, EXA, JLI, EPD, LKR],
IBW: [IBS, LKR, MOH],
GDN: [IBS, LKR, MOH, PBE, JLI, EXA, GRQ],
PBE: [IBS, GDN],
EXA: [IBS, GDN, EPD],
JLI: [IBS, GDN],
EPD: [IBS, EXA],
LKR: [IBS, IBW, GDN],
MOH: [IBW, GDN],
GRQ: [GDN]}","Node IBS is connected to nodes IBW, GDN, PBE, EXA, JLI, EPD, LKR.
Node IBW is connected to nodes IBS, LKR, MOH.
Node GDN is connected to nodes IBS, LKR, MOH, PBE, JLI, EXA, GRQ.
Node PBE is connected to nodes IBS, GDN.
Node EXA is connected to nodes IBS, GDN, EPD.
Node JLI is connected to nodes IBS, GDN.
Node EPD is connected to nodes IBS, EXA.
Node LKR is connected to nodes IBS, IBW, GDN.
Node MOH is connected to nodes IBW, GDN.
Node GRQ is connected to node GDN.","[MOH, EPD, GRQ, IBW, GDN, JLI, PBE, IBS, LKR, EXA]",10,16,False,Which are the neighbor nodes of node EPD? ,"[IBS, EXA]","Let's solve it step by step.
Node EPD connects to nodes [IBS, EXA], so the neighbors of node EPD are ","('[[EPD, IBW, GDN, EXA, IBS, PBE, JLI], [IBS, EXA], [], [GDN, LKR, PBE, MOH, JLI, IBS, EPD, IBW]]',)",1,72
neighbor,"[(FMR, DWN), (FMR, HQY), (FMR, VDP), (DWN, VDP), (DWN, CYR), (HQY, JFU), (HQY, DWN), (HQY, XOT), (VDP, CYR), (VDP, JFU), (VDP, HQY), (JFU, DWN), (JFU, HQY), (CYR, JFU), (CYR, ZNY), (CYR, VDP), (XOT, VDP), (ZNY, VDP), (ZNY, JFU)]","{FMR: [DWN, HQY, VDP],
DWN: [VDP, CYR],
HQY: [JFU, DWN, XOT],
VDP: [CYR, JFU, HQY],
JFU: [DWN, HQY],
CYR: [JFU, ZNY, VDP],
XOT: [VDP],
ZNY: [VDP, JFU]}","Node FMR is connected to nodes DWN, HQY, VDP.
Node DWN is connected to nodes VDP, CYR.
Node HQY is connected to nodes JFU, DWN, XOT.
Node VDP is connected to nodes CYR, JFU, HQY.
Node JFU is connected to nodes DWN, HQY.
Node CYR is connected to nodes JFU, ZNY, VDP.
Node XOT is connected to node VDP.
Node ZNY is connected to nodes VDP, JFU.","[CYR, JFU, DWN, HQY, ZNY, VDP, XOT, FMR]",8,19,True,"Which are the neighbor nodes of node FMR? In the context of a directed graph, we consider a node's successors as its neighbors. ","[DWN, HQY, VDP]","Let's solve it step by step.
Node FMR connects to nodes [DWN, HQY, VDP], so the neighbors of node FMR are ","('[[DWN, HQY, VDP], [HQY, DWN, FMR], [VDP, CYR, DWN, ZNY, HQY, XOT, FMR], [JFU, XOT, CYR, ZNY, HQY, DWN]]',)",0,73
neighbor,"[(CBX, PBZ), (CBX, QOZ), (CBX, PUN), (CBX, DEY), (PBZ, QOZ), (PBZ, ZZJ), (PBZ, QNV), (PUN, ZZJ), (PUN, MBG), (DEY, IGT), (DEY, XUP), (DEY, MBG), (ZZJ, IGT), (ZZJ, MBG), (ZZJ, QNV), (QNV, IGT), (QNV, XUP), (QNV, MBG), (IGT, XUP), (IGT, MBG)]","{CBX: [PBZ, QOZ, PUN, DEY],
PBZ: [CBX, QOZ, ZZJ, QNV],
QOZ: [CBX, PBZ],
PUN: [CBX, ZZJ, MBG],
DEY: [CBX, IGT, XUP, MBG],
ZZJ: [PBZ, IGT, PUN, MBG, QNV],
QNV: [PBZ, ZZJ, IGT, XUP, MBG],
IGT: [ZZJ, XUP, DEY, MBG, QNV],
MBG: [ZZJ, IGT, PUN, DEY, QNV],
XUP: [IGT, QNV, DEY]}","Node CBX is connected to nodes PBZ, QOZ, PUN, DEY.
Node PBZ is connected to nodes CBX, QOZ, ZZJ, QNV.
Node QOZ is connected to nodes CBX, PBZ.
Node PUN is connected to nodes CBX, ZZJ, MBG.
Node DEY is connected to nodes CBX, IGT, XUP, MBG.
Node ZZJ is connected to nodes PBZ, IGT, PUN, MBG, QNV.
Node QNV is connected to nodes PBZ, ZZJ, IGT, XUP, MBG.
Node IGT is connected to nodes ZZJ, XUP, DEY, MBG, QNV.
Node MBG is connected to nodes ZZJ, IGT, PUN, DEY, QNV.
Node XUP is connected to nodes IGT, QNV, DEY.","[QOZ, MBG, ZZJ, QNV, PUN, DEY, PBZ, XUP, IGT, CBX]",10,20,False,Which are the neighbor nodes of node XUP? ,"[IGT, QNV, DEY]","Let's solve it step by step.
Node XUP connects to nodes [IGT, QNV, DEY], so the neighbors of node XUP are ","('[[IGT, QNV, DEY], [MBG, XUP, ZZJ], [], [IGT, XUP]]',)",0,74
neighbor,"[(JXC, OGE), (JXC, YRI), (JXC, CYV), (CYV, RPS), (CYV, NHF), (CYV, KBO), (CYV, EDW), (CYV, MKX), (CYV, HID), (MKX, RMI), (RMI, KZR)]","{JXC: [OGE, YRI, CYV],
OGE: [JXC],
YRI: [JXC],
CYV: [JXC, RPS, NHF, KBO, EDW, MKX, HID],
RPS: [CYV],
NHF: [CYV],
KBO: [CYV],
EDW: [CYV],
MKX: [CYV, RMI],
HID: [CYV],
RMI: [KZR, MKX],
KZR: [RMI]}","Node JXC is connected to nodes OGE, YRI, CYV.
Node OGE is connected to node JXC.
Node YRI is connected to node JXC.
Node CYV is connected to nodes JXC, RPS, NHF, KBO, EDW, MKX, HID.
Node RPS is connected to node CYV.
Node NHF is connected to node CYV.
Node KBO is connected to node CYV.
Node EDW is connected to node CYV.
Node MKX is connected to nodes CYV, RMI.
Node HID is connected to node CYV.
Node RMI is connected to nodes KZR, MKX.
Node KZR is connected to node RMI.","[RMI, YRI, HID, KBO, JXC, MKX, KZR, EDW, CYV, OGE, NHF, RPS]",12,11,False,Which are the neighbor nodes of node RMI? ,"[KZR, MKX]","Let's solve it step by step.
Node RMI connects to nodes [KZR, MKX], so the neighbors of node RMI are ","('[[HID, KBO, NHF, RMI], [MKX, HID, RMI, JXC, KBO], [KBO, RPS, EDW, OGE, RMI, JXC, KZR, MKX, NHF, HID, CYV], [KZR, MKX]]',)",3,75
neighbor,"[(ACU, LTD), (ACU, CZT), (CZT, STH), (CZT, ZBZ), (CZT, BEI), (CZT, IGL), (CZT, DRH), (CZT, XIK), (CZT, VST), (IGL, SPF), (XIK, YHU), (XIK, ULA), (ULA, PLG)]","{ACU: [LTD, CZT],
LTD: [ACU],
CZT: [ACU, STH, ZBZ, BEI, IGL, DRH, XIK, VST],
STH: [CZT],
ZBZ: [CZT],
BEI: [CZT],
IGL: [CZT, SPF],
DRH: [CZT],
XIK: [CZT, YHU, ULA],
VST: [CZT],
SPF: [IGL],
YHU: [XIK],
ULA: [XIK, PLG],
PLG: [ULA]}","Node ACU is connected to nodes LTD, CZT.
Node LTD is connected to node ACU.
Node CZT is connected to nodes ACU, STH, ZBZ, BEI, IGL, DRH, XIK, VST.
Node STH is connected to node CZT.
Node ZBZ is connected to node CZT.
Node BEI is connected to node CZT.
Node IGL is connected to nodes CZT, SPF.
Node DRH is connected to node CZT.
Node XIK is connected to nodes CZT, YHU, ULA.
Node VST is connected to node CZT.
Node SPF is connected to node IGL.
Node YHU is connected to node XIK.
Node ULA is connected to nodes XIK, PLG.
Node PLG is connected to node ULA.","[YHU, VST, CZT, PLG, DRH, ZBZ, BEI, ULA, XIK, IGL, STH, LTD, ACU, SPF]",14,13,False,Which are the neighbor nodes of node VST? ,[CZT],"Let's solve it step by step.
Node VST connects to nodes [CZT], so the neighbors of node VST are ","('[[], [CZT, XIK], [STH, ACU], [CZT]]',)",3,76
neighbor,"[(BMT, XBN), (XBN, OED), (XBN, TPK), (OED, YNY), (OED, TPK), (YNY, AFT), (QWY, LQQ), (QWY, SAO), (LQQ, AFT)]","{BMT: [XBN],
XBN: [BMT, OED, TPK],
OED: [XBN, YNY, TPK],
TPK: [XBN, OED],
YNY: [OED, AFT],
QWY: [LQQ, SAO],
LQQ: [QWY, AFT],
SAO: [QWY],
AFT: [LQQ, YNY]}","Node BMT is connected to node XBN.
Node XBN is connected to nodes BMT, OED, TPK.
Node OED is connected to nodes XBN, YNY, TPK.
Node TPK is connected to nodes XBN, OED.
Node YNY is connected to nodes OED, AFT.
Node QWY is connected to nodes LQQ, SAO.
Node LQQ is connected to nodes QWY, AFT.
Node SAO is connected to node QWY.
Node AFT is connected to nodes LQQ, YNY.","[SAO, TPK, AFT, LQQ, QWY, BMT, XBN, YNY, OED]",9,9,False,Which are the neighbor nodes of node YNY? ,"[OED, AFT]","Let's solve it step by step.
Node YNY connects to nodes [OED, AFT], so the neighbors of node YNY are ","('[[OED], [], [SAO], [OED, AFT]]',)",3,77
neighbor,"[(YKO, NQL), (YKO, WOT), (NQL, IDJ), (NQL, NTF), (WOT, URN), (IDJ, GXM), (IDJ, GXR), (HEE, YHT), (HEE, URN), (HEE, OAH), (YHT, SNK), (YHT, BTE), (BTE, TOO), (GXR, TOO)]","{YKO: [NQL, WOT],
NQL: [YKO, IDJ, NTF],
WOT: [YKO, URN],
IDJ: [NQL, GXM, GXR],
NTF: [NQL],
HEE: [YHT, URN, OAH],
YHT: [HEE, SNK, BTE],
URN: [HEE, WOT],
OAH: [HEE],
SNK: [YHT],
BTE: [YHT, TOO],
GXM: [IDJ],
GXR: [IDJ, TOO],
TOO: [BTE, GXR]}","Node YKO is connected to nodes NQL, WOT.
Node NQL is connected to nodes YKO, IDJ, NTF.
Node WOT is connected to nodes YKO, URN.
Node IDJ is connected to nodes NQL, GXM, GXR.
Node NTF is connected to node NQL.
Node HEE is connected to nodes YHT, URN, OAH.
Node YHT is connected to nodes HEE, SNK, BTE.
Node URN is connected to nodes HEE, WOT.
Node OAH is connected to node HEE.
Node SNK is connected to node YHT.
Node BTE is connected to nodes YHT, TOO.
Node GXM is connected to node IDJ.
Node GXR is connected to nodes IDJ, TOO.
Node TOO is connected to nodes BTE, GXR.","[BTE, YHT, WOT, GXM, NTF, OAH, GXR, SNK, URN, IDJ, TOO, HEE, YKO, NQL]",14,14,False,Which are the neighbor nodes of node NTF? ,[NQL],"Let's solve it step by step.
Node NTF connects to nodes [NQL], so the neighbors of node NTF are ","('[[OAH, GXR, BTE, GXM], [NQL], [GXR, TOO, NTF, BTE, SNK, URN, OAH, WOT, YKO, NQL, YHT], [YKO, NTF, BTE, NQL, GXR, TOO, OAH]]',)",1,78
