task,graph,graph_adj,graph_nl,nodes,num_nodes,num_edges,directed,question,answer,steps,choices,label,id
degree,"[(YJJ, PJW), (YJJ, GWF), (PJW, KQG), (GWF, KQG), (GWF, PVD), (KQG, UYQ), (KQG, XKP), (KQG, EOV), (VAQ, UYQ)]","{YJJ: [PJW, GWF],
PJW: [YJJ, KQG],
GWF: [YJJ, KQG, PVD],
KQG: [PJW, UYQ, XKP, GWF, EOV],
VAQ: [UYQ],
UYQ: [VAQ, KQG],
XKP: [KQG],
EOV: [KQG],
PVD: [GWF]}","Node YJJ is connected to nodes PJW, GWF.
Node PJW is connected to nodes YJJ, KQG.
Node GWF is connected to nodes YJJ, KQG, PVD.
Node KQG is connected to nodes PJW, UYQ, XKP, GWF, EOV.
Node VAQ is connected to node UYQ.
Node UYQ is connected to nodes VAQ, KQG.
Node XKP is connected to node KQG.
Node EOV is connected to node KQG.
Node PVD is connected to node GWF.","[XKP, VAQ, PJW, YJJ, GWF, KQG, UYQ, PVD, EOV]",9,9,False,What is the degree of node GWF?,3,"Let's solve this problem step by step.
The neighbors of node GWF are: [YJJ, KQG, PVD], and there are 3 neighbor nodes.
So the degree of node GWF is ","('[1, 5, 0, 3]',)",3,146
degree,"[(ELQ, QVI), (ELQ, BGW), (ELQ, DNO), (QVI, DSO), (QVI, MOP), (QVI, RBW), (BGW, CXH), (BGW, QLI), (BGW, DNO), (DNO, RBW), (DNO, RKD), (DNO, IIN), (CXH, QLI), (CXH, MOP), (QLI, PBV), (QLI, DSO), (QLI, MOP), (QLI, FSK), (MOP, PBV), (MOP, RBW), (MOP, PKR), (DSO, PBV), (DSO, RKD), (RBW, IIN), (PBV, FSK), (RKD, IIN)]","{ELQ: [QVI, BGW, DNO],
QVI: [ELQ, DSO, MOP, RBW],
BGW: [ELQ, CXH, QLI, DNO],
DNO: [ELQ, RBW, RKD, BGW, IIN],
CXH: [QLI, MOP, BGW],
QLI: [CXH, PBV, DSO, MOP, BGW, FSK],
MOP: [CXH, QVI, PBV, QLI, RBW, PKR],
DSO: [QVI, PBV, QLI, RKD],
RBW: [QVI, MOP, IIN, DNO],
PBV: [DSO, QLI, MOP, FSK],
FSK: [PBV, QLI],
RKD: [DSO, IIN, DNO],
PKR: [MOP],
IIN: [RBW, RKD, DNO]}","Node ELQ is connected to nodes QVI, BGW, DNO.
Node QVI is connected to nodes ELQ, DSO, MOP, RBW.
Node BGW is connected to nodes ELQ, CXH, QLI, DNO.
Node DNO is connected to nodes ELQ, RBW, RKD, BGW, IIN.
Node CXH is connected to nodes QLI, MOP, BGW.
Node QLI is connected to nodes CXH, PBV, DSO, MOP, BGW, FSK.
Node MOP is connected to nodes CXH, QVI, PBV, QLI, RBW, PKR.
Node DSO is connected to nodes QVI, PBV, QLI, RKD.
Node RBW is connected to nodes QVI, MOP, IIN, DNO.
Node PBV is connected to nodes DSO, QLI, MOP, FSK.
Node FSK is connected to nodes PBV, QLI.
Node RKD is connected to nodes DSO, IIN, DNO.
Node PKR is connected to node MOP.
Node IIN is connected to nodes RBW, RKD, DNO.","[QLI, FSK, RBW, RKD, DNO, QVI, BGW, CXH, DSO, PKR, MOP, ELQ, PBV, IIN]",14,26,False,What is the degree of node RBW?,4,"Let's solve this problem step by step.
The neighbors of node RBW are: [QVI, MOP, IIN, DNO], and there are 4 neighbor nodes.
So the degree of node RBW is ","('[0, 10, 8, 4]',)",3,147
degree,"[(IXD, XVD), (IXD, ZFF), (IXD, GCZ), (ZFF, PGP), (ZFF, GCZ), (ZFF, FTJ), (GCZ, PGP), (GCZ, VOS), (GCZ, FTJ), (PGP, VOS), (VOS, ZXP), (FTJ, ZXP)]","{IXD: [XVD, ZFF, GCZ],
XVD: [IXD],
ZFF: [IXD, PGP, GCZ, FTJ],
GCZ: [IXD, PGP, ZFF, VOS, FTJ],
PGP: [ZFF, GCZ, VOS],
VOS: [PGP, ZXP, GCZ],
FTJ: [ZFF, ZXP, GCZ],
ZXP: [VOS, FTJ]}","Node IXD is connected to nodes XVD, ZFF, GCZ.
Node XVD is connected to node IXD.
Node ZFF is connected to nodes IXD, PGP, GCZ, FTJ.
Node GCZ is connected to nodes IXD, PGP, ZFF, VOS, FTJ.
Node PGP is connected to nodes ZFF, GCZ, VOS.
Node VOS is connected to nodes PGP, ZXP, GCZ.
Node FTJ is connected to nodes ZFF, ZXP, GCZ.
Node ZXP is connected to nodes VOS, FTJ.","[ZFF, PGP, XVD, VOS, FTJ, GCZ, IXD, ZXP]",8,12,False,What is the degree of node VOS?,3,"Let's solve this problem step by step.
The neighbors of node VOS are: [PGP, ZXP, GCZ], and there are 3 neighbor nodes.
So the degree of node VOS is ","('[1, 6, 0, 3]',)",3,148
degree,"[(UUL, ZLO), (UUL, YFC), (ZLO, AKM), (YFC, IUQ), (YFC, BHT), (YFC, EQB), (BHT, NBY), (BHT, YZM), (BHT, ERW), (BHT, CUB), (BHT, APH), (BHT, MFV)]","{UUL: [ZLO, YFC],
ZLO: [UUL, AKM],
YFC: [UUL, IUQ, BHT, EQB],
AKM: [ZLO],
IUQ: [YFC],
BHT: [YFC, NBY, YZM, ERW, CUB, APH, MFV],
EQB: [YFC],
NBY: [BHT],
YZM: [BHT],
ERW: [BHT],
CUB: [BHT],
APH: [BHT],
MFV: [BHT]}","Node UUL is connected to nodes ZLO, YFC.
Node ZLO is connected to nodes UUL, AKM.
Node YFC is connected to nodes UUL, IUQ, BHT, EQB.
Node AKM is connected to node ZLO.
Node IUQ is connected to node YFC.
Node BHT is connected to nodes YFC, NBY, YZM, ERW, CUB, APH, MFV.
Node EQB is connected to node YFC.
Node NBY is connected to node BHT.
Node YZM is connected to node BHT.
Node ERW is connected to node BHT.
Node CUB is connected to node BHT.
Node APH is connected to node BHT.
Node MFV is connected to node BHT.","[UUL, IUQ, YFC, AKM, ERW, CUB, YZM, APH, EQB, NBY, ZLO, MFV, BHT]",13,12,False,What is the degree of node YFC?,4,"Let's solve this problem step by step.
The neighbors of node YFC are: [UUL, IUQ, BHT, EQB], and there are 4 neighbor nodes.
So the degree of node YFC is ","('[1, 9, 0, 4]',)",3,149
degree,"[(DQP, MJJ), (DQP, HVY), (DQP, LEW), (DQP, OSE), (MJJ, HVY), (MJJ, QNC), (MJJ, FPT), (MJJ, LEW), (MJJ, OSE), (HVY, FFJ), (HVY, FPT), (HVY, LEW), (HVY, OSE), (LEW, FFJ), (LEW, UXR), (LEW, FPT), (LEW, OSE), (LEW, QHN), (OSE, DOJ), (OSE, FFJ), (OSE, UXR), (OSE, FPT), (OSE, QHN), (DOJ, FFJ), (DOJ, UXR), (DOJ, QNC), (DOJ, FPT), (FFJ, FPT), (QNC, FPT), (QNC, QHN), (FPT, QHN)]","{DQP: [MJJ, HVY, LEW, OSE],
MJJ: [DQP, HVY, QNC, FPT, LEW, OSE],
HVY: [DQP, FFJ, MJJ, FPT, LEW, OSE],
LEW: [DQP, FFJ, UXR, MJJ, HVY, FPT, OSE, QHN],
OSE: [DQP, DOJ, FFJ, UXR, MJJ, HVY, FPT, LEW, QHN],
DOJ: [FFJ, UXR, QNC, FPT, OSE],
FFJ: [DOJ, HVY, FPT, LEW, OSE],
UXR: [DOJ, LEW, OSE],
QNC: [DOJ, MJJ, FPT, QHN],
FPT: [DOJ, FFJ, MJJ, HVY, QNC, LEW, OSE, QHN],
QHN: [QNC, FPT, LEW, OSE]}","Node DQP is connected to nodes MJJ, HVY, LEW, OSE.
Node MJJ is connected to nodes DQP, HVY, QNC, FPT, LEW, OSE.
Node HVY is connected to nodes DQP, FFJ, MJJ, FPT, LEW, OSE.
Node LEW is connected to nodes DQP, FFJ, UXR, MJJ, HVY, FPT, OSE, QHN.
Node OSE is connected to nodes DQP, DOJ, FFJ, UXR, MJJ, HVY, FPT, LEW, QHN.
Node DOJ is connected to nodes FFJ, UXR, QNC, FPT, OSE.
Node FFJ is connected to nodes DOJ, HVY, FPT, LEW, OSE.
Node UXR is connected to nodes DOJ, LEW, OSE.
Node QNC is connected to nodes DOJ, MJJ, FPT, QHN.
Node FPT is connected to nodes DOJ, FFJ, MJJ, HVY, QNC, LEW, OSE, QHN.
Node QHN is connected to nodes QNC, FPT, LEW, OSE.","[QNC, LEW, DOJ, QHN, OSE, FFJ, HVY, FPT, DQP, MJJ, UXR]",11,31,False,What is the degree of node DOJ?,5,"Let's solve this problem step by step.
The neighbors of node DOJ are: [FFJ, UXR, QNC, FPT, OSE], and there are 5 neighbor nodes.
So the degree of node DOJ is ","('[8, 0, 5, 2]',)",2,150
degree,"[(KTI, SFA), (SFA, EDN), (SFA, KTI), (EDN, CUG), (EDN, KWB), (EDN, JFV), (EDN, EWX), (CUG, ZZM), (CUG, TVE), (KWB, ZZM), (KWB, EWX), (KWB, EDN), (KWB, CUG), (JFV, KTI), (EWX, KWB), (EWX, WDK), (ZZM, TVE), (ZZM, KTI), (ZZM, SFA), (ZZM, CUG), (ZZM, KWB), (TVE, SFA), (TVE, KWB), (TVE, WDK), (TVE, JFV), (WDK, JFV), (WDK, SFA)]","{KTI: [SFA],
SFA: [EDN, KTI],
EDN: [CUG, KWB, JFV, EWX],
CUG: [ZZM, TVE],
KWB: [ZZM, EWX, EDN, CUG],
JFV: [KTI],
EWX: [KWB, WDK],
ZZM: [TVE, KTI, SFA, CUG, KWB],
TVE: [SFA, KWB, WDK, JFV],
WDK: [JFV, SFA]}","Node KTI is connected to node SFA.
Node SFA is connected to nodes EDN, KTI.
Node EDN is connected to nodes CUG, KWB, JFV, EWX.
Node CUG is connected to nodes ZZM, TVE.
Node KWB is connected to nodes ZZM, EWX, EDN, CUG.
Node JFV is connected to node KTI.
Node EWX is connected to nodes KWB, WDK.
Node ZZM is connected to nodes TVE, KTI, SFA, CUG, KWB.
Node TVE is connected to nodes SFA, KWB, WDK, JFV.
Node WDK is connected to nodes JFV, SFA.","[WDK, SFA, KTI, CUG, TVE, KWB, EWX, EDN, ZZM, JFV]",10,27,True,What is the out-degree of node KTI?,1,"Let's solve this problem step by step.
The successors of node KTI are: [SFA], and there are 1 successor nodes.
So the degree of node KTI is ","('[4, 0, 1, 9]',)",2,151
degree,"[(SQE, LQR), (SQE, EIE), (SQE, FXM), (SQE, SZK), (LQR, FBD), (LQR, OFN), (LQR, BCZ), (FXM, LQR), (SZK, EIE), (SZK, SJY), (SZK, FBD), (QTU, JDQ), (JDQ, SJY), (JDQ, YKZ), (JDQ, BCZ), (JDQ, LQR), (HFC, LQR), (BCZ, LQR), (BCZ, EIE), (BCZ, SZK), (BCZ, QTU), (FBD, SQE), (FBD, HFC), (FBD, JDQ), (OFN, EIE), (SJY, EIE), (YKZ, QTU), (SHD, YKZ), (SHD, SZK), (SHD, BCZ), (SHD, FBD), (MRT, JDQ)]","{SQE: [LQR, EIE, FXM, SZK],
LQR: [FBD, OFN, BCZ],
EIE: [],
FXM: [LQR],
SZK: [EIE, SJY, FBD],
QTU: [JDQ],
JDQ: [SJY, YKZ, BCZ, LQR],
HFC: [LQR],
BCZ: [LQR, EIE, SZK, QTU],
FBD: [SQE, HFC, JDQ],
OFN: [EIE],
SJY: [EIE],
YKZ: [QTU],
SHD: [YKZ, SZK, BCZ, FBD],
MRT: [JDQ]}","Node SQE is connected to nodes LQR, EIE, FXM, SZK.
Node LQR is connected to nodes FBD, OFN, BCZ.
Node FXM is connected to node LQR.
Node SZK is connected to nodes EIE, SJY, FBD.
Node QTU is connected to node JDQ.
Node JDQ is connected to nodes SJY, YKZ, BCZ, LQR.
Node HFC is connected to node LQR.
Node BCZ is connected to nodes LQR, EIE, SZK, QTU.
Node FBD is connected to nodes SQE, HFC, JDQ.
Node OFN is connected to node EIE.
Node SJY is connected to node EIE.
Node YKZ is connected to node QTU.
Node SHD is connected to nodes YKZ, SZK, BCZ, FBD.
Node MRT is connected to node JDQ.","[OFN, QTU, YKZ, SQE, SJY, EIE, MRT, SHD, BCZ, FBD, HFC, JDQ, SZK, FXM, LQR]",15,32,True,What is the out-degree of node YKZ?,1,"Let's solve this problem step by step.
The successors of node YKZ are: [QTU], and there are 1 successor nodes.
So the degree of node YKZ is ","('[1, 0, 2, 9]',)",0,152
degree,"[(BUK, EUN), (BUK, SJV), (BUK, AID), (BUK, GNI), (EUN, GNI), (EUN, QLA), (SJV, LFV), (SJV, AID), (SJV, QNM), (SJV, QLA), (SJV, GNI), (SJV, PRW), (GNI, QNM), (GNI, PRW), (LFV, PRW), (LFV, JTF), (PRW, JTF), (PRW, NKF)]","{BUK: [EUN, SJV, AID, GNI],
EUN: [BUK, GNI, QLA],
SJV: [BUK, LFV, AID, QNM, QLA, GNI, PRW],
AID: [BUK, SJV],
GNI: [BUK, EUN, SJV, QNM, PRW],
QLA: [EUN, SJV],
LFV: [SJV, PRW, JTF],
QNM: [SJV, GNI],
PRW: [SJV, LFV, GNI, JTF, NKF],
JTF: [LFV, PRW],
NKF: [PRW]}","Node BUK is connected to nodes EUN, SJV, AID, GNI.
Node EUN is connected to nodes BUK, GNI, QLA.
Node SJV is connected to nodes BUK, LFV, AID, QNM, QLA, GNI, PRW.
Node AID is connected to nodes BUK, SJV.
Node GNI is connected to nodes BUK, EUN, SJV, QNM, PRW.
Node QLA is connected to nodes EUN, SJV.
Node LFV is connected to nodes SJV, PRW, JTF.
Node QNM is connected to nodes SJV, GNI.
Node PRW is connected to nodes SJV, LFV, GNI, JTF, NKF.
Node JTF is connected to nodes LFV, PRW.
Node NKF is connected to node PRW.","[QNM, AID, EUN, SJV, BUK, PRW, NKF, GNI, LFV, JTF, QLA]",11,18,False,What is the degree of node QNM?,2,"Let's solve this problem step by step.
The neighbors of node QNM are: [SJV, GNI], and there are 2 neighbor nodes.
So the degree of node QNM is ","('[0, 5, 2, 3]',)",2,153
degree,"[(CGS, ADC), (CGS, KSW), (ADC, KSW), (KSW, EGT), (KSW, LTF), (EGT, YIH), (YIH, ZVH), (LTF, TOX)]","{CGS: [ADC, KSW],
ADC: [CGS, KSW],
KSW: [CGS, ADC, EGT, LTF],
EGT: [KSW, YIH],
YIH: [EGT, ZVH],
LTF: [KSW, TOX],
TOX: [LTF],
ZVH: [YIH]}","Node CGS is connected to nodes ADC, KSW.
Node ADC is connected to nodes CGS, KSW.
Node KSW is connected to nodes CGS, ADC, EGT, LTF.
Node EGT is connected to nodes KSW, YIH.
Node YIH is connected to nodes EGT, ZVH.
Node LTF is connected to nodes KSW, TOX.
Node TOX is connected to node LTF.
Node ZVH is connected to node YIH.","[ADC, YIH, EGT, KSW, LTF, TOX, CGS, ZVH]",8,8,False,What is the degree of node CGS?,2,"Let's solve this problem step by step.
The neighbors of node CGS are: [ADC, KSW], and there are 2 neighbor nodes.
So the degree of node CGS is ","('[0, 2, 10, 6]',)",1,154
degree,"[(BOF, DVP), (BOF, JEM), (BOF, RRU), (BOF, PII), (DVP, RRU), (DVP, DGS), (JEM, PII), (JEM, DVP), (JEM, WSO), (JEM, GMZ), (RRU, DGS), (RRU, PII), (RRU, DVP), (RRU, WSO), (PII, ZFW), (PII, QIT), (PII, DGS), (ZFW, QIT), (ZFW, DGS), (QIT, DVP), (QIT, GMZ), (QIT, RRU), (DGS, PII), (DGS, BOF), (DGS, ZFW), (DGS, GMZ), (DGS, JEM), (WSO, QIT), (WSO, DGS), (WSO, PII), (WSO, BOF), (WSO, ZFW), (GMZ, JEM), (GMZ, QIT), (GMZ, DGS), (GMZ, BOF)]","{BOF: [DVP, JEM, RRU, PII],
DVP: [RRU, DGS],
JEM: [PII, DVP, WSO, GMZ],
RRU: [DGS, PII, DVP, WSO],
PII: [ZFW, QIT, DGS],
ZFW: [QIT, DGS],
QIT: [DVP, GMZ, RRU],
DGS: [PII, BOF, ZFW, GMZ, JEM],
WSO: [QIT, DGS, PII, BOF, ZFW],
GMZ: [JEM, QIT, DGS, BOF]}","Node BOF is connected to nodes DVP, JEM, RRU, PII.
Node DVP is connected to nodes RRU, DGS.
Node JEM is connected to nodes PII, DVP, WSO, GMZ.
Node RRU is connected to nodes DGS, PII, DVP, WSO.
Node PII is connected to nodes ZFW, QIT, DGS.
Node ZFW is connected to nodes QIT, DGS.
Node QIT is connected to nodes DVP, GMZ, RRU.
Node DGS is connected to nodes PII, BOF, ZFW, GMZ, JEM.
Node WSO is connected to nodes QIT, DGS, PII, BOF, ZFW.
Node GMZ is connected to nodes JEM, QIT, DGS, BOF.","[DGS, RRU, WSO, QIT, DVP, GMZ, BOF, PII, ZFW, JEM]",10,36,True,What is the out-degree of node RRU?,4,"Let's solve this problem step by step.
The successors of node RRU are: [DGS, PII, DVP, WSO], and there are 4 successor nodes.
So the degree of node RRU is ","('[6, 0, 3, 4]',)",3,155
degree,"[(OSK, YPH), (YPH, TIG), (YPH, PJV), (YPH, IKG), (TIG, PZI), (TIG, IKG), (GTQ, PZI), (GTQ, OTB)]","{OSK: [YPH],
YPH: [OSK, TIG, PJV, IKG],
TIG: [YPH, PZI, IKG],
PJV: [YPH],
IKG: [YPH, TIG],
GTQ: [PZI, OTB],
PZI: [GTQ, TIG],
OTB: [GTQ]}","Node OSK is connected to node YPH.
Node YPH is connected to nodes OSK, TIG, PJV, IKG.
Node TIG is connected to nodes YPH, PZI, IKG.
Node PJV is connected to node YPH.
Node IKG is connected to nodes YPH, TIG.
Node GTQ is connected to nodes PZI, OTB.
Node PZI is connected to nodes GTQ, TIG.
Node OTB is connected to node GTQ.","[PJV, IKG, GTQ, OSK, PZI, OTB, YPH, TIG]",8,8,False,What is the degree of node PJV?,1,"Let's solve this problem step by step.
The neighbors of node PJV are: [YPH], and there are 1 neighbor nodes.
So the degree of node PJV is ","('[3, 0, 4, 1]',)",3,156
degree,"[(CPS, SWZ), (CPS, WGD), (CPS, ZLG), (WGD, UGT), (WGD, QXS), (ZLG, LLM), (UGT, NCW), (UGT, UDT), (UDT, ZRE), (QXS, CPK), (QXS, ZXC), (ZXC, FJN), (ZRE, ZWQ)]","{CPS: [SWZ, WGD, ZLG],
SWZ: [CPS],
WGD: [CPS, UGT, QXS],
ZLG: [CPS, LLM],
UGT: [NCW, UDT, WGD],
NCW: [UGT],
UDT: [UGT, ZRE],
QXS: [CPK, WGD, ZXC],
CPK: [QXS],
ZXC: [QXS, FJN],
ZRE: [UDT, ZWQ],
ZWQ: [ZRE],
LLM: [ZLG],
FJN: [ZXC]}","Node CPS is connected to nodes SWZ, WGD, ZLG.
Node SWZ is connected to node CPS.
Node WGD is connected to nodes CPS, UGT, QXS.
Node ZLG is connected to nodes CPS, LLM.
Node UGT is connected to nodes NCW, UDT, WGD.
Node NCW is connected to node UGT.
Node UDT is connected to nodes UGT, ZRE.
Node QXS is connected to nodes CPK, WGD, ZXC.
Node CPK is connected to node QXS.
Node ZXC is connected to nodes QXS, FJN.
Node ZRE is connected to nodes UDT, ZWQ.
Node ZWQ is connected to node ZRE.
Node LLM is connected to node ZLG.
Node FJN is connected to node ZXC.","[NCW, LLM, CPK, ZRE, ZLG, UDT, UGT, ZXC, CPS, ZWQ, QXS, WGD, FJN, SWZ]",14,13,False,What is the degree of node LLM?,1,"Let's solve this problem step by step.
The neighbors of node LLM are: [ZLG], and there are 1 neighbor nodes.
So the degree of node LLM is ","('[3, 4, 1, 0]',)",2,157
degree,"[(ODO, FJG), (ODO, MBK), (ODO, FSM), (ODO, TEA), (ODO, SLL), (ODO, LZP), (FJG, MBK), (FJG, TEA), (FJG, SLL), (FJG, UPT), (FJG, LZP), (MBK, AFX), (MBK, UPT), (MBK, LZP), (FSM, TEA), (FSM, AFX), (FSM, LZP), (TEA, JAJ), (TEA, SLL), (TEA, LZP), (SLL, JAJ), (SLL, UPT), (SLL, LZP), (LZP, JAJ), (LZP, AFX), (LZP, UPT), (JAJ, AFX)]","{ODO: [FJG, MBK, FSM, TEA, SLL, LZP],
FJG: [ODO, MBK, TEA, SLL, UPT, LZP],
MBK: [ODO, FJG, AFX, UPT, LZP],
FSM: [ODO, TEA, AFX, LZP],
TEA: [ODO, FJG, JAJ, FSM, SLL, LZP],
SLL: [ODO, FJG, JAJ, TEA, UPT, LZP],
LZP: [ODO, FJG, JAJ, MBK, FSM, TEA, SLL, AFX, UPT],
UPT: [FJG, MBK, SLL, LZP],
JAJ: [TEA, SLL, AFX, LZP],
AFX: [JAJ, MBK, FSM, LZP]}","Node ODO is connected to nodes FJG, MBK, FSM, TEA, SLL, LZP.
Node FJG is connected to nodes ODO, MBK, TEA, SLL, UPT, LZP.
Node MBK is connected to nodes ODO, FJG, AFX, UPT, LZP.
Node FSM is connected to nodes ODO, TEA, AFX, LZP.
Node TEA is connected to nodes ODO, FJG, JAJ, FSM, SLL, LZP.
Node SLL is connected to nodes ODO, FJG, JAJ, TEA, UPT, LZP.
Node LZP is connected to nodes ODO, FJG, JAJ, MBK, FSM, TEA, SLL, AFX, UPT.
Node UPT is connected to nodes FJG, MBK, SLL, LZP.
Node JAJ is connected to nodes TEA, SLL, AFX, LZP.
Node AFX is connected to nodes JAJ, MBK, FSM, LZP.","[SLL, LZP, JAJ, AFX, FJG, ODO, TEA, MBK, FSM, UPT]",10,27,False,What is the degree of node TEA?,6,"Let's solve this problem step by step.
The neighbors of node TEA are: [ODO, FJG, JAJ, FSM, SLL, LZP], and there are 6 neighbor nodes.
So the degree of node TEA is ","('[1, 0, 6, 4]',)",2,158
degree,"[(AUL, NAI), (AUL, RMS), (AUL, ROO), (AUL, MHK), (AUL, DJR), (AUL, BLR), (AUL, CKB), (AUL, IYB), (AUL, NYE), (NAI, RMS), (NAI, WEU), (NAI, ROO), (NAI, DJR), (NAI, LED), (NAI, CKB), (NAI, NYE), (RMS, WEU), (RMS, ROO), (RMS, MHK), (RMS, DJR), (RMS, LED), (RMS, CKB), (RMS, LWO), (RMS, NYE), (ROO, WEU), (ROO, MHK), (ROO, LED), (ROO, BLR), (ROO, CKB), (ROO, IYB), (MHK, WEU), (MHK, DJR), (MHK, LED), (MHK, BLR), (MHK, CKB), (MHK, LWO), (MHK, NYE), (DJR, WEU), (DJR, BLR), (DJR, IYB), (DJR, LWO), (DJR, NYE), (BLR, WEU), (BLR, LED), (BLR, CKB), (BLR, IYB), (BLR, LWO), (BLR, NYE), (CKB, WEU), (CKB, LED), (CKB, NYE), (IYB, WEU), (IYB, LED), (IYB, LWO), (IYB, NYE), (NYE, LED), (NYE, LWO), (WEU, LED)]","{AUL: [NAI, RMS, ROO, MHK, DJR, BLR, CKB, IYB, NYE],
NAI: [AUL, RMS, WEU, ROO, DJR, LED, CKB, NYE],
RMS: [AUL, NAI, WEU, ROO, MHK, DJR, LED, CKB, LWO, NYE],
ROO: [AUL, NAI, RMS, WEU, MHK, LED, BLR, CKB, IYB],
MHK: [AUL, RMS, WEU, ROO, DJR, LED, BLR, CKB, LWO, NYE],
DJR: [AUL, NAI, RMS, WEU, MHK, BLR, IYB, LWO, NYE],
BLR: [AUL, WEU, ROO, MHK, DJR, LED, CKB, IYB, LWO, NYE],
CKB: [AUL, NAI, RMS, WEU, ROO, MHK, LED, BLR, NYE],
IYB: [AUL, WEU, ROO, DJR, LED, BLR, LWO, NYE],
NYE: [AUL, NAI, RMS, MHK, DJR, LED, BLR, CKB, IYB, LWO],
WEU: [NAI, RMS, ROO, MHK, DJR, LED, BLR, CKB, IYB],
LED: [NAI, RMS, WEU, ROO, MHK, BLR, CKB, IYB, NYE],
LWO: [RMS, MHK, DJR, BLR, IYB, NYE]}","Node AUL is connected to nodes NAI, RMS, ROO, MHK, DJR, BLR, CKB, IYB, NYE.
Node NAI is connected to nodes AUL, RMS, WEU, ROO, DJR, LED, CKB, NYE.
Node RMS is connected to nodes AUL, NAI, WEU, ROO, MHK, DJR, LED, CKB, LWO, NYE.
Node ROO is connected to nodes AUL, NAI, RMS, WEU, MHK, LED, BLR, CKB, IYB.
Node MHK is connected to nodes AUL, RMS, WEU, ROO, DJR, LED, BLR, CKB, LWO, NYE.
Node DJR is connected to nodes AUL, NAI, RMS, WEU, MHK, BLR, IYB, LWO, NYE.
Node BLR is connected to nodes AUL, WEU, ROO, MHK, DJR, LED, CKB, IYB, LWO, NYE.
Node CKB is connected to nodes AUL, NAI, RMS, WEU, ROO, MHK, LED, BLR, NYE.
Node IYB is connected to nodes AUL, WEU, ROO, DJR, LED, BLR, LWO, NYE.
Node NYE is connected to nodes AUL, NAI, RMS, MHK, DJR, LED, BLR, CKB, IYB, LWO.
Node WEU is connected to nodes NAI, RMS, ROO, MHK, DJR, LED, BLR, CKB, IYB.
Node LED is connected to nodes NAI, RMS, WEU, ROO, MHK, BLR, CKB, IYB, NYE.
Node LWO is connected to nodes RMS, MHK, DJR, BLR, IYB, NYE.","[AUL, ROO, RMS, MHK, BLR, LED, IYB, NYE, NAI, CKB, WEU, LWO, DJR]",13,58,False,What is the degree of node LED?,9,"Let's solve this problem step by step.
The neighbors of node LED are: [NAI, RMS, WEU, ROO, MHK, BLR, CKB, IYB, NYE], and there are 9 neighbor nodes.
So the degree of node LED is ","('[2, 0, 9, 10]',)",2,159
degree,"[(OPE, CKA), (CKA, LIR), (LIR, LFV), (LIR, ONQ), (LIR, VSA), (LFV, ONQ), (LFV, QME), (ONQ, CKA), (ONQ, LIR), (VSA, CKA), (VSA, GRI), (QME, CKA), (QME, LIR), (QME, LFV)]","{OPE: [CKA],
CKA: [LIR],
LIR: [LFV, ONQ, VSA],
LFV: [ONQ, QME],
ONQ: [CKA, LIR],
VSA: [CKA, GRI],
QME: [CKA, LIR, LFV],
GRI: []}","Node OPE is connected to node CKA.
Node CKA is connected to node LIR.
Node LIR is connected to nodes LFV, ONQ, VSA.
Node LFV is connected to nodes ONQ, QME.
Node ONQ is connected to nodes CKA, LIR.
Node VSA is connected to nodes CKA, GRI.
Node QME is connected to nodes CKA, LIR, LFV.","[VSA, GRI, ONQ, OPE, LIR, QME, LFV, CKA]",8,14,True,What is the out-degree of node LIR?,3,"Let's solve this problem step by step.
The successors of node LIR are: [LFV, ONQ, VSA], and there are 3 successor nodes.
So the degree of node LIR is ","('[9, 5, 3, 0]',)",2,160
degree,"[(AMG, YVQ), (AMG, DDI), (AMG, DTZ), (YVQ, BDK), (YVQ, DDI), (YVQ, CEL), (YVQ, AMG), (DDI, CEL), (DDI, DTZ), (DDI, AMG), (DDI, LNH), (DTZ, GSN), (DTZ, DDI), (BDK, LNH), (BDK, GSN), (BDK, DDI), (BDK, UAK), (BDK, CEL), (CEL, YVQ), (CEL, BDK), (CEL, UAK), (LNH, UAK), (LNH, DTZ), (GSN, UAK), (GSN, DTZ), (GSN, YVQ), (UAK, AMG)]","{AMG: [YVQ, DDI, DTZ],
YVQ: [BDK, DDI, CEL, AMG],
DDI: [CEL, DTZ, AMG, LNH],
DTZ: [GSN, DDI],
BDK: [LNH, GSN, DDI, UAK, CEL],
CEL: [YVQ, BDK, UAK],
LNH: [UAK, DTZ],
GSN: [UAK, DTZ, YVQ],
UAK: [AMG]}","Node AMG is connected to nodes YVQ, DDI, DTZ.
Node YVQ is connected to nodes BDK, DDI, CEL, AMG.
Node DDI is connected to nodes CEL, DTZ, AMG, LNH.
Node DTZ is connected to nodes GSN, DDI.
Node BDK is connected to nodes LNH, GSN, DDI, UAK, CEL.
Node CEL is connected to nodes YVQ, BDK, UAK.
Node LNH is connected to nodes UAK, DTZ.
Node GSN is connected to nodes UAK, DTZ, YVQ.
Node UAK is connected to node AMG.","[GSN, CEL, LNH, AMG, DDI, BDK, UAK, DTZ, YVQ]",9,27,True,What is the out-degree of node DDI?,4,"Let's solve this problem step by step.
The successors of node DDI are: [CEL, DTZ, AMG, LNH], and there are 4 successor nodes.
So the degree of node DDI is ","('[6, 4, 9, 0]',)",1,161
degree,"[(XJC, QWR), (XJC, YNJ), (XJC, QNW), (QWR, YNJ), (QWR, GIE), (QWR, WAX), (YNJ, UHJ), (YNJ, CCN), (YNJ, WAX), (YNJ, XJC), (YNJ, QWR), (QNW, WAX), (QNW, YNJ), (QNW, CCN), (GIE, FOG), (GIE, WFI), (GIE, UHJ), (WAX, FOG), (FOG, WFI), (FOG, GIE), (FOG, HTC), (WFI, CCN), (WFI, QNW), (WFI, FOG), (HTC, YNJ), (HTC, UHJ), (UHJ, FOG), (CCN, QNW), (TTI, CCN), (TTI, GIE), (TTI, HTC), (YXD, QWR), (YXD, YNJ), (YXD, TTI)]","{XJC: [QWR, YNJ, QNW],
QWR: [YNJ, GIE, WAX],
YNJ: [UHJ, CCN, WAX, XJC, QWR],
QNW: [WAX, YNJ, CCN],
GIE: [FOG, WFI, UHJ],
WAX: [FOG],
FOG: [WFI, GIE, HTC],
WFI: [CCN, QNW, FOG],
HTC: [YNJ, UHJ],
UHJ: [FOG],
CCN: [QNW],
TTI: [CCN, GIE, HTC],
YXD: [QWR, YNJ, TTI]}","Node XJC is connected to nodes QWR, YNJ, QNW.
Node QWR is connected to nodes YNJ, GIE, WAX.
Node YNJ is connected to nodes UHJ, CCN, WAX, XJC, QWR.
Node QNW is connected to nodes WAX, YNJ, CCN.
Node GIE is connected to nodes FOG, WFI, UHJ.
Node WAX is connected to node FOG.
Node FOG is connected to nodes WFI, GIE, HTC.
Node WFI is connected to nodes CCN, QNW, FOG.
Node HTC is connected to nodes YNJ, UHJ.
Node UHJ is connected to node FOG.
Node CCN is connected to node QNW.
Node TTI is connected to nodes CCN, GIE, HTC.
Node YXD is connected to nodes QWR, YNJ, TTI.","[TTI, WAX, QWR, QNW, YNJ, UHJ, GIE, YXD, HTC, FOG, XJC, WFI, CCN]",13,34,True,What is the out-degree of node QWR?,3,"Let's solve this problem step by step.
The successors of node QWR are: [YNJ, GIE, WAX], and there are 3 successor nodes.
So the degree of node QWR is ","('[1, 6, 0, 3]',)",3,162
degree,"[(XEM, VQQ), (XEM, TQE), (VQQ, BTH), (VQQ, FMM), (TQE, OOX), (BTH, VRN), (VRN, SKH), (VRN, LTE), (SKH, LTE), (SKH, CFH), (HUY, FBJ), (FBJ, CFH)]","{XEM: [VQQ, TQE],
VQQ: [XEM, BTH, FMM],
TQE: [XEM, OOX],
BTH: [VQQ, VRN],
FMM: [VQQ],
VRN: [BTH, SKH, LTE],
SKH: [VRN, LTE, CFH],
LTE: [VRN, SKH],
HUY: [FBJ],
FBJ: [HUY, CFH],
CFH: [FBJ, SKH],
OOX: [TQE]}","Node XEM is connected to nodes VQQ, TQE.
Node VQQ is connected to nodes XEM, BTH, FMM.
Node TQE is connected to nodes XEM, OOX.
Node BTH is connected to nodes VQQ, VRN.
Node FMM is connected to node VQQ.
Node VRN is connected to nodes BTH, SKH, LTE.
Node SKH is connected to nodes VRN, LTE, CFH.
Node LTE is connected to nodes VRN, SKH.
Node HUY is connected to node FBJ.
Node FBJ is connected to nodes HUY, CFH.
Node CFH is connected to nodes FBJ, SKH.
Node OOX is connected to node TQE.","[BTH, FMM, CFH, LTE, VQQ, OOX, TQE, FBJ, VRN, HUY, XEM, SKH]",12,12,False,What is the degree of node VRN?,3,"Let's solve this problem step by step.
The neighbors of node VRN are: [BTH, SKH, LTE], and there are 3 neighbor nodes.
So the degree of node VRN is ","('[3, 4, 0, 5]',)",0,163
degree,"[(STL, KVJ), (STL, GYH), (STL, QTM), (STL, KLU), (STL, FEN), (STL, JHF), (STL, ZQJ), (STL, XGJ), (STL, ZCY), (KVJ, VIR), (KVJ, FEN), (KVJ, RHR), (GYH, QTM), (QTM, ZQJ), (QTM, RHR), (QTM, JUW), (QTM, XGJ), (QTM, TYQ), (QTM, JHF), (QTM, YXJ), (QTM, ZCY), (KLU, ZCY), (JHF, YXJ), (ZCY, TYQ), (ZCY, VIR), (JUW, TYQ)]","{STL: [KVJ, GYH, QTM, KLU, FEN, JHF, ZQJ, XGJ, ZCY],
KVJ: [STL, VIR, FEN, RHR],
GYH: [STL, QTM],
QTM: [STL, ZQJ, RHR, GYH, JUW, XGJ, TYQ, JHF, YXJ, ZCY],
KLU: [STL, ZCY],
FEN: [STL, KVJ],
JHF: [STL, QTM, YXJ],
ZQJ: [STL, QTM],
XGJ: [STL, QTM],
ZCY: [STL, QTM, TYQ, KLU, VIR],
VIR: [KVJ, ZCY],
RHR: [KVJ, QTM],
JUW: [QTM, TYQ],
TYQ: [QTM, JUW, ZCY],
YXJ: [QTM, JHF]}","Node STL is connected to nodes KVJ, GYH, QTM, KLU, FEN, JHF, ZQJ, XGJ, ZCY.
Node KVJ is connected to nodes STL, VIR, FEN, RHR.
Node GYH is connected to nodes STL, QTM.
Node QTM is connected to nodes STL, ZQJ, RHR, GYH, JUW, XGJ, TYQ, JHF, YXJ, ZCY.
Node KLU is connected to nodes STL, ZCY.
Node FEN is connected to nodes STL, KVJ.
Node JHF is connected to nodes STL, QTM, YXJ.
Node ZQJ is connected to nodes STL, QTM.
Node XGJ is connected to nodes STL, QTM.
Node ZCY is connected to nodes STL, QTM, TYQ, KLU, VIR.
Node VIR is connected to nodes KVJ, ZCY.
Node RHR is connected to nodes KVJ, QTM.
Node JUW is connected to nodes QTM, TYQ.
Node TYQ is connected to nodes QTM, JUW, ZCY.
Node YXJ is connected to nodes QTM, JHF.","[TYQ, VIR, FEN, GYH, KLU, QTM, ZCY, YXJ, STL, JHF, JUW, ZQJ, XGJ, RHR, KVJ]",15,26,False,What is the degree of node FEN?,2,"Let's solve this problem step by step.
The neighbors of node FEN are: [STL, KVJ], and there are 2 neighbor nodes.
So the degree of node FEN is ","('[0, 10, 2, 8]',)",2,164
