task,graph,graph_adj,graph_nl,nodes,num_nodes,num_edges,directed,question,answer,steps,choices,label,id
degree,"[(HWS, KDO), (HWS, EXN), (HWS, XYC), (HWS, DCG), (HWS, YZE), (KDO, EXN), (KDO, XYC), (KDO, JVE), (KDO, AIM), (EXN, HYV), (EXN, GHR), (XYC, FNS), (XYC, HYV), (XYC, EWF), (DCG, USQ), (DCG, YZE), (DCG, FNS), (YZE, FNS), (YZE, AIM), (JVE, FNS), (JVE, GHR), (AIM, FNS), (AIM, GHR), (USQ, HYV), (USQ, EWF), (EWF, FNS)]","{HWS: [KDO, EXN, XYC, DCG, YZE],
KDO: [HWS, EXN, XYC, JVE, AIM],
EXN: [HWS, KDO, HYV, GHR],
XYC: [HWS, KDO, FNS, HYV, EWF],
DCG: [HWS, USQ, YZE, FNS],
YZE: [HWS, DCG, FNS, AIM],
JVE: [KDO, FNS, GHR],
AIM: [KDO, YZE, FNS, GHR],
USQ: [DCG, HYV, EWF],
HYV: [USQ, XYC, EXN],
EWF: [USQ, FNS, XYC],
FNS: [DCG, YZE, AIM, JVE, XYC, EWF],
GHR: [EXN, AIM, JVE]}","Node HWS is connected to nodes KDO, EXN, XYC, DCG, YZE.
Node KDO is connected to nodes HWS, EXN, XYC, JVE, AIM.
Node EXN is connected to nodes HWS, KDO, HYV, GHR.
Node XYC is connected to nodes HWS, KDO, FNS, HYV, EWF.
Node DCG is connected to nodes HWS, USQ, YZE, FNS.
Node YZE is connected to nodes HWS, DCG, FNS, AIM.
Node JVE is connected to nodes KDO, FNS, GHR.
Node AIM is connected to nodes KDO, YZE, FNS, GHR.
Node USQ is connected to nodes DCG, HYV, EWF.
Node HYV is connected to nodes USQ, XYC, EXN.
Node EWF is connected to nodes USQ, FNS, XYC.
Node FNS is connected to nodes DCG, YZE, AIM, JVE, XYC, EWF.
Node GHR is connected to nodes EXN, AIM, JVE.","[EXN, AIM, KDO, HWS, GHR, JVE, YZE, XYC, EWF, HYV, DCG, FNS, USQ]",13,26,False,What is the degree of node HYV?,3,"Let's solve this problem step by step.
The neighbors of node HYV are: [USQ, XYC, EXN], and there are 3 neighbor nodes.
So the degree of node HYV is ","('[2, 0, 6, 3]',)",3,67
degree,"[(NFW, OGD), (NFW, XZQ), (NFW, NTO), (OGD, XZQ), (OGD, NTO), (OGD, UDI), (OGD, NFW), (XZQ, NFW), (NTO, NFW), (NTO, OGD), (NTO, XZQ), (UDI, OGD), (UDI, ZPO), (UDI, NTO), (UDI, HQO), (ZPO, NTO), (ZPO, UDI), (ZPO, OGD), (HQO, NFW), (HQO, OGD), (OLJ, OGD), (OLJ, NTO), (OLJ, HQO)]","{NFW: [OGD, XZQ, NTO],
OGD: [XZQ, NTO, UDI, NFW],
XZQ: [NFW],
NTO: [NFW, OGD, XZQ],
UDI: [OGD, ZPO, NTO, HQO],
ZPO: [NTO, UDI, OGD],
HQO: [NFW, OGD],
OLJ: [OGD, NTO, HQO]}","Node NFW is connected to nodes OGD, XZQ, NTO.
Node OGD is connected to nodes XZQ, NTO, UDI, NFW.
Node XZQ is connected to node NFW.
Node NTO is connected to nodes NFW, OGD, XZQ.
Node UDI is connected to nodes OGD, ZPO, NTO, HQO.
Node ZPO is connected to nodes NTO, UDI, OGD.
Node HQO is connected to nodes NFW, OGD.
Node OLJ is connected to nodes OGD, NTO, HQO.","[OGD, HQO, NFW, NTO, ZPO, XZQ, UDI, OLJ]",8,23,True,What is the out-degree of node OLJ?,3,"Let's solve this problem step by step.
The successors of node OLJ are: [OGD, NTO, HQO], and there are 3 successor nodes.
So the degree of node OLJ is ","('[0, 4, 8, 3]',)",3,68
degree,"[(GBU, DPQ), (GBU, POI), (DPQ, JLN), (POI, JPW), (JLN, CSP), (JLN, UNK), (HDB, NJW), (NJW, XIF), (XIF, XKH), (BFE, XKH), (XKH, JPW), (JPW, HGU), (CSP, UNK), (UNK, YEX)]","{GBU: [DPQ, POI],
DPQ: [GBU, JLN],
POI: [GBU, JPW],
JLN: [DPQ, CSP, UNK],
HDB: [NJW],
NJW: [HDB, XIF],
XIF: [NJW, XKH],
BFE: [XKH],
XKH: [BFE, JPW, XIF],
JPW: [XKH, POI, HGU],
CSP: [JLN, UNK],
UNK: [CSP, JLN, YEX],
HGU: [JPW],
YEX: [UNK]}","Node GBU is connected to nodes DPQ, POI.
Node DPQ is connected to nodes GBU, JLN.
Node POI is connected to nodes GBU, JPW.
Node JLN is connected to nodes DPQ, CSP, UNK.
Node HDB is connected to node NJW.
Node NJW is connected to nodes HDB, XIF.
Node XIF is connected to nodes NJW, XKH.
Node BFE is connected to node XKH.
Node XKH is connected to nodes BFE, JPW, XIF.
Node JPW is connected to nodes XKH, POI, HGU.
Node CSP is connected to nodes JLN, UNK.
Node UNK is connected to nodes CSP, JLN, YEX.
Node HGU is connected to node JPW.
Node YEX is connected to node UNK.","[JLN, HDB, NJW, BFE, JPW, POI, CSP, XKH, YEX, DPQ, HGU, XIF, GBU, UNK]",14,14,False,What is the degree of node DPQ?,2,"Let's solve this problem step by step.
The neighbors of node DPQ are: [GBU, JLN], and there are 2 neighbor nodes.
So the degree of node DPQ is ","('[8, 0, 10, 2]',)",3,69
degree,"[(PPE, LQO), (PPE, MTM), (PPE, CSZ), (LQO, IRV), (LQO, DFK), (MTM, ORV), (MTM, MGS), (IRV, MGS), (AQF, RCG), (AQF, SRE), (RCG, NEJ), (SRE, ECP), (NEJ, DYU), (DYU, ECP)]","{PPE: [LQO, MTM, CSZ],
LQO: [PPE, IRV, DFK],
MTM: [PPE, ORV, MGS],
CSZ: [PPE],
IRV: [LQO, MGS],
DFK: [LQO],
AQF: [RCG, SRE],
RCG: [AQF, NEJ],
SRE: [AQF, ECP],
NEJ: [RCG, DYU],
ORV: [MTM],
MGS: [MTM, IRV],
DYU: [NEJ, ECP],
ECP: [DYU, SRE]}","Node PPE is connected to nodes LQO, MTM, CSZ.
Node LQO is connected to nodes PPE, IRV, DFK.
Node MTM is connected to nodes PPE, ORV, MGS.
Node CSZ is connected to node PPE.
Node IRV is connected to nodes LQO, MGS.
Node DFK is connected to node LQO.
Node AQF is connected to nodes RCG, SRE.
Node RCG is connected to nodes AQF, NEJ.
Node SRE is connected to nodes AQF, ECP.
Node NEJ is connected to nodes RCG, DYU.
Node ORV is connected to node MTM.
Node MGS is connected to nodes MTM, IRV.
Node DYU is connected to nodes NEJ, ECP.
Node ECP is connected to nodes DYU, SRE.","[LQO, MTM, RCG, CSZ, AQF, ECP, DYU, MGS, SRE, PPE, ORV, IRV, NEJ, DFK]",14,14,False,What is the degree of node AQF?,2,"Let's solve this problem step by step.
The neighbors of node AQF are: [RCG, SRE], and there are 2 neighbor nodes.
So the degree of node AQF is ","('[6, 0, 4, 2]',)",3,70
degree,"[(WCP, FXE), (WCP, BLA), (FXE, CRJ), (BLA, BAK), (CRJ, IQY), (CRJ, WRV), (CRJ, PTZ), (BAK, QJI), (IQY, JYF), (WRV, JYF), (WRV, UKF), (PTZ, XHJ), (QJI, IKR), (UKF, XPV)]","{WCP: [FXE, BLA],
FXE: [WCP, CRJ],
BLA: [WCP, BAK],
CRJ: [FXE, IQY, WRV, PTZ],
BAK: [BLA, QJI],
IQY: [CRJ, JYF],
WRV: [CRJ, JYF, UKF],
PTZ: [CRJ, XHJ],
JYF: [IQY, WRV],
QJI: [BAK, IKR],
XHJ: [PTZ],
IKR: [QJI],
UKF: [WRV, XPV],
XPV: [UKF]}","Node WCP is connected to nodes FXE, BLA.
Node FXE is connected to nodes WCP, CRJ.
Node BLA is connected to nodes WCP, BAK.
Node CRJ is connected to nodes FXE, IQY, WRV, PTZ.
Node BAK is connected to nodes BLA, QJI.
Node IQY is connected to nodes CRJ, JYF.
Node WRV is connected to nodes CRJ, JYF, UKF.
Node PTZ is connected to nodes CRJ, XHJ.
Node JYF is connected to nodes IQY, WRV.
Node QJI is connected to nodes BAK, IKR.
Node XHJ is connected to node PTZ.
Node IKR is connected to node QJI.
Node UKF is connected to nodes WRV, XPV.
Node XPV is connected to node UKF.","[IQY, FXE, WCP, UKF, WRV, XPV, IKR, XHJ, BAK, QJI, BLA, PTZ, CRJ, JYF]",14,14,False,What is the degree of node XPV?,1,"Let's solve this problem step by step.
The neighbors of node XPV are: [UKF], and there are 1 neighbor nodes.
So the degree of node XPV is ","('[10, 0, 1, 3]',)",2,71
degree,"[(TBC, QME), (TBC, GYA), (TBC, QMW), (TBC, SBV), (TBC, QHT), (TBC, NGQ), (TBC, DTT), (QME, QHT), (QME, FCQ), (QME, YAZ), (GYA, FCQ), (GYA, DTT), (GYA, QMW), (QMW, YAZ), (QMW, IXF), (SBV, YAZ), (QHT, QNX), (NGQ, YAZ), (YAZ, QNX), (YAZ, IXF)]","{TBC: [QME, GYA, QMW, SBV, QHT, NGQ, DTT],
QME: [TBC, QHT, FCQ, YAZ],
GYA: [TBC, FCQ, DTT, QMW],
QMW: [TBC, GYA, YAZ, IXF],
SBV: [TBC, YAZ],
QHT: [TBC, QME, QNX],
NGQ: [TBC, YAZ],
DTT: [TBC, GYA],
FCQ: [QME, GYA],
YAZ: [QME, QMW, NGQ, QNX, IXF, SBV],
QNX: [QHT, YAZ],
IXF: [QMW, YAZ]}","Node TBC is connected to nodes QME, GYA, QMW, SBV, QHT, NGQ, DTT.
Node QME is connected to nodes TBC, QHT, FCQ, YAZ.
Node GYA is connected to nodes TBC, FCQ, DTT, QMW.
Node QMW is connected to nodes TBC, GYA, YAZ, IXF.
Node SBV is connected to nodes TBC, YAZ.
Node QHT is connected to nodes TBC, QME, QNX.
Node NGQ is connected to nodes TBC, YAZ.
Node DTT is connected to nodes TBC, GYA.
Node FCQ is connected to nodes QME, GYA.
Node YAZ is connected to nodes QME, QMW, NGQ, QNX, IXF, SBV.
Node QNX is connected to nodes QHT, YAZ.
Node IXF is connected to nodes QMW, YAZ.","[TBC, QHT, DTT, QME, IXF, QMW, FCQ, NGQ, GYA, SBV, QNX, YAZ]",12,20,False,What is the degree of node NGQ?,2,"Let's solve this problem step by step.
The neighbors of node NGQ are: [TBC, YAZ], and there are 2 neighbor nodes.
So the degree of node NGQ is ","('[3, 0, 9, 2]',)",3,72
degree,"[(EIP, ZXB), (EIP, SVA), (EIP, OXE), (EIP, QIK), (ZXB, UQA), (ZXB, JGP), (ZXB, SVA), (ZXB, URJ), (SVA, JGP), (SVA, URJ), (SVA, QIK), (OXE, ZLF), (OXE, QIK), (QIK, JGP), (QIK, WSK), (UQA, JGP), (UQA, URJ), (UQA, WSK), (JGP, ZLF), (JGP, UFK), (URJ, EUT), (WSK, ZLF), (ZLF, UFK), (ZLF, EUT)]","{EIP: [ZXB, SVA, OXE, QIK],
ZXB: [EIP, UQA, JGP, SVA, URJ],
SVA: [EIP, ZXB, JGP, URJ, QIK],
OXE: [EIP, ZLF, QIK],
QIK: [EIP, JGP, SVA, OXE, WSK],
UQA: [ZXB, JGP, URJ, WSK],
JGP: [ZXB, UQA, SVA, ZLF, QIK, UFK],
URJ: [ZXB, UQA, SVA, EUT],
WSK: [UQA, ZLF, QIK],
ZLF: [JGP, OXE, UFK, WSK, EUT],
UFK: [JGP, ZLF],
EUT: [ZLF, URJ]}","Node EIP is connected to nodes ZXB, SVA, OXE, QIK.
Node ZXB is connected to nodes EIP, UQA, JGP, SVA, URJ.
Node SVA is connected to nodes EIP, ZXB, JGP, URJ, QIK.
Node OXE is connected to nodes EIP, ZLF, QIK.
Node QIK is connected to nodes EIP, JGP, SVA, OXE, WSK.
Node UQA is connected to nodes ZXB, JGP, URJ, WSK.
Node JGP is connected to nodes ZXB, UQA, SVA, ZLF, QIK, UFK.
Node URJ is connected to nodes ZXB, UQA, SVA, EUT.
Node WSK is connected to nodes UQA, ZLF, QIK.
Node ZLF is connected to nodes JGP, OXE, UFK, WSK, EUT.
Node UFK is connected to nodes JGP, ZLF.
Node EUT is connected to nodes ZLF, URJ.","[UFK, JGP, SVA, EUT, QIK, EIP, UQA, OXE, ZLF, URJ, WSK, ZXB]",12,24,False,What is the degree of node EIP?,4,"Let's solve this problem step by step.
The neighbors of node EIP are: [ZXB, SVA, OXE, QIK], and there are 4 neighbor nodes.
So the degree of node EIP is ","('[1, 0, 2, 4]',)",3,73
degree,"[(TLX, BJS), (BJS, FYY), (HLP, FYY), (HLP, MXU), (HLP, FBV), (MXU, FBJ), (MXU, TLX), (MXU, KME), (FBV, YDL), (RRC, KME), (RRC, MXU), (RRC, FBV), (RRC, TLX), (KME, FBV), (FBJ, HLP), (AGF, KME), (AGF, TGZ), (YDL, TGZ), (YDL, BJS), (YDL, DZN), (DZN, FBJ), (DZN, TGZ), (XUY, HLP), (XUY, RRC)]","{TLX: [BJS],
BJS: [FYY],
HLP: [FYY, MXU, FBV],
FYY: [],
MXU: [FBJ, TLX, KME],
FBV: [YDL],
RRC: [KME, MXU, FBV, TLX],
KME: [FBV],
FBJ: [HLP],
AGF: [KME, TGZ],
TGZ: [],
YDL: [TGZ, BJS, DZN],
DZN: [FBJ, TGZ],
XUY: [HLP, RRC]}","Node TLX is connected to node BJS.
Node BJS is connected to node FYY.
Node HLP is connected to nodes FYY, MXU, FBV.
Node MXU is connected to nodes FBJ, TLX, KME.
Node FBV is connected to node YDL.
Node RRC is connected to nodes KME, MXU, FBV, TLX.
Node KME is connected to node FBV.
Node FBJ is connected to node HLP.
Node AGF is connected to nodes KME, TGZ.
Node YDL is connected to nodes TGZ, BJS, DZN.
Node DZN is connected to nodes FBJ, TGZ.
Node XUY is connected to nodes HLP, RRC.","[MXU, RRC, HLP, DZN, BJS, TLX, YDL, AGF, KME, FBJ, FBV, XUY, FYY, TGZ]",14,24,True,What is the out-degree of node XUY?,2,"Let's solve this problem step by step.
The successors of node XUY are: [HLP, RRC], and there are 2 successor nodes.
So the degree of node XUY is ","('[2, 3, 4, 0]',)",0,74
degree,"[(MKA, MRN), (MKA, OKM), (MKA, VNK), (MKA, WWO), (MRN, VNK), (MRN, TYM), (OKM, WAN), (OKM, TYM), (OKM, VNK), (VNK, YCI), (VNK, TYM), (WWO, WAN), (WWO, KNM), (TYM, YCI), (TYM, OSF), (WAN, KNM), (WAN, OSF), (KNM, YCI), (KNM, OSF), (OSF, YCI)]","{MKA: [MRN, OKM, VNK, WWO],
MRN: [MKA, VNK, TYM],
OKM: [MKA, WAN, TYM, VNK],
VNK: [MKA, MRN, OKM, YCI, TYM],
WWO: [MKA, WAN, KNM],
TYM: [MRN, OKM, VNK, YCI, OSF],
WAN: [OKM, KNM, OSF, WWO],
KNM: [WAN, YCI, WWO, OSF],
OSF: [WAN, YCI, TYM, KNM],
YCI: [VNK, TYM, KNM, OSF]}","Node MKA is connected to nodes MRN, OKM, VNK, WWO.
Node MRN is connected to nodes MKA, VNK, TYM.
Node OKM is connected to nodes MKA, WAN, TYM, VNK.
Node VNK is connected to nodes MKA, MRN, OKM, YCI, TYM.
Node WWO is connected to nodes MKA, WAN, KNM.
Node TYM is connected to nodes MRN, OKM, VNK, YCI, OSF.
Node WAN is connected to nodes OKM, KNM, OSF, WWO.
Node KNM is connected to nodes WAN, YCI, WWO, OSF.
Node OSF is connected to nodes WAN, YCI, TYM, KNM.
Node YCI is connected to nodes VNK, TYM, KNM, OSF.","[MRN, YCI, OKM, MKA, WAN, OSF, WWO, VNK, KNM, TYM]",10,20,False,What is the degree of node MKA?,4,"Let's solve this problem step by step.
The neighbors of node MKA are: [MRN, OKM, VNK, WWO], and there are 4 neighbor nodes.
So the degree of node MKA is ","('[5, 1, 4, 0]',)",2,75
degree,"[(XVG, QND), (XVG, QJU), (XVG, HGY), (XVG, GFB), (XVG, NTT), (XVG, UID), (QND, HGY), (QND, GFB), (QND, NTT), (QND, ZFT), (QND, GWS), (QND, VCR), (QND, XVG), (QJU, FJT), (QJU, GFB), (QJU, UID), (QJU, GWS), (QJU, VCR), (QJU, XVG), (HGY, NTT), (HGY, DMQ), (HGY, QND), (GFB, ZFT), (GFB, UID), (GFB, GWS), (GFB, DMQ), (GFB, QND), (GFB, ICM), (GFB, HGY), (NTT, ZFT), (NTT, UID), (NTT, DMQ), (NTT, XVG), (NTT, QJU), (NTT, GFB), (UID, XVG), (UID, ICM), (UID, HGY), (UID, ZFT), (ZFT, GWS), (ZFT, VCR), (ZFT, QND), (ZFT, FJT), (ZFT, NTT), (GWS, DMQ), (GWS, XVG), (GWS, QND), (GWS, ICM), (GWS, QJU), (GWS, GFB), (GWS, NTT), (VCR, XVG), (VCR, ICM), (VCR, QJU), (VCR, FJT), (VCR, NTT), (ICM, FJT), (ICM, ZFT), (ICM, UID), (ICM, DMQ), (ICM, VCR), (ICM, XVG), (ICM, QND), (FJT, UID), (FJT, VCR), (FJT, XVG), (FJT, ICM), (DMQ, QJU), (DMQ, GFB), (DMQ, ZFT)]","{XVG: [QND, QJU, HGY, GFB, NTT, UID],
QND: [HGY, GFB, NTT, ZFT, GWS, VCR, XVG],
QJU: [FJT, GFB, UID, GWS, VCR, XVG],
HGY: [NTT, DMQ, QND],
GFB: [ZFT, UID, GWS, DMQ, QND, ICM, HGY],
NTT: [ZFT, UID, DMQ, XVG, QJU, GFB],
UID: [XVG, ICM, HGY, ZFT],
ZFT: [GWS, VCR, QND, FJT, NTT],
GWS: [DMQ, XVG, QND, ICM, QJU, GFB, NTT],
VCR: [XVG, ICM, QJU, FJT, NTT],
ICM: [FJT, ZFT, UID, DMQ, VCR, XVG, QND],
FJT: [UID, VCR, XVG, ICM],
DMQ: [QJU, GFB, ZFT]}","Node XVG is connected to nodes QND, QJU, HGY, GFB, NTT, UID.
Node QND is connected to nodes HGY, GFB, NTT, ZFT, GWS, VCR, XVG.
Node QJU is connected to nodes FJT, GFB, UID, GWS, VCR, XVG.
Node HGY is connected to nodes NTT, DMQ, QND.
Node GFB is connected to nodes ZFT, UID, GWS, DMQ, QND, ICM, HGY.
Node NTT is connected to nodes ZFT, UID, DMQ, XVG, QJU, GFB.
Node UID is connected to nodes XVG, ICM, HGY, ZFT.
Node ZFT is connected to nodes GWS, VCR, QND, FJT, NTT.
Node GWS is connected to nodes DMQ, XVG, QND, ICM, QJU, GFB, NTT.
Node VCR is connected to nodes XVG, ICM, QJU, FJT, NTT.
Node ICM is connected to nodes FJT, ZFT, UID, DMQ, VCR, XVG, QND.
Node FJT is connected to nodes UID, VCR, XVG, ICM.
Node DMQ is connected to nodes QJU, GFB, ZFT.","[VCR, NTT, QND, ICM, HGY, GWS, ZFT, DMQ, QJU, FJT, GFB, XVG, UID]",13,70,True,What is the out-degree of node QND?,7,"Let's solve this problem step by step.
The successors of node QND are: [HGY, GFB, NTT, ZFT, GWS, VCR, XVG], and there are 7 successor nodes.
So the degree of node QND is ","('[0, 7, 1, 6]',)",1,76
degree,"[(RJB, XHY), (RJB, XWP), (RJB, XGS), (RJB, QUE), (RJB, TCZ), (RJB, OKA), (RJB, DOR), (XHY, XWP), (XHY, BFZ), (XHY, XGS), (XHY, TCZ), (XHY, GAO), (XHY, OKA), (XHY, UXZ), (XHY, DOR), (XWP, BFZ), (XWP, XGS), (XWP, QUE), (XWP, TCZ), (XWP, GAO), (XWP, OKA), (XWP, DOR), (XGS, BFZ), (XGS, QUE), (XGS, GAO), (XGS, YBJ), (XGS, OKA), (XGS, DOR), (QUE, BFZ), (QUE, TCZ), (QUE, GAO), (QUE, OKA), (QUE, UXZ), (QUE, DOR), (TCZ, BFZ), (TCZ, UXZ), (TCZ, DOR), (OKA, BFZ), (OKA, YBJ), (DOR, BFZ), (DOR, GAO), (DOR, YBJ), (BFZ, GAO), (BFZ, YBJ), (BFZ, UXZ), (GAO, UXZ), (UXZ, YBJ)]","{RJB: [XHY, XWP, XGS, QUE, TCZ, OKA, DOR],
XHY: [RJB, XWP, BFZ, XGS, TCZ, GAO, OKA, UXZ, DOR],
XWP: [RJB, XHY, BFZ, XGS, QUE, TCZ, GAO, OKA, DOR],
XGS: [RJB, XHY, XWP, BFZ, QUE, GAO, YBJ, OKA, DOR],
QUE: [RJB, XWP, BFZ, XGS, TCZ, GAO, OKA, UXZ, DOR],
TCZ: [RJB, XHY, XWP, BFZ, QUE, UXZ, DOR],
OKA: [RJB, XHY, XWP, BFZ, XGS, QUE, YBJ],
DOR: [RJB, XHY, XWP, BFZ, XGS, QUE, TCZ, GAO, YBJ],
BFZ: [XHY, XWP, XGS, QUE, TCZ, GAO, YBJ, OKA, UXZ, DOR],
GAO: [XHY, XWP, BFZ, XGS, QUE, UXZ, DOR],
UXZ: [XHY, BFZ, QUE, TCZ, GAO, YBJ],
YBJ: [BFZ, XGS, OKA, UXZ, DOR]}","Node RJB is connected to nodes XHY, XWP, XGS, QUE, TCZ, OKA, DOR.
Node XHY is connected to nodes RJB, XWP, BFZ, XGS, TCZ, GAO, OKA, UXZ, DOR.
Node XWP is connected to nodes RJB, XHY, BFZ, XGS, QUE, TCZ, GAO, OKA, DOR.
Node XGS is connected to nodes RJB, XHY, XWP, BFZ, QUE, GAO, YBJ, OKA, DOR.
Node QUE is connected to nodes RJB, XWP, BFZ, XGS, TCZ, GAO, OKA, UXZ, DOR.
Node TCZ is connected to nodes RJB, XHY, XWP, BFZ, QUE, UXZ, DOR.
Node OKA is connected to nodes RJB, XHY, XWP, BFZ, XGS, QUE, YBJ.
Node DOR is connected to nodes RJB, XHY, XWP, BFZ, XGS, QUE, TCZ, GAO, YBJ.
Node BFZ is connected to nodes XHY, XWP, XGS, QUE, TCZ, GAO, YBJ, OKA, UXZ, DOR.
Node GAO is connected to nodes XHY, XWP, BFZ, XGS, QUE, UXZ, DOR.
Node UXZ is connected to nodes XHY, BFZ, QUE, TCZ, GAO, YBJ.
Node YBJ is connected to nodes BFZ, XGS, OKA, UXZ, DOR.","[XGS, OKA, GAO, UXZ, XWP, DOR, QUE, YBJ, RJB, BFZ, XHY, TCZ]",12,47,False,What is the degree of node RJB?,7,"Let's solve this problem step by step.
The neighbors of node RJB are: [XHY, XWP, XGS, QUE, TCZ, OKA, DOR], and there are 7 neighbor nodes.
So the degree of node RJB is ","('[7, 6, 1, 0]',)",0,77
degree,"[(RXT, JZW), (RXT, LWI), (JZW, BHX), (JZW, UHF), (LWI, UFH), (BHX, GDQ), (UHF, YIP), (UFH, LOL), (YIP, PHK), (YIP, EMJ), (PHK, BTG), (EMJ, BTG)]","{RXT: [JZW, LWI],
JZW: [RXT, BHX, UHF],
LWI: [RXT, UFH],
BHX: [JZW, GDQ],
UHF: [JZW, YIP],
UFH: [LWI, LOL],
LOL: [UFH],
GDQ: [BHX],
YIP: [PHK, UHF, EMJ],
PHK: [YIP, BTG],
EMJ: [YIP, BTG],
BTG: [PHK, EMJ]}","Node RXT is connected to nodes JZW, LWI.
Node JZW is connected to nodes RXT, BHX, UHF.
Node LWI is connected to nodes RXT, UFH.
Node BHX is connected to nodes JZW, GDQ.
Node UHF is connected to nodes JZW, YIP.
Node UFH is connected to nodes LWI, LOL.
Node LOL is connected to node UFH.
Node GDQ is connected to node BHX.
Node YIP is connected to nodes PHK, UHF, EMJ.
Node PHK is connected to nodes YIP, BTG.
Node EMJ is connected to nodes YIP, BTG.
Node BTG is connected to nodes PHK, EMJ.","[BHX, BTG, YIP, LWI, UFH, EMJ, RXT, PHK, JZW, UHF, GDQ, LOL]",12,12,False,What is the degree of node EMJ?,2,"Let's solve this problem step by step.
The neighbors of node EMJ are: [YIP, BTG], and there are 2 neighbor nodes.
So the degree of node EMJ is ","('[2, 0, 7, 4]',)",0,78
degree,"[(ECN, VCV), (ECN, HSV), (ECN, JOK), (ECN, UAA), (VCV, OLJ), (VCV, FSY), (VCV, GKY), (HSV, HUO), (HSV, JTD), (HSV, CXT), (HSV, FSY), (HSV, GKY), (HSV, UAA), (HSV, RZL), (JOK, FSY), (UAA, OLJ), (UAA, GKY), (OLJ, HUO), (OLJ, RZL), (FSY, RZL), (GKY, HUO), (GKY, JTD), (HUO, JTD), (HUO, RZL), (RZL, JTD), (RZL, CXT)]","{ECN: [VCV, HSV, JOK, UAA],
VCV: [ECN, OLJ, FSY, GKY],
HSV: [ECN, HUO, JTD, CXT, FSY, GKY, UAA, RZL],
JOK: [ECN, FSY],
UAA: [ECN, OLJ, HSV, GKY],
OLJ: [VCV, HUO, UAA, RZL],
FSY: [VCV, HSV, JOK, RZL],
GKY: [VCV, HSV, HUO, JTD, UAA],
HUO: [OLJ, HSV, JTD, GKY, RZL],
RZL: [OLJ, HSV, HUO, JTD, CXT, FSY],
JTD: [HSV, HUO, GKY, RZL],
CXT: [HSV, RZL]}","Node ECN is connected to nodes VCV, HSV, JOK, UAA.
Node VCV is connected to nodes ECN, OLJ, FSY, GKY.
Node HSV is connected to nodes ECN, HUO, JTD, CXT, FSY, GKY, UAA, RZL.
Node JOK is connected to nodes ECN, FSY.
Node UAA is connected to nodes ECN, OLJ, HSV, GKY.
Node OLJ is connected to nodes VCV, HUO, UAA, RZL.
Node FSY is connected to nodes VCV, HSV, JOK, RZL.
Node GKY is connected to nodes VCV, HSV, HUO, JTD, UAA.
Node HUO is connected to nodes OLJ, HSV, JTD, GKY, RZL.
Node RZL is connected to nodes OLJ, HSV, HUO, JTD, CXT, FSY.
Node JTD is connected to nodes HSV, HUO, GKY, RZL.
Node CXT is connected to nodes HSV, RZL.","[HUO, JOK, CXT, ECN, UAA, VCV, RZL, HSV, OLJ, JTD, GKY, FSY]",12,26,False,What is the degree of node JTD?,4,"Let's solve this problem step by step.
The neighbors of node JTD are: [HSV, HUO, GKY, RZL], and there are 4 neighbor nodes.
So the degree of node JTD is ","('[4, 6, 0, 7]',)",0,79
degree,"[(VII, YLV), (VII, VCZ), (VII, BAF), (YLV, FCH), (VCZ, BAF), (VCZ, FCH), (VCZ, CFM), (VCZ, ISL), (VCZ, UWI), (VCZ, SKZ), (VCZ, TGO), (BAF, NKV), (BAF, YOA), (BAF, UWI), (FCH, YOA), (FCH, TGO), (FCH, FFE), (NKV, CFM), (YOA, CFM), (YOA, ISL), (CFM, FFE), (CFM, SKZ)]","{VII: [YLV, VCZ, BAF],
YLV: [VII, FCH],
VCZ: [VII, BAF, FCH, CFM, ISL, UWI, SKZ, TGO],
BAF: [VII, NKV, YOA, UWI, VCZ],
FCH: [YLV, YOA, TGO, VCZ, FFE],
NKV: [BAF, CFM],
YOA: [BAF, FCH, CFM, ISL],
UWI: [BAF, VCZ],
CFM: [NKV, FFE, VCZ, YOA, SKZ],
TGO: [FCH, VCZ],
FFE: [FCH, CFM],
SKZ: [CFM, VCZ],
ISL: [YOA, VCZ]}","Node VII is connected to nodes YLV, VCZ, BAF.
Node YLV is connected to nodes VII, FCH.
Node VCZ is connected to nodes VII, BAF, FCH, CFM, ISL, UWI, SKZ, TGO.
Node BAF is connected to nodes VII, NKV, YOA, UWI, VCZ.
Node FCH is connected to nodes YLV, YOA, TGO, VCZ, FFE.
Node NKV is connected to nodes BAF, CFM.
Node YOA is connected to nodes BAF, FCH, CFM, ISL.
Node UWI is connected to nodes BAF, VCZ.
Node CFM is connected to nodes NKV, FFE, VCZ, YOA, SKZ.
Node TGO is connected to nodes FCH, VCZ.
Node FFE is connected to nodes FCH, CFM.
Node SKZ is connected to nodes CFM, VCZ.
Node ISL is connected to nodes YOA, VCZ.","[YOA, ISL, VII, VCZ, UWI, CFM, FFE, NKV, YLV, FCH, SKZ, TGO, BAF]",13,22,False,What is the degree of node VCZ?,8,"Let's solve this problem step by step.
The neighbors of node VCZ are: [VII, BAF, FCH, CFM, ISL, UWI, SKZ, TGO], and there are 8 neighbor nodes.
So the degree of node VCZ is ","('[9, 0, 8, 1]',)",2,80
degree,"[(CNE, MLH), (CNE, WEP), (CNE, QQZ), (CNE, MHC), (CNE, XVB), (CNE, LTT), (MLH, WEP), (MLH, ZQX), (MLH, QQZ), (MLH, MHC), (WEP, QQZ), (WEP, LTT), (WEP, MLH), (WEP, FWJ), (QQZ, MHC), (QQZ, GIS), (QQZ, LTT), (QQZ, CNE), (QQZ, KNA), (MHC, GIS), (MHC, CNE), (XVB, CNE), (XVB, MLH), (LTT, GER), (LTT, KNA), (LTT, WEP), (LTT, ZQX), (ZQX, QQZ), (ZQX, MTE), (ZQX, GIS), (GER, KNA), (GER, QQZ), (GER, MHC), (GER, LTT), (GER, CNE), (KNA, LTT), (FWJ, GIS), (FWJ, MLH), (GIS, CNE), (GIS, GER), (GIS, MHC), (GIS, MTE), (MTE, LTT), (MTE, CNE), (MTE, MLH), (MTE, GER), (MTE, FWJ), (MTE, WEP)]","{CNE: [MLH, WEP, QQZ, MHC, XVB, LTT],
MLH: [WEP, ZQX, QQZ, MHC],
WEP: [QQZ, LTT, MLH, FWJ],
QQZ: [MHC, GIS, LTT, CNE, KNA],
MHC: [GIS, CNE],
XVB: [CNE, MLH],
LTT: [GER, KNA, WEP, ZQX],
ZQX: [QQZ, MTE, GIS],
GER: [KNA, QQZ, MHC, LTT, CNE],
KNA: [LTT],
FWJ: [GIS, MLH],
GIS: [CNE, GER, MHC, MTE],
MTE: [LTT, CNE, MLH, GER, FWJ, WEP]}","Node CNE is connected to nodes MLH, WEP, QQZ, MHC, XVB, LTT.
Node MLH is connected to nodes WEP, ZQX, QQZ, MHC.
Node WEP is connected to nodes QQZ, LTT, MLH, FWJ.
Node QQZ is connected to nodes MHC, GIS, LTT, CNE, KNA.
Node MHC is connected to nodes GIS, CNE.
Node XVB is connected to nodes CNE, MLH.
Node LTT is connected to nodes GER, KNA, WEP, ZQX.
Node ZQX is connected to nodes QQZ, MTE, GIS.
Node GER is connected to nodes KNA, QQZ, MHC, LTT, CNE.
Node KNA is connected to node LTT.
Node FWJ is connected to nodes GIS, MLH.
Node GIS is connected to nodes CNE, GER, MHC, MTE.
Node MTE is connected to nodes LTT, CNE, MLH, GER, FWJ, WEP.","[FWJ, MHC, GIS, WEP, ZQX, QQZ, CNE, LTT, MTE, MLH, GER, KNA, XVB]",13,48,True,What is the out-degree of node LTT?,4,"Let's solve this problem step by step.
The successors of node LTT are: [GER, KNA, WEP, ZQX], and there are 4 successor nodes.
So the degree of node LTT is ","('[0, 4, 5, 10]',)",1,81
degree,"[(EMM, KUD), (EMM, FPD), (EMM, EEY), (EMM, PPY), (KUD, SIF), (KUD, ADH), (KUD, XHV), (FPD, SIF), (FPD, VYM), (FPD, ADH), (FPD, HIR), (FPD, EQG), (FPD, PPY), (FPD, LUE), (EEY, SIF), (EEY, VYM), (EEY, XHV), (EEY, ADH), (PPY, XHV), (PPY, ADH), (PPY, EQG), (ADH, VYM), (ADH, XHV), (ADH, LUE), (ADH, EQG), (ADH, XLG), (ADH, ORD), (XHV, VYM), (XHV, ORD), (VYM, ORD), (VYM, LUE), (VYM, HIR), (HIR, XLG)]","{EMM: [KUD, FPD, EEY, PPY],
KUD: [EMM, SIF, ADH, XHV],
FPD: [EMM, SIF, VYM, ADH, HIR, EQG, PPY, LUE],
EEY: [EMM, SIF, VYM, XHV, ADH],
PPY: [EMM, FPD, XHV, ADH, EQG],
SIF: [KUD, FPD, EEY],
ADH: [KUD, FPD, EEY, VYM, XHV, LUE, EQG, XLG, ORD, PPY],
XHV: [KUD, EEY, VYM, ADH, PPY, ORD],
VYM: [FPD, EEY, XHV, ORD, ADH, LUE, HIR],
HIR: [FPD, VYM, XLG],
EQG: [FPD, ADH, PPY],
LUE: [FPD, VYM, ADH],
ORD: [VYM, XHV, ADH],
XLG: [ADH, HIR]}","Node EMM is connected to nodes KUD, FPD, EEY, PPY.
Node KUD is connected to nodes EMM, SIF, ADH, XHV.
Node FPD is connected to nodes EMM, SIF, VYM, ADH, HIR, EQG, PPY, LUE.
Node EEY is connected to nodes EMM, SIF, VYM, XHV, ADH.
Node PPY is connected to nodes EMM, FPD, XHV, ADH, EQG.
Node SIF is connected to nodes KUD, FPD, EEY.
Node ADH is connected to nodes KUD, FPD, EEY, VYM, XHV, LUE, EQG, XLG, ORD, PPY.
Node XHV is connected to nodes KUD, EEY, VYM, ADH, PPY, ORD.
Node VYM is connected to nodes FPD, EEY, XHV, ORD, ADH, LUE, HIR.
Node HIR is connected to nodes FPD, VYM, XLG.
Node EQG is connected to nodes FPD, ADH, PPY.
Node LUE is connected to nodes FPD, VYM, ADH.
Node ORD is connected to nodes VYM, XHV, ADH.
Node XLG is connected to nodes ADH, HIR.","[XLG, XHV, EEY, FPD, PPY, ORD, EQG, LUE, SIF, KUD, ADH, EMM, VYM, HIR]",14,33,False,What is the degree of node FPD?,8,"Let's solve this problem step by step.
The neighbors of node FPD are: [EMM, SIF, VYM, ADH, HIR, EQG, PPY, LUE], and there are 8 neighbor nodes.
So the degree of node FPD is ","('[0, 10, 9, 8]',)",3,82
