task,graph,graph_adj,graph_nl,nodes,num_nodes,num_edges,directed,question,answer,steps,choices,label,id
degree,"[(EGX, CZF), (EGX, CVM), (EGX, EOH), (CZF, CVM), (CZF, EOH), (CZF, JJC), (CZF, RRE), (CZF, JEO), (CVM, JJC), (CVM, RRE), (CVM, CZF), (EOH, JEO), (EOH, CZF), (EOH, CVM), (JJC, CIF), (JJC, RRE), (JJC, CVM), (JJC, EGX), (CIF, JEO), (CIF, CZF), (CIF, CVM), (CIF, EOH), (RRE, CVM), (RRE, EOH), (JEO, CVM), (JEO, CIF)]","{EGX: [CZF, CVM, EOH],
CZF: [CVM, EOH, JJC, RRE, JEO],
CVM: [JJC, RRE, CZF],
EOH: [JEO, CZF, CVM],
JJC: [CIF, RRE, CVM, EGX],
CIF: [JEO, CZF, CVM, EOH],
RRE: [CVM, EOH],
JEO: [CVM, CIF]}","Node EGX is connected to nodes CZF, CVM, EOH.
Node CZF is connected to nodes CVM, EOH, JJC, RRE, JEO.
Node CVM is connected to nodes JJC, RRE, CZF.
Node EOH is connected to nodes JEO, CZF, CVM.
Node JJC is connected to nodes CIF, RRE, CVM, EGX.
Node CIF is connected to nodes JEO, CZF, CVM, EOH.
Node RRE is connected to nodes CVM, EOH.
Node JEO is connected to nodes CVM, CIF.","[CZF, EOH, EGX, CIF, CVM, RRE, JEO, JJC]",8,26,True,What is the out-degree of node CZF?,5,"Let's solve this problem step by step.
The successors of node CZF are: [CVM, EOH, JJC, RRE, JEO], and there are 5 successor nodes.
So the degree of node CZF is ","('[5, 0, 6, 9]',)",0,229
degree,"[(ANR, NDO), (ANR, VHT), (NDO, FEW), (NDO, XTK), (NDO, TTZ), (NDO, JCY), (NDO, QHC), (NDO, RKE), (NDO, AXA), (TTZ, XQC), (JCY, GVL), (JCY, XNR), (XNR, YNF)]","{ANR: [NDO, VHT],
NDO: [ANR, FEW, XTK, TTZ, JCY, QHC, RKE, AXA],
VHT: [ANR],
FEW: [NDO],
XTK: [NDO],
TTZ: [NDO, XQC],
JCY: [NDO, GVL, XNR],
QHC: [NDO],
RKE: [NDO],
AXA: [NDO],
GVL: [JCY],
XNR: [JCY, YNF],
XQC: [TTZ],
YNF: [XNR]}","Node ANR is connected to nodes NDO, VHT.
Node NDO is connected to nodes ANR, FEW, XTK, TTZ, JCY, QHC, RKE, AXA.
Node VHT is connected to node ANR.
Node FEW is connected to node NDO.
Node XTK is connected to node NDO.
Node TTZ is connected to nodes NDO, XQC.
Node JCY is connected to nodes NDO, GVL, XNR.
Node QHC is connected to node NDO.
Node RKE is connected to node NDO.
Node AXA is connected to node NDO.
Node GVL is connected to node JCY.
Node XNR is connected to nodes JCY, YNF.
Node XQC is connected to node TTZ.
Node YNF is connected to node XNR.","[XTK, ANR, XNR, TTZ, NDO, YNF, QHC, VHT, JCY, GVL, RKE, AXA, XQC, FEW]",14,13,False,What is the degree of node ANR?,2,"Let's solve this problem step by step.
The neighbors of node ANR are: [NDO, VHT], and there are 2 neighbor nodes.
So the degree of node ANR is ","('[10, 2, 4, 0]',)",1,230
degree,"[(IHW, XRW), (IHW, CRT), (IHW, EYS), (IHW, KDB), (IHW, JEA), (XRW, EYS), (XRW, KDB), (CRT, EYS), (CRT, BFM), (CRT, FZI), (CRT, XRW), (EYS, BFM), (KDB, FZI), (KDB, XRW), (KDB, CRT), (JEA, IHW), (JEA, XRW), (JEA, EYS), (JEA, KDB), (FZI, XRW), (FZI, KDB), (FZI, BFM), (BFM, XRW), (BFM, CRT), (BFM, KDB), (LJZ, IHW), (LJZ, XRW), (LJZ, EYS)]","{IHW: [XRW, CRT, EYS, KDB, JEA],
XRW: [EYS, KDB],
CRT: [EYS, BFM, FZI, XRW],
EYS: [BFM],
KDB: [FZI, XRW, CRT],
JEA: [IHW, XRW, EYS, KDB],
FZI: [XRW, KDB, BFM],
BFM: [XRW, CRT, KDB],
LJZ: [IHW, XRW, EYS]}","Node IHW is connected to nodes XRW, CRT, EYS, KDB, JEA.
Node XRW is connected to nodes EYS, KDB.
Node CRT is connected to nodes EYS, BFM, FZI, XRW.
Node EYS is connected to node BFM.
Node KDB is connected to nodes FZI, XRW, CRT.
Node JEA is connected to nodes IHW, XRW, EYS, KDB.
Node FZI is connected to nodes XRW, KDB, BFM.
Node BFM is connected to nodes XRW, CRT, KDB.
Node LJZ is connected to nodes IHW, XRW, EYS.","[CRT, FZI, JEA, IHW, LJZ, KDB, BFM, XRW, EYS]",9,28,True,What is the out-degree of node LJZ?,3,"Let's solve this problem step by step.
The successors of node LJZ are: [IHW, XRW, EYS], and there are 3 successor nodes.
So the degree of node LJZ is ","('[3, 0, 4, 9]',)",0,231
degree,"[(NDF, UJW), (NDF, YQB), (NDF, TJT), (NDF, DWB), (NDF, SOI), (NDF, ERI), (NDF, YNX), (UJW, SOI), (UJW, QFL), (UJW, YNX), (YQB, XZH), (YQB, TJT), (YQB, DWB), (YQB, MAV), (YQB, QFL), (YQB, NIS), (YQB, YNX), (TJT, XZH), (TJT, DWB), (TJT, SOI), (TJT, MAV), (TJT, KXB), (DWB, XZH), (DWB, SOI), (DWB, KXB), (DWB, ERI), (SOI, QFL), (SOI, ERI), (SOI, NIS), (SOI, YNX), (ERI, XZH), (ERI, KXB), (ERI, GOC), (YNX, MAV), (YNX, KXB), (YNX, AET), (QFL, MAV), (QFL, KXB), (QFL, GOC), (QFL, AET), (QFL, NIS), (XZH, MAV), (XZH, KXB), (XZH, AET), (XZH, NIS), (MAV, GOC), (MAV, AET), (KXB, GOC), (KXB, AET), (KXB, NIS), (AET, GOC)]","{NDF: [UJW, YQB, TJT, DWB, SOI, ERI, YNX],
UJW: [NDF, SOI, QFL, YNX],
YQB: [NDF, XZH, TJT, DWB, MAV, QFL, NIS, YNX],
TJT: [NDF, XZH, YQB, DWB, SOI, MAV, KXB],
DWB: [NDF, XZH, YQB, TJT, SOI, KXB, ERI],
SOI: [NDF, UJW, TJT, DWB, QFL, ERI, NIS, YNX],
ERI: [NDF, XZH, DWB, SOI, KXB, GOC],
YNX: [NDF, UJW, YQB, SOI, MAV, KXB, AET],
QFL: [UJW, YQB, SOI, MAV, KXB, GOC, AET, NIS],
XZH: [YQB, TJT, DWB, MAV, KXB, ERI, AET, NIS],
MAV: [XZH, YQB, TJT, QFL, GOC, AET, YNX],
KXB: [XZH, TJT, DWB, QFL, GOC, ERI, AET, NIS, YNX],
AET: [XZH, MAV, QFL, KXB, GOC, YNX],
NIS: [XZH, YQB, SOI, QFL, KXB],
GOC: [MAV, QFL, KXB, ERI, AET]}","Node NDF is connected to nodes UJW, YQB, TJT, DWB, SOI, ERI, YNX.
Node UJW is connected to nodes NDF, SOI, QFL, YNX.
Node YQB is connected to nodes NDF, XZH, TJT, DWB, MAV, QFL, NIS, YNX.
Node TJT is connected to nodes NDF, XZH, YQB, DWB, SOI, MAV, KXB.
Node DWB is connected to nodes NDF, XZH, YQB, TJT, SOI, KXB, ERI.
Node SOI is connected to nodes NDF, UJW, TJT, DWB, QFL, ERI, NIS, YNX.
Node ERI is connected to nodes NDF, XZH, DWB, SOI, KXB, GOC.
Node YNX is connected to nodes NDF, UJW, YQB, SOI, MAV, KXB, AET.
Node QFL is connected to nodes UJW, YQB, SOI, MAV, KXB, GOC, AET, NIS.
Node XZH is connected to nodes YQB, TJT, DWB, MAV, KXB, ERI, AET, NIS.
Node MAV is connected to nodes XZH, YQB, TJT, QFL, GOC, AET, YNX.
Node KXB is connected to nodes XZH, TJT, DWB, QFL, GOC, ERI, AET, NIS, YNX.
Node AET is connected to nodes XZH, MAV, QFL, KXB, GOC, YNX.
Node NIS is connected to nodes XZH, YQB, SOI, QFL, KXB.
Node GOC is connected to nodes MAV, QFL, KXB, ERI, AET.","[AET, NDF, KXB, YNX, ERI, TJT, MAV, NIS, SOI, QFL, DWB, GOC, XZH, UJW, YQB]",15,51,False,What is the degree of node UJW?,4,"Let's solve this problem step by step.
The neighbors of node UJW are: [NDF, SOI, QFL, YNX], and there are 4 neighbor nodes.
So the degree of node UJW is ","('[4, 7, 0, 2]',)",0,232
degree,"[(DEX, VNT), (DEX, FQZ), (DEX, VIH), (DEX, KNF), (VNT, OFF), (VNT, XDZ), (VNT, FQZ), (VNT, ZKT), (VNT, BXC), (VNT, DEX), (FQZ, GIN), (FQZ, KNF), (FQZ, ZKT), (FQZ, BXC), (FQZ, VNT), (FQZ, OFF), (FQZ, XDZ), (VIH, ZKT), (VIH, BXC), (VIH, DEX), (VIH, VNT), (KNF, ZKT), (KNF, DEX), (KNF, VNT), (KNF, XDZ), (KNF, FQZ), (KNF, VIH), (KNF, GIN), (OFF, FQZ), (OFF, VIH), (OFF, ZKT), (OFF, BXC), (XDZ, FQZ), (XDZ, VIH), (XDZ, KNF), (XDZ, ZKT), (XDZ, BXC), (XDZ, DEX), (XDZ, VNT), (ZKT, BXC), (ZKT, VNT), (ZKT, OFF), (ZKT, FQZ), (ZKT, VIH), (ZKT, GIN), (BXC, FQZ), (BXC, VIH), (BXC, KNF), (BXC, ZKT), (GIN, BXC), (GIN, DEX), (GIN, VNT), (GIN, OFF)]","{DEX: [VNT, FQZ, VIH, KNF],
VNT: [OFF, XDZ, FQZ, ZKT, BXC, DEX],
FQZ: [GIN, KNF, ZKT, BXC, VNT, OFF, XDZ],
VIH: [ZKT, BXC, DEX, VNT],
KNF: [ZKT, DEX, VNT, XDZ, FQZ, VIH, GIN],
OFF: [FQZ, VIH, ZKT, BXC],
XDZ: [FQZ, VIH, KNF, ZKT, BXC, DEX, VNT],
ZKT: [BXC, VNT, OFF, FQZ, VIH, GIN],
BXC: [FQZ, VIH, KNF, ZKT],
GIN: [BXC, DEX, VNT, OFF]}","Node DEX is connected to nodes VNT, FQZ, VIH, KNF.
Node VNT is connected to nodes OFF, XDZ, FQZ, ZKT, BXC, DEX.
Node FQZ is connected to nodes GIN, KNF, ZKT, BXC, VNT, OFF, XDZ.
Node VIH is connected to nodes ZKT, BXC, DEX, VNT.
Node KNF is connected to nodes ZKT, DEX, VNT, XDZ, FQZ, VIH, GIN.
Node OFF is connected to nodes FQZ, VIH, ZKT, BXC.
Node XDZ is connected to nodes FQZ, VIH, KNF, ZKT, BXC, DEX, VNT.
Node ZKT is connected to nodes BXC, VNT, OFF, FQZ, VIH, GIN.
Node BXC is connected to nodes FQZ, VIH, KNF, ZKT.
Node GIN is connected to nodes BXC, DEX, VNT, OFF.","[XDZ, BXC, OFF, DEX, VIH, KNF, GIN, FQZ, VNT, ZKT]",10,53,True,What is the out-degree of node VIH?,4,"Let's solve this problem step by step.
The successors of node VIH are: [ZKT, BXC, DEX, VNT], and there are 4 successor nodes.
So the degree of node VIH is ","('[4, 0, 10, 8]',)",0,233
degree,"[(BPL, ZXX), (BPL, HDE), (ZXX, PAJ), (ZXX, HDE), (ZXX, CCJ), (HDE, PAJ), (HDE, QZV), (PAJ, WCZ), (PAJ, CCJ), (WCZ, CQR), (WCZ, AXG), (WCZ, QZV), (WCZ, FKC), (CQR, FKC), (AXG, QZV)]","{BPL: [ZXX, HDE],
ZXX: [BPL, PAJ, HDE, CCJ],
HDE: [BPL, ZXX, PAJ, QZV],
PAJ: [ZXX, HDE, WCZ, CCJ],
CCJ: [ZXX, PAJ],
WCZ: [PAJ, CQR, AXG, QZV, FKC],
CQR: [FKC, WCZ],
FKC: [CQR, WCZ],
AXG: [QZV, WCZ],
QZV: [AXG, HDE, WCZ]}","Node BPL is connected to nodes ZXX, HDE.
Node ZXX is connected to nodes BPL, PAJ, HDE, CCJ.
Node HDE is connected to nodes BPL, ZXX, PAJ, QZV.
Node PAJ is connected to nodes ZXX, HDE, WCZ, CCJ.
Node CCJ is connected to nodes ZXX, PAJ.
Node WCZ is connected to nodes PAJ, CQR, AXG, QZV, FKC.
Node CQR is connected to nodes FKC, WCZ.
Node FKC is connected to nodes CQR, WCZ.
Node AXG is connected to nodes QZV, WCZ.
Node QZV is connected to nodes AXG, HDE, WCZ.","[QZV, PAJ, FKC, BPL, HDE, WCZ, CQR, ZXX, CCJ, AXG]",10,15,False,What is the degree of node AXG?,2,"Let's solve this problem step by step.
The neighbors of node AXG are: [QZV, WCZ], and there are 2 neighbor nodes.
So the degree of node AXG is ","('[0, 4, 1, 2]',)",3,234
degree,"[(WPW, FFU), (FFU, AGU), (FFU, FNF), (FFU, DCC), (DCC, OGS), (DCC, FFU), (DCC, YBC), (DCC, GUX), (OGS, AGU), (OGS, GUX), (YBC, AGU), (YBC, FNF), (YBC, EFM), (YBC, FFU), (GUX, DCC), (GUX, FFU), (AGU, LTI), (AGU, DCC), (AGU, NME), (AGU, YBC), (EFM, FFU), (EFM, IWH), (FNF, NME), (FNF, GUX), (NME, GUX), (QSD, QAZ), (QSD, DCC), (QSD, FFU), (QAZ, LTI), (QAZ, YBC), (LTI, YBC), (LTI, AGU), (LTI, FNF)]","{WPW: [FFU],
FFU: [AGU, FNF, DCC],
DCC: [OGS, FFU, YBC, GUX],
OGS: [AGU, GUX],
YBC: [AGU, FNF, EFM, FFU],
GUX: [DCC, FFU],
AGU: [LTI, DCC, NME, YBC],
EFM: [FFU, IWH],
IWH: [],
FNF: [NME, GUX],
NME: [GUX],
QSD: [QAZ, DCC, FFU],
QAZ: [LTI, YBC],
LTI: [YBC, AGU, FNF]}","Node WPW is connected to node FFU.
Node FFU is connected to nodes AGU, FNF, DCC.
Node DCC is connected to nodes OGS, FFU, YBC, GUX.
Node OGS is connected to nodes AGU, GUX.
Node YBC is connected to nodes AGU, FNF, EFM, FFU.
Node GUX is connected to nodes DCC, FFU.
Node AGU is connected to nodes LTI, DCC, NME, YBC.
Node EFM is connected to nodes FFU, IWH.
Node FNF is connected to nodes NME, GUX.
Node NME is connected to node GUX.
Node QSD is connected to nodes QAZ, DCC, FFU.
Node QAZ is connected to nodes LTI, YBC.
Node LTI is connected to nodes YBC, AGU, FNF.","[LTI, IWH, FNF, GUX, QAZ, YBC, DCC, WPW, OGS, EFM, QSD, FFU, AGU, NME]",14,33,True,What is the out-degree of node EFM?,2,"Let's solve this problem step by step.
The successors of node EFM are: [FFU, IWH], and there are 2 successor nodes.
So the degree of node EFM is ","('[10, 9, 0, 2]',)",3,235
degree,"[(ECU, DFP), (ECU, JLL), (ECU, JQC), (ECU, NPN), (DFP, JLL), (DFP, WIV), (DFP, UVD), (DFP, YAJ), (DFP, PTW), (JLL, FJY), (JLL, WIV), (JLL, JJO), (JLL, DPK), (JLL, PTW), (JLL, DFP), (JQC, WIV), (JQC, XDW), (JQC, YAJ), (JQC, ECU), (JQC, PTW), (NPN, WHC), (NPN, DPK), (NPN, JLL), (NPN, JQC), (PTW, JLL), (PTW, XDW), (PTW, ECU), (XDW, UVD), (XDW, WHC), (XDW, PTW), (XDW, DFP), (XDW, ZAY), (XDW, JQC), (XDW, NPN), (XDW, FJY), (WIV, XDW), (WIV, ECU), (WIV, PTW), (WIV, JQC), (UVD, ECU), (UVD, PTW), (UVD, JQC), (UVD, JJO), (UVD, XDW), (YAJ, ZAY), (YAJ, FJY), (YAJ, XDW), (ZAY, FJY), (ZAY, WIV), (ZAY, JJO), (ZAY, UVD), (ZAY, WHC), (ZAY, DPK), (ZAY, ECU), (ZAY, PTW), (FJY, WHC), (FJY, DPK), (FJY, YAJ), (FJY, DFP), (FJY, JLL), (JJO, XDW), (JJO, ECU), (JJO, PTW), (JJO, DFP), (JJO, FJY), (WHC, YAJ), (WHC, ECU), (WHC, ZAY), (DPK, ECU), (DPK, JLL), (DPK, JQC), (DPK, WHC)]","{ECU: [DFP, JLL, JQC, NPN],
DFP: [JLL, WIV, UVD, YAJ, PTW],
JLL: [FJY, WIV, JJO, DPK, PTW, DFP],
JQC: [WIV, XDW, YAJ, ECU, PTW],
NPN: [WHC, DPK, JLL, JQC],
PTW: [JLL, XDW, ECU],
XDW: [UVD, WHC, PTW, DFP, ZAY, JQC, NPN, FJY],
WIV: [XDW, ECU, PTW, JQC],
UVD: [ECU, PTW, JQC, JJO, XDW],
YAJ: [ZAY, FJY, XDW],
ZAY: [FJY, WIV, JJO, UVD, WHC, DPK, ECU, PTW],
FJY: [WHC, DPK, YAJ, DFP, JLL],
JJO: [XDW, ECU, PTW, DFP, FJY],
WHC: [YAJ, ECU, ZAY],
DPK: [ECU, JLL, JQC, WHC]}","Node ECU is connected to nodes DFP, JLL, JQC, NPN.
Node DFP is connected to nodes JLL, WIV, UVD, YAJ, PTW.
Node JLL is connected to nodes FJY, WIV, JJO, DPK, PTW, DFP.
Node JQC is connected to nodes WIV, XDW, YAJ, ECU, PTW.
Node NPN is connected to nodes WHC, DPK, JLL, JQC.
Node PTW is connected to nodes JLL, XDW, ECU.
Node XDW is connected to nodes UVD, WHC, PTW, DFP, ZAY, JQC, NPN, FJY.
Node WIV is connected to nodes XDW, ECU, PTW, JQC.
Node UVD is connected to nodes ECU, PTW, JQC, JJO, XDW.
Node YAJ is connected to nodes ZAY, FJY, XDW.
Node ZAY is connected to nodes FJY, WIV, JJO, UVD, WHC, DPK, ECU, PTW.
Node FJY is connected to nodes WHC, DPK, YAJ, DFP, JLL.
Node JJO is connected to nodes XDW, ECU, PTW, DFP, FJY.
Node WHC is connected to nodes YAJ, ECU, ZAY.
Node DPK is connected to nodes ECU, JLL, JQC, WHC.","[ZAY, UVD, YAJ, DFP, PTW, JJO, WHC, FJY, NPN, JLL, JQC, ECU, DPK, XDW, WIV]",15,72,True,What is the out-degree of node JQC?,5,"Let's solve this problem step by step.
The successors of node JQC are: [WIV, XDW, YAJ, ECU, PTW], and there are 5 successor nodes.
So the degree of node JQC is ","('[0, 3, 5, 10]',)",2,236
degree,"[(TXI, JXS), (TXI, BKE), (TXI, RLV), (TXI, XOI), (TXI, QNV), (TXI, ACD), (JXS, XUH), (JXS, DES), (RLV, RLB), (RLV, FWS), (ACD, OBT), (ACD, VBK)]","{TXI: [JXS, BKE, RLV, XOI, QNV, ACD],
JXS: [TXI, XUH, DES],
BKE: [TXI],
RLV: [TXI, RLB, FWS],
XOI: [TXI],
QNV: [TXI],
ACD: [TXI, OBT, VBK],
XUH: [JXS],
DES: [JXS],
OBT: [ACD],
VBK: [ACD],
RLB: [RLV],
FWS: [RLV]}","Node TXI is connected to nodes JXS, BKE, RLV, XOI, QNV, ACD.
Node JXS is connected to nodes TXI, XUH, DES.
Node BKE is connected to node TXI.
Node RLV is connected to nodes TXI, RLB, FWS.
Node XOI is connected to node TXI.
Node QNV is connected to node TXI.
Node ACD is connected to nodes TXI, OBT, VBK.
Node XUH is connected to node JXS.
Node DES is connected to node JXS.
Node OBT is connected to node ACD.
Node VBK is connected to node ACD.
Node RLB is connected to node RLV.
Node FWS is connected to node RLV.","[FWS, XOI, ACD, RLV, OBT, VBK, DES, BKE, QNV, TXI, XUH, RLB, JXS]",13,12,False,What is the degree of node XOI?,1,"Let's solve this problem step by step.
The neighbors of node XOI are: [TXI], and there are 1 neighbor nodes.
So the degree of node XOI is ","('[7, 1, 0, 3]',)",1,237
degree,"[(NQA, ELR), (NQA, FQM), (NQA, QOX), (NQA, PAW), (NQA, VPN), (NQA, MRJ), (ELR, PAW), (ELR, VPN), (ELR, NQA), (FQM, CXB), (FQM, NQA), (QOX, XRS), (QOX, ELR), (PAW, NQA), (PAW, FQM), (PAW, CXB), (VPN, CXB), (VPN, PAW), (VPN, XRS), (MRJ, CXB), (MRJ, PAW), (MRJ, XRS), (CXB, NQA), (XRS, VPN), (XRS, CXB)]","{NQA: [ELR, FQM, QOX, PAW, VPN, MRJ],
ELR: [PAW, VPN, NQA],
FQM: [CXB, NQA],
QOX: [XRS, ELR],
PAW: [NQA, FQM, CXB],
VPN: [CXB, PAW, XRS],
MRJ: [CXB, PAW, XRS],
CXB: [NQA],
XRS: [VPN, CXB]}","Node NQA is connected to nodes ELR, FQM, QOX, PAW, VPN, MRJ.
Node ELR is connected to nodes PAW, VPN, NQA.
Node FQM is connected to nodes CXB, NQA.
Node QOX is connected to nodes XRS, ELR.
Node PAW is connected to nodes NQA, FQM, CXB.
Node VPN is connected to nodes CXB, PAW, XRS.
Node MRJ is connected to nodes CXB, PAW, XRS.
Node CXB is connected to node NQA.
Node XRS is connected to nodes VPN, CXB.","[CXB, MRJ, FQM, VPN, PAW, NQA, ELR, XRS, QOX]",9,25,True,What is the out-degree of node CXB?,1,"Let's solve this problem step by step.
The successors of node CXB are: [NQA], and there are 1 successor nodes.
So the degree of node CXB is ","('[0, 1, 3, 6]',)",1,238
degree,"[(WJR, MDA), (WJR, PTN), (WJR, ONN), (WJR, SQL), (WJR, PZM), (MDA, SQL), (MDA, PZM), (MDA, JTX), (PTN, FYH), (PTN, JTX), (PTN, REG), (ONN, SQL), (ONN, PTN), (SQL, BLS), (SQL, QKO), (SQL, ONN), (SQL, QIW), (PZM, FYH), (ZTJ, JTX), (JTX, QKO), (JTX, REG), (JTX, ONN), (JTX, SQL), (JTX, WJR), (QKO, REG), (QKO, SQL), (QKO, WJR), (QKO, JTX), (REG, BLS), (REG, PZM), (REG, WJR), (BLS, PZM), (BLS, ZTJ), (BLS, PTN), (BLS, SQL), (QIW, BLS), (QIW, ZTJ), (QIW, QKO), (QIW, MDA), (QIW, ONN)]","{WJR: [MDA, PTN, ONN, SQL, PZM],
MDA: [SQL, PZM, JTX],
PTN: [FYH, JTX, REG],
ONN: [SQL, PTN],
SQL: [BLS, QKO, ONN, QIW],
PZM: [FYH],
ZTJ: [JTX],
JTX: [QKO, REG, ONN, SQL, WJR],
QKO: [REG, SQL, WJR, JTX],
REG: [BLS, PZM, WJR],
BLS: [PZM, ZTJ, PTN, SQL],
FYH: [],
QIW: [BLS, ZTJ, QKO, MDA, ONN]}","Node WJR is connected to nodes MDA, PTN, ONN, SQL, PZM.
Node MDA is connected to nodes SQL, PZM, JTX.
Node PTN is connected to nodes FYH, JTX, REG.
Node ONN is connected to nodes SQL, PTN.
Node SQL is connected to nodes BLS, QKO, ONN, QIW.
Node PZM is connected to node FYH.
Node ZTJ is connected to node JTX.
Node JTX is connected to nodes QKO, REG, ONN, SQL, WJR.
Node QKO is connected to nodes REG, SQL, WJR, JTX.
Node REG is connected to nodes BLS, PZM, WJR.
Node BLS is connected to nodes PZM, ZTJ, PTN, SQL.
Node QIW is connected to nodes BLS, ZTJ, QKO, MDA, ONN.","[QKO, PTN, SQL, BLS, ZTJ, ONN, WJR, FYH, PZM, QIW, MDA, REG, JTX]",13,40,True,What is the out-degree of node QIW?,5,"Let's solve this problem step by step.
The successors of node QIW are: [BLS, ZTJ, QKO, MDA, ONN], and there are 5 successor nodes.
So the degree of node QIW is ","('[5, 7, 0, 8]',)",0,239
degree,"[(VEN, GCI), (VEN, ZUQ), (VEN, FBW), (GCI, ZUQ), (GCI, FBW), (GCI, KSD), (ZUQ, HUP), (ZUQ, UBH), (ZUQ, QDC), (ZUQ, KSD), (ZUQ, VEN), (ZUQ, GCI), (FBW, EYE), (FBW, UBH), (FBW, VEN), (FBW, GCI), (FBW, ZUQ), (NTD, KEV), (NTD, FBW), (NTD, HUP), (KEV, EYE), (KEV, UBH), (KEV, TIM), (HUP, EYE), (HUP, UBH), (HUP, VEN), (KSD, NTD), (KSD, ZUQ), (KSD, HUP), (KSD, UBH), (EYE, UBH), (EYE, KSD), (EYE, TIM), (EYE, ZUQ), (UBH, KSD), (UBH, VEN), (UBH, GCI), (UBH, FBW), (TIM, VEN), (TIM, KEV), (TIM, QDC), (QDC, KSD), (QDC, GCI)]","{VEN: [GCI, ZUQ, FBW],
GCI: [ZUQ, FBW, KSD],
ZUQ: [HUP, UBH, QDC, KSD, VEN, GCI],
FBW: [EYE, UBH, VEN, GCI, ZUQ],
NTD: [KEV, FBW, HUP],
KEV: [EYE, UBH, TIM],
HUP: [EYE, UBH, VEN],
KSD: [NTD, ZUQ, HUP, UBH],
EYE: [UBH, KSD, TIM, ZUQ],
UBH: [KSD, VEN, GCI, FBW],
TIM: [VEN, KEV, QDC],
QDC: [KSD, GCI]}","Node VEN is connected to nodes GCI, ZUQ, FBW.
Node GCI is connected to nodes ZUQ, FBW, KSD.
Node ZUQ is connected to nodes HUP, UBH, QDC, KSD, VEN, GCI.
Node FBW is connected to nodes EYE, UBH, VEN, GCI, ZUQ.
Node NTD is connected to nodes KEV, FBW, HUP.
Node KEV is connected to nodes EYE, UBH, TIM.
Node HUP is connected to nodes EYE, UBH, VEN.
Node KSD is connected to nodes NTD, ZUQ, HUP, UBH.
Node EYE is connected to nodes UBH, KSD, TIM, ZUQ.
Node UBH is connected to nodes KSD, VEN, GCI, FBW.
Node TIM is connected to nodes VEN, KEV, QDC.
Node QDC is connected to nodes KSD, GCI.","[GCI, UBH, EYE, HUP, NTD, ZUQ, TIM, KSD, VEN, KEV, FBW, QDC]",12,43,True,What is the out-degree of node KSD?,4,"Let's solve this problem step by step.
The successors of node KSD are: [NTD, ZUQ, HUP, UBH], and there are 4 successor nodes.
So the degree of node KSD is ","('[3, 4, 0, 7]',)",1,240
degree,"[(PHC, IOL), (PHC, SVB), (IOL, PUY), (IOL, EJY), (IOL, GVO), (SVB, IHH), (SVB, PTH), (SVB, EJY), (SVB, KAQ), (SVB, IOL), (SVB, PUY), (EKA, IOL), (EKA, MVY), (EKA, PTH), (EKA, EJY), (EKA, KAQ), (MVY, MNZ), (MVY, PTH), (MVY, PUY), (PTH, MVY), (EJY, GVO), (EJY, IOL), (EJY, IHH), (KAQ, EJY), (PUY, EKA), (PUY, IOL), (GVO, PHC), (GVO, EKA), (GVO, MVY), (GVO, SVB), (GVO, CLS), (GVO, PTH), (MNZ, CLS), (MNZ, PTH), (MNZ, EJY), (MNZ, GVO), (MNZ, EKA), (IHH, PTH), (IHH, GVO), (IHH, MVY), (CLS, PTH), (CLS, KAQ), (CLS, EKA), (CLS, IHH)]","{PHC: [IOL, SVB],
IOL: [PUY, EJY, GVO],
SVB: [IHH, PTH, EJY, KAQ, IOL, PUY],
EKA: [IOL, MVY, PTH, EJY, KAQ],
MVY: [MNZ, PTH, PUY],
PTH: [MVY],
EJY: [GVO, IOL, IHH],
KAQ: [EJY],
PUY: [EKA, IOL],
GVO: [PHC, EKA, MVY, SVB, CLS, PTH],
MNZ: [CLS, PTH, EJY, GVO, EKA],
IHH: [PTH, GVO, MVY],
CLS: [PTH, KAQ, EKA, IHH]}","Node PHC is connected to nodes IOL, SVB.
Node IOL is connected to nodes PUY, EJY, GVO.
Node SVB is connected to nodes IHH, PTH, EJY, KAQ, IOL, PUY.
Node EKA is connected to nodes IOL, MVY, PTH, EJY, KAQ.
Node MVY is connected to nodes MNZ, PTH, PUY.
Node PTH is connected to node MVY.
Node EJY is connected to nodes GVO, IOL, IHH.
Node KAQ is connected to node EJY.
Node PUY is connected to nodes EKA, IOL.
Node GVO is connected to nodes PHC, EKA, MVY, SVB, CLS, PTH.
Node MNZ is connected to nodes CLS, PTH, EJY, GVO, EKA.
Node IHH is connected to nodes PTH, GVO, MVY.
Node CLS is connected to nodes PTH, KAQ, EKA, IHH.","[EJY, EKA, GVO, KAQ, MNZ, IOL, SVB, IHH, PTH, PUY, MVY, PHC, CLS]",13,44,True,What is the out-degree of node KAQ?,1,"Let's solve this problem step by step.
The successors of node KAQ are: [EJY], and there are 1 successor nodes.
So the degree of node KAQ is ","('[1, 7, 0, 9]',)",0,241
degree,"[(SPP, SIK), (SPP, ZFU), (SPP, DCF), (SPP, VZJ), (SPP, QXB), (SPP, ROP), (SIK, ABW), (ZFU, QXB), (DCF, ABW), (DCF, ROP), (DCF, SYE), (VZJ, VKA), (QXB, VKA), (QXB, ABW), (QXB, WCA), (ABW, WCA), (ABW, SYE), (VKA, WCA)]","{SPP: [SIK, ZFU, DCF, VZJ, QXB, ROP],
SIK: [SPP, ABW],
ZFU: [SPP, QXB],
DCF: [SPP, ABW, ROP, SYE],
VZJ: [SPP, VKA],
QXB: [SPP, VKA, ABW, WCA, ZFU],
ROP: [SPP, DCF],
ABW: [SIK, QXB, DCF, WCA, SYE],
VKA: [QXB, VZJ, WCA],
WCA: [QXB, VKA, ABW],
SYE: [ABW, DCF]}","Node SPP is connected to nodes SIK, ZFU, DCF, VZJ, QXB, ROP.
Node SIK is connected to nodes SPP, ABW.
Node ZFU is connected to nodes SPP, QXB.
Node DCF is connected to nodes SPP, ABW, ROP, SYE.
Node VZJ is connected to nodes SPP, VKA.
Node QXB is connected to nodes SPP, VKA, ABW, WCA, ZFU.
Node ROP is connected to nodes SPP, DCF.
Node ABW is connected to nodes SIK, QXB, DCF, WCA, SYE.
Node VKA is connected to nodes QXB, VZJ, WCA.
Node WCA is connected to nodes QXB, VKA, ABW.
Node SYE is connected to nodes ABW, DCF.","[WCA, ROP, SIK, ZFU, DCF, VZJ, SPP, ABW, QXB, VKA, SYE]",11,18,False,What is the degree of node ROP?,2,"Let's solve this problem step by step.
The neighbors of node ROP are: [SPP, DCF], and there are 2 neighbor nodes.
So the degree of node ROP is ","('[7, 10, 2, 0]',)",2,242
degree,"[(WHB, KMH), (WHB, THH), (WHB, WKJ), (WHB, AOJ), (KMH, MQC), (KMH, THH), (KMH, YSB), (KMH, MWT), (KMH, HBI), (KMH, AOJ), (KMH, MQF), (THH, YSB), (THH, HBI), (THH, AOJ), (THH, WHB), (THH, MQF), (WKJ, AOJ), (WKJ, MQF), (WKJ, KMH), (AOJ, KMH), (AOJ, MQC), (AOJ, YSB), (MQF, KMH), (MQF, THH), (MQC, THH), (MQC, WKJ), (MQC, YSB), (MQC, MWT), (MQC, AOJ), (YSB, AOJ), (YSB, KMH), (YSB, MQC), (YSB, THH), (MWT, AOJ), (MWT, MQF), (MWT, THH), (MWT, WKJ)]","{WHB: [KMH, THH, WKJ, AOJ],
KMH: [MQC, THH, YSB, MWT, HBI, AOJ, MQF],
THH: [YSB, HBI, AOJ, WHB, MQF],
WKJ: [AOJ, MQF, KMH],
AOJ: [KMH, MQC, YSB],
MQF: [KMH, THH],
MQC: [THH, WKJ, YSB, MWT, AOJ],
YSB: [AOJ, KMH, MQC, THH],
MWT: [AOJ, MQF, THH, WKJ],
HBI: []}","Node WHB is connected to nodes KMH, THH, WKJ, AOJ.
Node KMH is connected to nodes MQC, THH, YSB, MWT, HBI, AOJ, MQF.
Node THH is connected to nodes YSB, HBI, AOJ, WHB, MQF.
Node WKJ is connected to nodes AOJ, MQF, KMH.
Node AOJ is connected to nodes KMH, MQC, YSB.
Node MQF is connected to nodes KMH, THH.
Node MQC is connected to nodes THH, WKJ, YSB, MWT, AOJ.
Node YSB is connected to nodes AOJ, KMH, MQC, THH.
Node MWT is connected to nodes AOJ, MQF, THH, WKJ.","[MQC, THH, WKJ, WHB, MQF, YSB, KMH, AOJ, MWT, HBI]",10,37,True,What is the out-degree of node WHB?,4,"Let's solve this problem step by step.
The successors of node WHB are: [KMH, THH, WKJ, AOJ], and there are 4 successor nodes.
So the degree of node WHB is ","('[0, 9, 1, 4]',)",3,243
degree,"[(EBF, YLJ), (EBF, UMG), (YLJ, LFC), (UMG, OWX), (LFC, OWX), (LFC, PVS), (PVS, HKZ), (HKZ, TUB)]","{EBF: [YLJ, UMG],
YLJ: [EBF, LFC],
UMG: [EBF, OWX],
LFC: [YLJ, OWX, PVS],
OWX: [LFC, UMG],
PVS: [LFC, HKZ],
HKZ: [PVS, TUB],
TUB: [HKZ]}","Node EBF is connected to nodes YLJ, UMG.
Node YLJ is connected to nodes EBF, LFC.
Node UMG is connected to nodes EBF, OWX.
Node LFC is connected to nodes YLJ, OWX, PVS.
Node OWX is connected to nodes LFC, UMG.
Node PVS is connected to nodes LFC, HKZ.
Node HKZ is connected to nodes PVS, TUB.
Node TUB is connected to node HKZ.","[UMG, PVS, EBF, HKZ, LFC, YLJ, TUB, OWX]",8,8,False,What is the degree of node LFC?,3,"Let's solve this problem step by step.
The neighbors of node LFC are: [YLJ, OWX, PVS], and there are 3 neighbor nodes.
So the degree of node LFC is ","('[6, 10, 0, 3]',)",3,244
degree,"[(HOU, XFG), (HOU, AZS), (XFG, XQR), (AZS, TOA), (XQR, TOA), (XQR, DBB), (BCK, TOA), (BCK, QMN), (TOA, TTF)]","{HOU: [XFG, AZS],
XFG: [HOU, XQR],
AZS: [HOU, TOA],
XQR: [XFG, TOA, DBB],
BCK: [TOA, QMN],
TOA: [BCK, AZS, XQR, TTF],
QMN: [BCK],
TTF: [TOA],
DBB: [XQR]}","Node HOU is connected to nodes XFG, AZS.
Node XFG is connected to nodes HOU, XQR.
Node AZS is connected to nodes HOU, TOA.
Node XQR is connected to nodes XFG, TOA, DBB.
Node BCK is connected to nodes TOA, QMN.
Node TOA is connected to nodes BCK, AZS, XQR, TTF.
Node QMN is connected to node BCK.
Node TTF is connected to node TOA.
Node DBB is connected to node XQR.","[QMN, HOU, TTF, XQR, XFG, DBB, TOA, AZS, BCK]",9,9,False,What is the degree of node AZS?,2,"Let's solve this problem step by step.
The neighbors of node AZS are: [HOU, TOA], and there are 2 neighbor nodes.
So the degree of node AZS is ","('[2, 4, 3, 0]',)",0,245
